danji_id,danji_name,age,sex,residenceType,married,totalScore,totalDesc,trafficScore,trafficDesc,aroundScore,aroundDesc,careScore,careDesc,residentScore,residentDesc
11884,우림필유,30대,여자,자가 거주,미혼,5,연식이야 오래되었긴 하지만 그것만보기엔 이점이 너무너무나도 많음. 위에도 언급했다시피 경기에서 이정도면..뭐 나는 결혼도안했고 아이도없지만 아이키우기에도 너무나적합할듯.,5,금천구청 및 150번 버스는 핵심임 나는 지하철역과 버스정류장이 정말 마음에들었음. 서울 아니고서야 경기에서 이정도면 도그허니임,5,조용하고 선선하니 좋음. 사람사는냄새가 확실히나는 동네인데 그렇다고 후미지지않는 아주 좋은 환경이라 생각함.,3,비교적 잘 되고있다 생각하나 보안은 의문임. 실제로 씨씨티비가 되고있는지 모르겠음. 택배없어져서 택배사직원이랑 확인하려고 한번 문의했었는데 씨씨티비가 다 꺼져있다했음..,5,남향30평아파트에 살고있는데 다 괜찮음. 일단 집은 누가 어떻게사냐에따라 다르기도하고..
11884,우림필유,40대,여자,자가 거주,기혼,5,위에서 글들 보면 아시겠지만 요새처럼 조용하고 잘 관리가 된 아파트고 용이 시설도 주위에 많아 좋습니다.,5,버스정류장이나 전철 타기 좋아요 강남순환도로까지 연결되어 좋아요~ 영등포까지 가는 버스도 있고 금천구청역으로 통하는 길과 가까워서 좋고 다만 바로 앞은 아니라 아쉽지만 5분거립니다.,5,"농수산마트 홈플 이마트 작은시장 마트 가깝고 까페와 골목상권으로 통하는 출구가 여러개라 편하고 좋습니다. 편의점, 빨래방, 놀이터 주변아파트, 학교 태권도 모든 근접해 좋고 조용하고 안쪽이라 먼지도 적어 너무 좋아요 삼익아파트때는 뷰는 좋은데 미세먼지 대로변에 소음이 있었는데 여기는 정말 조용하고 먼지없어 좋고 일하시는분들도 너무 친절하시고 좋습니다. 가끔 역으로 경비아저씨가 갑질하냐고 더 주민 시킬때도 있는데..여긴 너무들 부지런하셔서 새벽부터 쓸고 일하시고 인사받아주시고 다들 넘 좋습니다~",5,단지관리 끝장입니다. 다른 아파트 보심 아시지만 다른곳보다 깔끔하고 깨끗하게 관리된게 정원이나 건물이나 한눈에 보입니다.,5,층간소음은 좀 있다고 들었는데 윗층에 천사가 사시는지 조용하고 옆집도 조용해 전 잘 모르겠고..아래층에 죄송하지만 이사인테리어때만 시끄럽다시고 아직 못 뵈었습니다~^^ 저흰 베란다 터서 덥지도 않고 간접 직접 채광도 있고 좋습니다.  앗 그래서 저희 층수도 있고 해서 커튼은 쳐둡니다. 옆호랑 꺽이기도 하고 밑에서 보는 사람이 있을까 싶어서요 없겠지만요
11884,우림필유,50대,남자,자가 거주,기혼,5,개인적으로 가장 큰 장점은 조용하다는 것. 물론 소규모단지이다 보니 전체적으로 좁은 느낌이 있지만 조용함을 좋아하는 사람에게는 좋은 것 같습니다.,5,"10년전에는 교통여건 안 좋았으나, 수원광명, 강남순환도로 개통후에는 사통팔달 위치임. 조만간 신안산선 개통되면 서울 여의도까지 15~20분 가능. 금천구청역 도보로 8~10분.",5,"이마트 소하점 차량으로 5분, 근처 중소형마트 다수 존재(도보 이용), 롯데 빅마트, 홈플러스 시흥점 이용 가능.",5,"관리는 잘 되는 편, 경비아저씨들 매우 친절. 주차 대수 부족은 문제이나 한밤중에 와도 주차는 가능(브레이크 풀고)",5,큰길가에서 안쪽으로 들어 와 있다보니 확실히 조용함. 큰 길가에 비하면 매우 큰 장점입니다.
11884,우림필유,40대,남자,전세 또는 월세,기혼,5,주변에 비해 저평가된 아파트임은 분명합니다  대형마트 가깝고 전철역도 도보로 이용가능하며 서울로 출퇴근하기에도 전혀 불편함 없네요  실거주및 투자용으로도 좋다고 판단됩니다,4,금천구청역 도보로 이용가능하고 구로디지털역 버스로 이용가능해서 편리합니다 다만 조금 걸어야 합니다,5,안양천에 산책나가기 편하고 아파트 주변은 혐오시설 없고 조용하며 살기 좋아요 아이들과 살기 너무 좋네요,4,아파트가 깨끗하게 관리가 잘되어 있고 공용현관 비밀번호로 안전하고 일단 1층현관이 넓어서 들어왔을때 시원한 느낌이 듭니다 지하주차장과 연결되어 편리해요,5,아파트 내부 구조가 잘빠져있고 거실과 주방이 같은평수 아파트에 비해 넓은 느낌이 있습니다 화장실도 2개라 3~4식구 살기에 좋습니다
11884,우림필유,30대,남자,자가 거주,기혼,4,"복도식 치고 일자형이 아니고, 실내 구조가 나쁘지 않음. 24평에 화장실 2개 만족 함. 교통도 편리한 편이라 살기엔 좋음.",4,"금구역 도보 15분이면 충분함. 서부 간선 및 고속도로 이용에도 용이함. 철산으로 가는 버스나, 서울로 가는 버스가 많이있음",4,"도보로 이용할수 있는 대형마트는 없음. 가장 가까운곳은 식자재 마트인데 그닥 평이 좋지 않음. 안양천도 도보 10분이면 충분하며, 한내천도 근처에 있어 산책에는 아주 용이",4,"다들 주차가 문제라고 하는데, 9시 30분 이전에 오면 이중 주차외에도 자리는 있음. 지상에도 자리가 있는 편임. 다만 일주일에 한번만 분리수거를 해서 그건 불편함.",5,12시 이후에 해가 엄청 늦게 까지 들어옴. 현관문을 열어두면 아주 시원함. 층간 소음이 있긴 하지만 신경쓰여 잠 못잘 정도는 아님. 대로변에서 조금 안에 있어 차량 소음이 심하지 않음
11884,우림필유,20대,남자,자가 거주,미혼,3,"적당하게 인근에 누릴 시설이나 편의시설 등이 잘 위치해 있고, 대중교통 이용도 중박은 침. 다만 협소한 주차공간이 매우 아쉬움.",3,"도보 10~15분 거리에 1호선 금천구청역이 있다. 다만 말이 도보 10분이지 생각보다 가깝다는 느낌은 아님, 역세권 버프는 도보 5분 이내에 역이 위치해야 최적이라 생각함. 또한 도보 5분 이내 버스 정류장들을 이용시 서울 진입이 비교적 수월한 편. 자가용 이용시 수원 강남 고속도로타고 강남권 출퇴근이 용이함. 나머지 루트는 그냥저냥 무난한 편.",3,"도보 15분, 자가용 5분 이내 이마트, 다이소, 하이마트, 삼성 디지털 플라자등 편의 시설 이용 가능. 단 단지 인근이 아닌점이 아쉬움. 슬슬 운동한다 생각하고 걸어갔다 오면 운동되는 느낌 나고 나름 괜찮음. 단지 인근 편의점, 병원, 시장, 식당 등 있을건 얼추 다 있긴 함.",2,주차 관리가 전혀 안됌. 지하 주차 공간이 인간적으로 너무 협소함. 주차 외 다른 단지관리는 평범하게 이루어지고 있다고 생각하지만 주차 문제가 너무 심각함.,3,햇빛 잘 들고 통풍 잘 되고 전반적으로 만족스러움. 다만 층간소음이 매우 잘 전달되기에 소리에 예민한 사람이라면 극심한 스트레스에 시달릴것임.
11884,우림필유,30대,여자,자가 거주,기혼,4,이 동네에서 가격대비 소형평수가 화장실 2개에 살기 좋습니다. 샷시도 다른 아파트에비해 좋아서인지 따뜻해요. 구조가 잘 빠졌다고들 합니다.,4,"10분내에 1호선 금천구청역. 버스타고 서울(독산,가산디지털단지 등)진입 쉽고 버스타고 15분내에 광명 Ktx역 진입. 강남순환고속도로 진입 쉬움. 버스타고 15분쯤 철산역 진입.",4,아이들 키우기 좋다. 우림필유 뒤 만6세까지 다닐수 있는 시립어린이집 있음. 도로가 아닌 아파트가 많아 아이들이 안전하게 돌아다닐 수 있고 도보 10분거리에 이마트 및 학원 외식업종 기타 상가가 많음. 도보 10분이내에 초등학교 있음. 도보 10분 금천구청역. 아이들과 노부부들 살기에 부족함 없고 깨끗한 동네입니다.,4,경비아저씨가 청소도 잘해주시고 친절하세요. 분리수거도 주말에 합니다. 택배도 잘 받아주세요. 관리실에서 형광등 같은거 부탁하면 간단한건 친절히 도와주세요,5,"여러 방향중에 햇빛이 잘들어오는 남향라인 선호합니다. 남향이 프라이빗합니다. 방충망 중문 설치하면 여름에 맞바람 통해서 시원해요. 이케아, 롯데아울역 등 주변 인프라 형성이 잘되어있어요"
11884,우림필유,20대,남자,전세 또는 월세,기혼,1,주차공간?? 세대수보다 모잘라 이중주차는 물론 거주자가 차를 주차할 곳도 없어 아파트 주변에다 주차함  그렇다고 외부차량 관리가 제대로 되는것도 아님 주차공간은 없으면서 주차공간을 무슨 통로로 만들고 주차도 못하게함,3,금천구청역이 도보 10분내로 잇어 가깝지는 않지만. 나름 편리하고 개인 차량이동시 도로 입지 환경은 좋아 강남순환이나 광명고속 타기 편리함,2,아파트 주변은 좋은환경은 없으나 도보나15분 차량 5분정도 이동시 공원 및 마트등이 가까이 있으나 아파트 단지내에서 이동거리가 있음,1,"아파트 관리가 제대로 되지 않음 시설낙후, 주차공간부족, 분리수거 또한 공간이 없어 주차장에서 함..관리비가 아까움",1,복도식이라 베란다 와 현관을 개방시 바람통풍은 좋음 하지만 남서향 구조로 낮 3시부터 해가베란다로 들어옴....
11884,우림필유,20대,여자,자가 거주,미혼,2,"아파트 구조는 좋지만 혼자사시는분들, 부부이신데 아이가질 생각이 없으신분들은 비추한다  아이들키우는 부모들, 노부부들은 추천한다",1,도로가 엄청좁고 인도도 없어서 진짜 불편하다. 별한개주는것도 아까울 따름이다 길이 3개가있는데 다 좁아서 차끼리마주치면 곤란하다,3,"원래 2개의별이지만 저번달쯤에 다이소와 대형서점,오피스디포, 어투썸플레이스, 대형 휴대폰가게가 들어왔다. 다이소를 다른곳까지 않가서 편리하다",4,경비아저씨가 좋다. 가다 쓰레기보이면 바로바로 주워주시고 인사도 잘해주신다. 여름에 물도나와서 아이들은 좋아할거같다,2,여름에 물이나오는데 저층 아파트에사는사람들은 시끄럽다. 그냥 걸어다니는데 시끄럽다고 문제가 되기도 하여서 실내용 슬리퍼를 구입했는데도 시끄럽다고 하였다
11884,우림필유,20대,여자,전세 또는 월세,기혼,5,"상가도 많고, 아파트 단지가 매우 깨끗하고 쾌적하다. 교통시설이 잘 되있어 교통이 편하다.",5,"집에서 멀리 떨어지지 않은곳에 버스정류장이 있어 버스타기가 편했고, 그 주위에 도로가 잘 있어, 교통이 편하다.",5,"주변에 상가와 식당, 가게들이 꽤 있어 식료품 등을 사는게 편했다.",5,"아파트단지가 데체적으로 매우 깨끗했고, 놀이터 등의 시설이 잘 갖춰져 있어 편했다.",5,"베란다가 조금 더 넓었으면 좋겠고, 층간소음이 심하진 않지만 조금 있었다."
11884,우림필유,30대,여자,자가 거주,기혼,4,"가까이에 대형마트와 공원이 있고, 동네가 조용하고 한적해서 좋음.지하철역이 도보로 이용가능하여 1호선 출퇴근이 편리함,",4,금천구청역 도보 10분거리여서 지하철이용 편리합니다  버스타고 10분이면 7호선 철산역.이용 가능,5,"도로 건너편 도보5분 공원이 있어 아이들 키우기 좋고,차로 5분이면 이마트 있어서 장보기 편함   차로 10분이면 이케아 롯데아울렛 있어서 좋음",5,아파트 단지 청소를 깨끗하게 하는 편이고 경비아저씨들이 친절하고 외부인 주차관리를 잘 통제하는 편이다,4,"일조량이 좋은 편은 아님, 아파트 구조가 일자가 아니라서 건물로 인해 일조량이 많지는 않음.도로변에 있는 곳이 아니라서 차량소음이 없고 동네가 조용함"
11884,우림필유,20대,여자,전세 또는 월세,미혼,4,대형마트도 가깝고 학교 편의시설 공원도 모두 걸어서 10분 정도면 갈 수 있어요  소하동 쪽이 굉장히 깨끗하고 서울도 가까워 좋은 거 같아요,5,지하철이 근처에 있어 교통 이편 하며 서울도 가까워서 좋습니다  버스도 물론 편리하고요,5,최근 몇 년 사이 대형마트도 생기고 코스트코가 생겨 좋습니다. 편의시설이 계속해서 추가되고 있어 앞으로도 좋을 거 같으며 주변도 깨끗해서 좋아요,3,아파트로 들어오는 길이 너무 어두워서 많이 무섭습니다 가로등 설치가 좀 더 필요합니다.  반면에 아파트 주변이나 단지 내는 깨끗해서 정말 좋습니다.,3,1층은 너무 햇볕이 안 들어 곰팡이가 생길 지경이며 몸 건강 에조 안 좋은 거 같아요. 1층이나 낮은 층은 별로 좋지 않아요.
11884,우림필유,30대,남자,자가 거주,기혼,4,"소하1동에서 가격 대비 주위 환경 봤을 때, 이만한 아파트는 없음. 단독필지의 금액으로 아파트를 살 수 있음",3,"광명 서울 가는 5627 버스가 매우 불편하나 5535번 버스는 나름 이용이 편하고, 차량으로는 서울과 매우 근접.",3,"가까이에 홈플 익스프레스와 슈퍼 있고, 편의점도 가까이 있음. 아파트 자체는 한동짜리이나 가까이에 동양 2차나 휴먼시아 5단지의 제반시설 이용하면 편리.",3,주위 평이 아파트 관리가 잘 되고 있다고 함. 단 주차 매우 불편,3,화장실 좁고 햇볕이 잘 안 듦 베란다가 나름 넓고 구조는 나쁘지 않은 것 같음
11884,우림필유,30대,여자,자가 거주,기혼,4,교통여건도 지하철. 버스 타기가 좋고 집도 넓게 구조가 빠져서 좋다 도로변이 아니라 시끄럽지도 않고 아파트 관리가 잘되어서 편하다 학교를 갈 때 신호등을 많이 건너야 하지만 아이들 등교시간에 경비이자씨들도 안전하도록 지도해주셔서 단점도 나름 보안이 되고 있다,4,지하철은 도보로 10분 정도 소요되고 버스정류장은 5분 안쪽이라 교통이 편리하 다서 울로 나가는 버스가 시간이 많이 걸리는 게 단점이다,3,학교 갈 때 신호등을 많이 건너야 해서 불편하다 공원이 가까이 있어 산책하기 좋다 아파트 주변에는 아이들이 놀기가 좁은 길로 인해 위험한 게 단점이다,4,세대수가 적지만 관리가 철저하고 깨끗하다세대수가 적어 관리비는 다른 아파트에 비싼 편이 단점이다,4,도로변을 끼고 있지 않아 시끄럽지 않고 층간소음은 여느 아파트처럼 그래서 조심해야 하는 게 불편하다 한동으로 모두 연결되어 있어 해가 아주 밝게 들어오는 느낌은 아니다
11884,우림필유,40대,여자,자가 거주,기혼,3,"마트나 지하철이 가깝고, 아웃렛과 ktx역, 고속도로 ic 등이 가까워 나름 살기 편한 곳임.. 주변 시세보다 저렴한 편이라 돈이 부족한데 소하동에 살기 원한다면 괜찮을 듯함. 25평은 복도식이라 계단식을 원하는 사람들한테는 비추.",3,"금천구청역은 걸어서 15분 정도의 거리이나 지하철을 걸어서 탈 수 있다는 점은 장점, 버스노선은 많지 않은 편이라 조금 불편, 동네에 차가 많지 않아 자가용 이용은 좋은 편.. 고속도로와 인접하여 편함..",4,"차로 7분 거리, 버스로 2 정거장 가면 이마트, 차로 10~15분 정도 거리의 롯데아웃렛과 코스트코 ktx광명역이 있고, 근처에 한내천과 안양천이 있어 산책과 운동코스로 좋음.. 고속도로도 인접해 있고, 혁신학교인 구름산초등학교로 배정됨..",2,"1동이라 아파트값이 주변에 비해 그다지 좋지 않음, 단지 청소는 깨끗한 편, 주차장이 비좁고 주차관리가 잘 안됨, 관리비도 저렴하지 않은 편..",2,"남향이 아니고 저층이라 햇빛은 그다지 안 들어옴, 낮에도 거실 불 켜놓고 있음. 베란다 트인 집은 겨울에 추운데 안 트인 집은 따뜻함. 층간소음은 조금 있는 편이라 아이들이 뛰지 못함.."
11884,우림필유,30대,여자,자가 거주,기혼,4,아파트가 한 동짜리 계단식이라 여유공간이 별로 없다. 아이들이 뛰어놀 수 있는 공간이 별로 없다는 게 아쉽다,4,지하철은 도보 10분이나 강남. 성남 등등 고속도로 와인 접하여 교통편리,4,걸어서 15분 이 면 이마트. 5분이면 홈플 익스프레스에 각종 슈퍼.. 편의점이 아파트 주변으로 3 개정도.. 도서관과 공원도 가까이 있고.,4,택배보관함이 없어 불편하다 경비아저씨가 친절하다  공동현관의 별로 카드키가 없으니 불편하다,5,남향과 보일러가 엄청 잘되어있는지.. 지금 추운 겨울인데도 보일러를 안 틀고 있음
12398,각산,30대,여자,자가 거주,기혼,5,"교통이 제일 좋음. 전철역 접근이 좋음. 1.2.7호선 보통 이용함. 이마트 5분거리. 코스트코,이케아,롯데아울렛,ktx 자차 10분 거리.",5,"전철역 가는 마을버스가 집앞에 대기해서 완전 편리함.마을버스타면 1.7호선, 동네버스타면 2.7호선 탈 수 있음. Ktx광명역까지 동네버스 15분.",5,"진짜 집 바로 코앞에 우리은행 지점이 있음. 동네슈퍼, 홈플러스슈퍼 있어서 이용편리. 3분 거리에 산책로 있고, 다른 쪽 5분 거리에 안양천 산책로 있어서 봄 되면 벚꽃길 펼쳐짐.",4,아파트가 한 동이라는 게 단점이라면 단점. 경비아저씨가 주차단속 엄청 열심히 함. 택배함은 따로 없고 경비실에 맡김.,4,햇볕 잘 들어와요. 근데 요즘 아파트들 다 그런것처럼 다른 아파트들이랑 가까운 느낌이 없지않아 있음
12398,각산,30대,남자,자가 거주,기혼,4,아파트는 조용하고 살기 좋은데 주차장이 많이 부족하고 햇빛이 나무에 가려서 잘 안 들어옴 시내버스는 자주 다녀요,5,마을버스 5 9번 버스가 있는데 배차시간은 5~10분으로 짧고 정류장까지 걸어서 2분 이내,5,아파트 바로 앞에 공원 은행 인천초등학교 인천중학교 어린이집 운상고등학교 구름산초등학교가 있는데 학교나 학원이 많은 편,5,아파트에 주차장이 많이 부족해서 도로 옆으로 불법 주차하는 차가 많고 단지 주변은 깨끗하고 조경상태는 좋은 편,4,베란다가 앞에 큰 나무가 많이 있어서 햇빛이 잘 안 들어오고 층간소음도 조금 있음 아파트에 환기가 잘 안돼요
12398,각산,20대,여자,자가 거주,미혼,4,경비아저씨가 출퇴근을 하기 때문에 불편한 점이 좀 있지만 그것 빼고는 다 만족한다. 또 지진에 대비해 설계된 점이 장점이라면 장점이다.,4,주변에 있는 버스정류장 5곳이 모두 도보 5분 이내로 갈 수 있다. 제일 가까운 금천구청역이 도보 15분인 것이 단점이라면 단점이다.,5,바로 옆에 우리은행이 있어 우리은행을 쓰는 사람들에겐 매우 좋다. 옆 상가에 마트도 있고 목욕탕도 있고 헬스장도 있어서 멀리 안나가도 되니 좋다. 또 미니 홈플러스도 도보 3분 거리에 있다. 안양천이 가깝기 때문에 산책도 가기 쉽다.,3,공용현관의 비밀번호는 바꾼 적이 없다. 경비아저씨가 출퇴근을 하므로 경비실에 맡긴 택배를 평일 7시 이후나 주말에는 받기 힘들다.,4,바람이 잘 들어와서 여름에는 시원하지만 겨울은 좀 춥다. 중앙난방이 없기 때문에 냉난방은 자기가 조절 가능하다. 맨 위층에 살아서 그런지 층간소음은 없는 편이다.
12398,각산,30대,여자,자가 거주,미혼,3,아파트가 겨울에 좀 춥다 햇빛이 많이 들어오진 않는다 공원이 근처에 있어 좋고 교통은 편리함,4,서울 경기 가는 버스가 있어 좋다. 1호선 금천구청 독산역과 가깝다,4,주변에 안양천이 있고 공원이 많다  마트는 홈플러스 익스프레스 정도. 큰 마트는 버스로 좀 나가야 함,3,단지가 하나라 자체적으로 주민들 중에서 대표와 감사 등을 뽑아 관리,3,햇빛이 잘 안 들어옴. 앞에 고층아파트들이 많이 들어서서 적게 들어온다
6128,동양2차,40대,여자,자가 거주,기혼,5,연식이오래되었지만 전체적인관리가잘되어있고 관리비도저렴하고 이아파트주변환경과 조건을아시는분들은 이사오시고싶어한다.,5,"10분정도도보에금천구청역전철역과 독산역,가산디지털단지역으로가는마을버스가있고 정문바로앞버스정류장이있다. 주변교통혼잡이없어자가이용도편리하다.",5,"초,중,고등학교가다근처에있고 하안사거리와소하사거리다가까워서학원도많고 생활에불편이없다. 이마트,빅마켓,코스트코,롯데아울렛,뉴코아아울렛,이케아, 가산디지털아울렛등쇼핑이 차로10분이내여서멀리나갈필요가없다. 한내천과안양천으로도보로산책과운동이가능하다.",5,무인택배함이있고 입주민외현관출입이안되서안전하다 청소가잘되어있고역 조경이예쁘고놀이터도관리가잘되있고 단지내도서관도너무좋다.,5,도보역세권이고주변이친환경적이다. 곧중앙대병원도개원예정이고학군도좋다. 주변에인프라는많지만 단지내는한적하고안정적이다.
6128,동양2차,40대,남자,자가 거주,기혼,5,일단 교통여권도 편해서 추천하고 가족끼리 살고싶다면 이 아파트를 추천한다 넓고 충간소음이 없으며 아파트 관리가 잘 돼서 안전하다,5,버스정류장이랑 가까워서 좋으면서 차도 막히지않아 빠른 이동으 가능하다 하안동으로 나갈때 12번버스나 11-2번을 타는데 빨리빨리 버스가 돌아서 빠르고 좋다,5,버스타고 3정거장이면 이마트와 식당가와 화장품가게등 필요한곳은 다 있고 근처에 할인마트가 많아 편리하다 또한 놀이터가 바로 옆에 있기에 아이부모는 아이들 놀리기 편하다,5,단지 청소는 아주 자주 해주어서 엄청 깨끗하다 또한 택배보관을 잘 해주셔서 안심하고 보관할수있다,4,집 전체도 넓고 바람도 잘 들어온다 근처가 그늘져있기 때문이다 아파트가 약간 오래되긴 했지만 충간소음은 안들린다 하지만 가끔 현관에 불이 들어오지 않을때가 있다
6128,동양2차,30대,여자,자가 거주,기혼,5,저희 아파트근처엔 초등학교 두군대도 잇고.  중학교. 고등학교 쇼핑몰 등등 아주 잘되어잇어요.  아이들 키우는엄마들은 깨끗하고 살기 좋아서 이곳을 벗어나지 않습니다^^,5,집앞 정류장이 있어요. 버스 노선도 많구요 서울.경기도 지역외.  가는버스가잇어요. 그래서 금천구 회사주위에 있는사람들은 이곳에 많이 사네요^^,5,집앞 상가에 홈플러스 익스프레스가 있구요.  건너편엔 한내천이라고 걷기 좋은 코스의 공원이 있어요. 초등학교 중학교 고등학교도 가깝고  10분 걸으면 이마트. 병원 등등 많아요.,5,우리아파트는 소하동에서 관리가 제일 잘된 아파트로 유명해요. 연식은 좀 됫지만. 다른 동네 주민들은 우리 아파트를 보고 깨끗하다며 연식이 오래됫다고 하면 놀라네요! 세대수가 많아 관리비도 적고 살기 좋아요.,5,장점은 확장형이 아닌데도 30평대 아파트 치곤 넓게 빠졋구요. 특히 거실이 넓어요. 새로지은 30평대 아파트 (확장형)보단 넓을거에요.  단점은 단일창이라 조금 춥고 확장한집도 썰렁하단점
6128,동양2차,40대,여자,자가 거주,기혼,5,상권도 좋고 아이들 키우기에 필요한 것들이 준비되어 좋고주말에 가족들과 한내천이나 안양천을 걸은수 있고  마트나 외식할곳도 멀리있지 않어서 주거 환경으로 좋다,5,정문 바로앞에 버스정류장  후문 도보 10분 금천구청역  차가막히거나 교통이 혼잡하지 않다,4,아파트 정문 버스정류장  후문으로10분걸으면 금천구청역   근처 이마트ㆍ뉴코아아울렛ㆍ한내천공원ㆍ안양천공원,4,"우수아파드선정됨.  아파트관리사무소동에 작은도서관이 있어서 편리하고  10분걸으면 시에서 운영하는 대도서관도 있음  택배는보관함있고, 1층 현관은 인식되는 카드사용",5,도보로 15분 정도가면 낮은 산이 있음  소하동에서 괜찮은 아파트
