danji_id,danji_name,age,sex,residenceType,married,totalScore,totalDesc,trafficScore,trafficDesc,aroundScore,aroundDesc,careScore,careDesc,residentScore,residentDesc
1282,한신,40대,여자,자가 거주,미혼,5,상가에마트 ㅡ후문쪽 골목시장 생활형 마트 ㆍ후문쪽에  왠만한 편의시설다있어요 ㅡ투썸 카페 와인카페 ㅡ다있을건있고요 ㅡ구디나 광명역이나 광명시 이용버스 많아용,5,버스 정문앞에 구디 ㅡ광명ㅡ버스 자주 있어 편해요 자가용운전이라 ㅡ저는잘안타지만 ㅡ주말에는 가끔탑니다,5,정문 ㅡ마트 후문에 생활용 골목 시장 ㆍ대형마트 ㆍ아파트가 평지여서 장보러다니기 굿입니다 길건너 한내로 산책로 이용합니다 ㅡ 때로는 안양천 도보로 고척돔까지 운동 해서 ㅡ웰빙~~살기는 굿입니다,5,자유출입이지만 잡상인 없고요 게시판에  주민뉴스 항상 전달력 굿입니다 ㆍ매번읽어보네요  ㅡ택배 ㆍ문앞이나 경비실 보관해주시고 ㅡ오래된아파트지만 진짜 깨긋하고 관리잘됨 ㅡ사시는분들은 ㅡ여유롭고 평지성이라  편의시설은 후문쪽에 다있고 ㅡ정문상가 휘트니스 센터. 좋아요,5,저는거실 확장을해서 널게쓰고있고요 ㅡ오래된되지라 ㅡ이사오실때 상황에따라서 리모델링 필수일듯요ㆍ층간소음 어느아파트랑 비슷합니다ㆍ 아파트가 간격이 넓어 일조랑좋아요 난방비도 기본 적인 비용 정도로 들어갑니다ㅡ
1282,한신,40대,여자,자가 거주,기혼,5,서울에 가격대비 최고의 아파트라 생각됨. 근처 광명역. 코스트코 이케아.이마트.홈플러스 생활편리. 구름산.안양천.한내천 쾌적한 환경. 대체적으로 주민들 친절한듯. 소하동생활권 이용가능(도서관 등등) 앞으로 발전이 기대됨.,5,금천구청이용7분.단지앞 버스정거장. 서울강남순환도로 이용으로 주말  오전수업 수업기준 대치동학원가 25분소요.목동은 15분소요됨,5,"안양천,한내천 더블 팍세권. 유해요소 없어서  어린 자녀들 키우기 좋음. 단지내 한신유치원 리모델링함. 코스트코,이케아,이마트 있어 편리함",4,오래되었으나 정원수및 단지 관리 잘 되어짐. 공용현관은  비밀번호 아님. 경비아저씨들 친절하심.  횡단보도 건너 초.중 학교있음. 6차선이긴하나 차 많이 다니는 도로는 아닌듯.,4,"오래된 아파트 치고,층간소음 없음. 새로 입주하시는 분은  리모델링, 샤시 할 필요있음. 오래된 아파트 치고 지하주차장 있으나 연결 되지는 않고. 지상은 아직까지는 이중주차 별 무리 없음"
1282,한신,40대,남자,자가 거주,기혼,5,"교통, 주변환경, 단지환경 등 고려시 가성비 최고 서울권 6억이하 무조건 가치있다고 판단되며, 도보 역세권 및 신안산선 이용가능 측면에서 매력적으로 판단됨",5,"금천구청역- 도보 7분 버스정류장- 단지 바로 앞 2분 강남권 자차 -  강남순환고속도로 진입  외곽권 - 서해안고속, 서부간선, 제2경인, 외곽순환 등",4,"이마트, 뉴코아, 홈플 익스프레스 등 인근에 마트 위치 단, 단지내 상가건물 오래되어 아쉬움 더블 팍세권으로 인근 안양천과 한내천의 공원과 구름산의 녹지를 마음껏  누림",5,"첨단 출입시설이 있는건 아니지만 주차, 분리수거, 택배보광 등  단지관리 매우 양호 지하주차장도 있어 늦은 밤은 조금 복잡하지만 일자주차등으로 큰 불편은 아닌듯 함",5,"일조권 풍부하고, 층간소음이나 주변 도로소음 거의 느끼지 못함 냉방은 자연 환기로 여름에도 쾌적함 느낄수 있고, 난방비는 지역난방인가? 여하튼 관리비 차이는 크기 못느낌"
1282,한신,30대,여자,자가 거주,기혼,5,가성비 최고의 아파트이다. 32평 매매6억되기전에 무주택자라면 무조건 입성하는걸 추천하고 재건축이나 리모델링 호재로 투자로도 추천한다,5,"도보10분으로 금천구청역 갈수있고 강남순환도로 바로진입,서부간서도로 지하화 신안산선착공으로 영등포ㆍ여의도 출퇴근가능합니다 ㆍ수인선도 진입하기 좋으며 광명KTX 이용과함께 이케아 코스트코 롯데아울렛등 너무 좋아요",5,서울 금천구인데 주거생활권은 광명이라서 녹지풍부하고 쾌적해서 공기가 좋다 단점이라고 하면 아파트딘지 상가가 활성화되고 외관리모델링이 필요하다,5,"30년된 아파트라 연식을 속일순없지만 외벽도색,조경.청소관리,주차관리,재활용분리수거등 안정적으로 관리되고있다",5,서울에 1000세대 대단지아파트로 조용하고 쾌적하며 주민들이 상냥하고 예의바르다 주변에 광명소하동ㆍ하안동에 인접해서 인프라는 충분하다
1282,한신,30대,여자,전세 또는 월세,미혼,5,괜찮음  주민들도 모난 사람들 별로 없고  모르는 사람도 엘리베이터 타면 서로 인사하고 훈훈함  노인들도 많이 사는데 젠틀하다는 느낌을 많이 받음,5,"지하철 1, 2호선이나 서울역 나가는 버스도 바로 있고,   앞에 마을버스 정류장도 있어서 교통이 매우 편리  특히 금천구청역은 걸어다닐 수 있는 거리라 아주 좋음",4,"단지 내에 상가도 있고, 후문쪽에도 이것저것 있어서 편리함. 그리고 매주 장날이라 나쁘지 않음.   자차 이용하거나 버스타면 이마트도 가까움",5,경비 아저씨들이 매우 친절하시고 단지 관리도 잘 되어있음.   분리수거를 일주일이 한 번 깔아놔서 불편하지만 음쓰 버리는 거나 이런 건 아주 편리함. 지하주차장이 엘리베이터 연결이 안 된 점은 좀 아쉬움,4,층간소음 빼곤 괜찮음   단지 간격도 넓어서 답답한 것도 없고  단지 내가 넓직해서 산책하기도 좋음  개별난방이라 난방비는 케바케
1282,한신,40대,여자,자가 거주,기혼,5,생활권편리. 아파트가 조용하고 깨끗. 관리 잘되어 있음.  주민들이 여유있고 친절함.,5,금천구청역 도보 10분. 단지앞 버스정류장 . 2호선 구로디지털단지역 15분 이용가능. 사통팔달. 강남순환. 수원광명 고속. 외곽. 서해안등 고속도로진출입시점.,5,생활권 편리 . 노브랜드 홈플러스익스프레스 도보5분.  이마트. 코스트코. 롯데아울렛. 이케아등 10~15분 거리있음. 안양천 산책하기좋음.,5,깨끗하고 주차간격이 넓어서 옆차 문콕 없음. 지하주차장있음.,5,층간소음 조금 있지만. 윗층을 잘 만나야 ㅠㅠ.집이 환하고 난방비절약됨.
1282,한신,40대,남자,자가 거주,기혼,5,맛벌이 출퇴근 교통이 좋음 실거주자가 많아 분위기가 차분하고 주말 및 여가시간에 산책과 쇼핑을 하기에 최적 초중하교 단지앞이라 좋음 서울 다른지역과 비교해 이십평대의 가격으로 삼십평아파트를 구입가능!!!,5,안양성남 고속도로 판교 이십분 강남순환 고속도로 양재 이십분 서해안 고속도로 다이렉트  인천 수원 다이렉트 금천구청역 신호등없이 칠분,5,안양천 운동 좋음 공기좋음 코스트코 이마트 단지앞 초중,4,인테리어 필요  수도 난방공사 완료 관리비 좋음 자동문 없음 차단기 있음.,5,난방공사가 불편한점이 많이 개선되었다. 층간소음은 보통 바람과 공기는 좋음
1282,한신,40대,남자,자가 거주,기혼,5,교통 교육 주변시설 기준으로 가격이 매우 메리트있는 아파트라고 생각합니다. 맛벌이 출퇴근 부부 및 아이들을 키우는 세대들에게도 가격이 부담스럽고 교통교육이 불편한 지역보다 서울 20평대가격에도 구입 할 수 없는 자금으로 34평 자가아파트 입니다.,5,건널목없이 금천구청역을 단지에서 이용할 수 있습니다. 안양성남고속 도로로 판교까지 이십분 강남순환도로로 양재까지 이십분 서해안고속도로뿐아니라 수원 인천 모든곳으로 갈 수 있는 사통팔달!,5,안양천을 앞마당처럼 이용할 수 있으며 구청이 가까우며 코스트코 이마트등 편의시설을 이용이 좋습니다. 단지 앞 초중학교 역시 메리트 입니다.,4,조용하고 깨끗합니다. 단지관리가 무척 잘되어진 아파트입니다.,5,수도와 난방공사가 끝나 관리비가 줄어들었습니다. 아파트가 90년대라 깨끗한 내부를 원하시면 인테리어가 필요합니다.
1282,한신,40대,남자,자가 거주,기혼,3,학교따지지 않는다면 상관없지만 초중고학교 학생이 있으면 학군등에 대해 고민할 필요있음. 젊은분들 실거주하려면 전면적인 리모델링필요,5,"금천구청역 10분정도 소요되고 강남방향은 신도림이나 가산역 환승으로 불편한편. 서울방향버스가 단지앞에 여러대있다. 10여분 거리에 서해안고속, 강남순환고속, 안양성남고속, 광명수원고속도로가 있어 편리한 편이다.",4,"자동차 10~20분거리에 이마트 홈플러스, 빅마켓, 이케아, 코스트코 등이 있고 도보로 이용할만한 곳은 지역마트와 홈플익스프레스 정도이다. 안양천의 산책로나 자전거길 접근성은 매우 좋다",4,오래된 아파트 청소 깨끗한 느낌정도. 현관문 잠금장치없고 지하주차장과 엘리베이터 연결안되었다. 지역난방으로 바뀌고 관리비는 조금 줄어든것 같다. 연세드신분들이 많은 편이라 조용한편,4,층간소음은 보통이고 서부간선도로 끝부분에있어서 도로쪽 동들은 여름에 차소리들린다. 단지내에 공원1곳과 놀이터 2곳이 있다.
1282,한신,40대,남자,자가 거주,기혼,4,1991식 구축이라 주변 신축에비해 메리트 떨어지고 행정구역은 금천구지만 생활권은 광명이라서 그런지 주변시세대비 저렴한편이고 어린자녀가 있는 가족은 추천하기 애매함.,5,"금천구청역 남자걸음 10분이내이고 단지앞 서울시내쪽으로 나가는 버스가 몇대있고 바로옆의 동양아파트쪽으로는 안양과 철산동방향 버스가 많다. 강남순환고속도로, 안양성남고속도로, 광명수원고속도로 개통으로 지방으로 가는 선택로가 넓어졌음. 서부간선도로 지하화 완공되면 좀더 빠르게 여의도나 마포로 접근할듯하고 광명역이 가까워서 지방여행 용이.",5,"안양천 산책로는 사계절 최고인듯하고, 삼성산, 구름산 등 인근에 있어서 등산이나 산책하기 좋음. 서부간선도로의 종점 부분에 단지가 위치해서 도로쪽 동은 자동차소음 있음. 생활권이 광명이라 가끔 광명시민으로 착각하기도함",4,1991년도 입주했는데 나름 잘되고 있는편. 관리비는 지역난방으로 바뀌고 조금 줄어들었는데 각 가정의 창호상태나 사용빈도에 따라 차이가 날 수 있음. 현관이 개방된 형태라 밤에 전단지 붙이고 가고 지하주차장과 엘리베이터 연결이 안되어 있음.,4,"안양천 산책로는 사계절 최고인듯하고 서부간선도로의 종점 부분에 단지가 위치해서 도로쪽의 동은 자동차소음 있음. 쇼핑은 광명의 이마트, 코스트코, 시흥사거리의 재래시장이나 홈플러스, 가산동 마리오아울렛 등 차안막히면 모두 10~20분거리이고. 지방여행갈때 광명역이용하기 용이하다."
1282,한신,20대,여자,자가 거주,미혼,4,주변시설 잘 되어있어서 매우 만족하고  대중교통이 편리하게 잘 사용할수 잇더록 되어잇어 좋다,4,바로앞 마을버스와 버스정류장이있고 독산역 근처에 바로앞이 안양천이 교통이 매우 편리하다,3,마을버스도 가깝고 슈퍼나 편리한 이용시설이 바로앞ㅇㅔ있어좋고  아이들놀이터도 잘되어있다,3,공동현관 있지만 전단지 붙이는 사람은 잘만 들어온다 택배를 자주 시켜 경비아저씨덕에 편리하다,3,에어컨 난방 틀지않아더ㅠ괜찮다  해도 잘 들고 엘리베이터는 점 무섭다
1282,한신,20대,여자,자가 거주,기혼,3,주변환경은 평화롭고 좋지만 아파트가 오래되어서 추천하지 않는다.,4,금천구청역이 도보 5분 거리이고 버스정류장이 1~2분거리에 여러개 있다. 그러나 금천구청을 육교를 건너가야 하는데 육교에 엘레베이터가 설치되어있지 않아서 유모차나 휠체어를 이용하여 넘어가기가 힘들다.,3,백화점은 전철로 3정거장 정도 거리에 3개 정도 있고 아울렛은 도보 10분거리에 하나있다. 가산 패션단지나 광명 이케아가 버스로 쉽게 갈 수 있으나 30분 정도 걸린다. 슈퍼는 요즘 대형 슈퍼가 많이 생겼다. 아이들이 놀기 좋은 공원은 버스를 타고 15분 정도 가야 있다. 도보 10분거리에 축구장이 있다.,3,현관에 비밀번호가 설치되어있지 않다. 경비 아저씨들이 대체적으로 친절하시고 치안도 안전한편이다. 단지내는 깨끗하다. 그러나 주차공간이 부족하고 복잡하다.,2,층간 소음 문제가 심하다. 오래된 아파트여서 물이 샐 때도 있다. 냉난방비도 평수가 넓은 동에 살았어서 많이 나왔다.
1282,한신,20대,여자,자가 거주,미혼,5,저는 결혼하게되어 다른곳으로 집을 얻을 사람이지만  정말 좋아요 생각해보면 교통 편의 공기 뭐 하나 빠질게 없던것 같아요 그래서 가족들은 이사할 생각 없는것 같구요   너무 편하고 문제점이 딱히 없다보니 갈 이유도 없고  특히나 제일 좋은것은 방이 4개 이고 화장실이2개임에도 집값이 높지 않아 더더욱 안 떠나는 거죠 동네가 질이 좀 떨어지긴 하지만 그래도 집 자체로는 매우 만족이에요,5,"상가쪽 맨 앞동 아파트인데 마을버스,버스정류장 도보2분거리에요 세 종류 버스 오고 2호선 가려면 구로디지털단지역 까지20분 정도 소요되는 버스있고 신림 거쳐 노량진역 까지 가는 버스있구요 구로역 고대병원 지나서 목동까지 가는 버스있어요 ~골라서 타면 되고 버스는 아주 자주오구요 마을버스 기점이자 종점이어서 들어가서 대기하면 기사님 출발 하시는게 제일 좋아요 여름엔 시원하기 기다리고 겨울엔 따뜻하게!!!타고 기다리고 있음 출발하고 항상 앉아가구요~ 시간도 10분 이내로 가요 금천구청은 도보로10분걸려요",5,단지주변에 홈플러스 익스프레스 있고 공원 통과해서  도보 15분 정도 걸으면 이마트 있어요~^^ 그쪽이 요새 핫해져서 올리브영 스타벅스 맛집 많구요 매우 가까운 곳에 다 있고 산책로 매우 훌륭해요 특히 아파트 단지바로옆에있는 안양천은 정말 사계절내내 좋구여~  서울시 자전거 따릉이도 바로 있어서 타기좋아요   이마트쪽 한내천 공원도 산책코스로 너무 좋구요  봄에 특히 꽃도 많이 피고 좋아요 강추에요   편의점은 단지내엔 없고 조금 걸어가면 씨유 잇어요 한 7분 거리??다이소 도보15분정도 걸려요,4,"혹시 부재시 경비아저씨 택배 잘 맡아주시구요  찾아가지 못하거나 잊은 경우 연락 주십니다~친절 하시고   미화에 굉장히 신경 쓰시구요   청소하시는 분들도 깨끗이 잘해주시고..  아래에 비밀번호 현관통제가 없어요~그래도 지금10년이상 살면서 문제 한번도 못봣어요 단지가 큰편이고   세대도 많아서 안정감 있고, 대부분 다들 오래 거주한 주민들이기 때문에 안전하다는 느낌이 강해요",4,관리비는 조금 비싼 편이엇던것 같고  동남향인데.. 햇빛 잘들어와요 낮에 뒷방과  주방까지 빛 들어와요 층간소음은 심하지 않은 편이었던것 같고 ..  좀 오래된 아파트지만 문제사항은 특별히 없구요  복도식이 아니다보니 깔끔하고~ 이웃끼리 막 친하진 않아도 그냥 만나면 목례는 하는 정도??
1282,한신,20대,여자,전세 또는 월세,미혼,5,주변에 아파트가 많아 안전한 것 같고 버스정류장이 가까워 편리하나 지하철을 타려면 조금 걸어야 하는것이 단점이다,5,바로 앞이 시내버스 정류장이며 마을버스도 운행하여 편리하나 지하철을 타려면 10분 이상 걸어야해서 조금 불편하다,4,걸어서 10분거리안에 동네 마트가 있어 장보기 편하지만 근처에 편의점이 없어서 불편하다,4,주차할 곳이 많고 청소도 깨끗하게 되어있다. 출입통제는 그렇게 안전한 것 같지는 않다,4,햇빛이 잘 들어오고 여름엔 바람도 시원하게 분다.  층간소음은 집마다 다르다고 생각한다
1282,한신,30대,여자,자가 거주,기혼,4,교통도 편리하고 각종 대형마트와 산책로가 잘되어있어 아주 좋습니다. 산책로를 따라가다보면 가산 아울렛과도 가깝습니다.  또한 많은 아파트들이 모여있어 거주조건으로는 최적입니다.,4,바로앞 금천 구청역이있어 지하철 이용이 용이하고  광명 안양버스등이있으며 교통이 편리합니다.,4,이마트 홈플러스 조금더가면 코스트코 롯데몰등이 있어 마트이용이 용이합니다.  또한 뚝방길이 아주 잘되어있어 산책하기 좋습니다.,4,경비아저씨께서 청소를 아주 열심히 하셔서 항상 깨끗합니다.일주일에 한번씩 장이 열리는데 많은 사람들이 이용합니다.,4,교통이 편리하고 빅마켓 롯데마트 홈플러스 이마트 코스트코 롯게몰등이 가깝고 시흥시장 하안동 시장이 가깝습니다.  단지가 조용하고 좋습니다.
1282,한신,20대,여자,자가 거주,미혼,5,교통이 정말 편하다 127호선 모두 가깝다 또 경기도 여러 곳으로 가는 버스도 많기에 어디든 갈 수 있다 가까이에 아웃렛도 많아 쇼핑하러 멀리 가지 않아도 된다 또한 아파트 값이 저렴하기에 서울에서 이 정도면 매우 만족하고 살 거 같다,5,"1호선 매우 가깝고 2호선 7호 선도 가깝다 이케아 코스트코도 버스 한 번에 갈 수 있고 서울, 안양, 인천 등으로도 쉽게 갈 수 있다 출퇴근도 다양한 버스와 지하철로 매우 편하다",5,공원도 많고 안양천이 있기 때문에 산책하기 매우 좋다 봄에는 벚꽃축제도 하고 구경거리도 많다.  또한 이마트 뉴코아 아웃렛도 걸어서 갈 수 있기 때문에 장보기 쇼핑하기가 편하다 홈플러스 익스플러스와 작은 슈퍼도 많기 때문에 저렴하게 물건을 구입할 수 있어 좋다,5,단지에 공용 비밀번호는 없지만 관리가 잘됐기에 불편한 점은 없다 관리 아저씨가 항상 상주하시면 아침저녁으로 자주 순찰하셔서 위험하지 않다 관리비는 비싸지만 오래된 아파트라 이해한다,5,아파트가 복도식이 아니라 더럽지 않다 다만 건물 사이가 가까워 항상 커튼을 쳐야 한다 오래된 아파트라 자주 손봐야 하지만 햇빛도 잘 들고 위치도 좋기에 만족한다
1282,한신,50대,여자,자가 거주,기혼,5,"전철역. 도서관이 가깝고, 안양천이 가까워 운동하기 좋다 오래된 아파트라 중간 소음은 있지만 단지는 조용하고 아담해 살기에는 불편하지 않다가 격이 저렴한 편에 속해서 5점을 주었다",5,"금천구청역까지 걸어 15분 정도 걸림. 독산역은 마을버스 이용하면 10분 정도 걸리는 거리이고, 20호선 이용하려면 버스 이용하며 20분 정도 걸린다",5,"버스로 2 정거장이면 독산동 홈플러스가 있고, 롯데마트도 있다, 재래시장도 여러 곳 주변에 있고 시흥 금남시장 또는 독산동 남문시장..",5,1000세 대지만 어수선하지 않고 쾌적하다 택배는 경비아저씨가 받아주신다 현관이 오픈되어 있어 너무 자유로운 편이라 그게 조금 신경 쓰인다,4,"베란다가 넓게 트여 바람과 햇볕이 잘 들어와 난방을 덜할 수 있다 오래된 아파트라 중간 소음이 있어, 아이들이 있는 가정에서는 신경을 써야 할 듯 싸다"
1282,한신,30대,여자,전세 또는 월세,미혼,5,애들 키우기에도 좋고 노인들이 살기에도 좋음. 1인 가족보다 가족단위로 많이 생활함,5,지하철 1호선이 가까이 있음. 버스 노선도 가까움. 자주 오므로 큰 대로변으로 바로 나갈 수 있음,5,주변에 하안사거리나 소하동 상권이 가까이 있음. 금천구청도 가까이 있음,5,단지 청소도 깨끗이 관리되고 있음. 아파트 외관 관리를 위해 도색작업을 주기적으로 함,5,주변 학교도 많고 주변 상권도 활성화되어 있고 지하철 및 버스 등 대중교통이 활성화되어 있음
1282,한신,40대,여자,전세 또는 월세,기혼,3,전철이 가깝고 서부 간서 도로 타기 쉽고 대형마트도ㅠ가까움  오래되어 저렴하나 좁은 평수가 없고 대형이 많은 편이다,5,금천구청역 걸어서 5분 서부간선도로 바로 나갈 수 있으며 광명으로 가는 버스들이 있으며 마을버스도 많음 차 막히지 읺음,4,"안양천이 바로 보여 평소 운동하기 좋으며 이마트도 가깝고 광명으로 가기 편해 아웃렛과 이케아, 코스트코도 이용하기 편함",3,오래된 단지로 주차장이 넓어 좋고 중앙난방식이라 관리비는 좀 비싼 편이다 단지는 깨끗한 편이고 경비아저씨들이 택배를 잘 받아주는 편임,3,중앙난방식이라 마음대로 난방을 조절할 수없는 점이 아쉽고 층간 소음은 좀 있는 편이다 베란다는 있지만 그리 시원한 편은 아닌 것 같다
1282,한신,40대,여자,자가 거주,미혼,4,한적하고 조용합니다 노인 분등 사시기에는 좋을 거 같아요 대가족 단위나.. 여긴 살아본 사람이 좋은지 알아요,4,서울 변두리라 택시잡기 애매. 광명시에 있는 서울임 그러나 걸어서 금천구청역이 가깝고 버스는 환승해야 하는 부분이 좀 있으나 환승하면 되니까요,4,문제없어요 작은 마트 있고 차 타고 좀 나가면 광명 소하동 대형 이마트가 있고 소하동 쪽 광명 도서관 있고 더 가면 코스코 이케아 롯데아웃렛 있어서 편리한 편입니다,4,좀 오래된 아파트인 거 말고는 나쁘지 않아요 잘 관리하시는 편입니다 택배도 잘 받아주시고 단 오래된 아파트여서 지하주차장과 집으로 바로 연결되는 엘베가 없네요,4,나쁘지 않아요 지역난방이라 본인 하기 나름인데 관리비는 좀 나가요 오래된 아파트라요.
1282,한신,30대,여자,자가 거주,미혼,5,동네가 조용하고 출퇴근길 좌우 나무들이 많고 지하철도 가깝네요,5,역과 7분 거리로 가깝습니다 길이 다른 동네에 비해 넓고 쾌적합니다,5,널찍하여서 답답하지 않습니다 마트도 가깝고 코스코 이케아 아웃렛은 차 타고 말지 않습니다 근데 50자 이상 써야 한다는 건 조금 그러네요,4,아무래도 오래된 아파트라 지하주차장에서 집으로 바로 연결되는 엘리베이터가 없습니다,5,난방은 자기하기 나름이지요 뭐 해 잘 들어오고 난방 잘됩니다 가끔 앞 주택들에서 소음이 큭 들리긴 하지만요
1282,한신,20대,여자,자가 거주,미혼,4,"가까이에 마트, 지하철역, 버스 노선, 소하동으로 조금만 걸으면 산책할 수 있는 공원이 있어 편리하다. 단지가 조용한 동네라 왁자지껄한 사건이 없어서 좋다. 하지만 아파트가 조금 오래되어서 4점을 주었다.",4,"금천구청역이 도보 8분 거리이고 신림, 구로디지털단지역으로 갈 수 있는 6635번 버스가 집 앞에 바로 있다. 하지만 바로 강남, 목동 쪽으로 갈 수 있는 버스가 없어 불편하다.",4,버스로 10분 하안사거리와 소하 사거리 번화가가 있으며 동양아파트 정문 앞에 미니 홈플러스가 있어서 장을 보기 편하다. 단지 내에는 놀이터가 있다.,4,공용현관이 없어 잡상인이 가끔 들어온다. 경비 아저씨가 택배보관이나 분리수거를 잘 하셔서 편리하다.,3,옛날 건물이라 베란다가 넓게 트여있지 않지만 여름에는 선선하고 겨울에는 난방을 덜 할 수 있을 정도로 따뜻하다. 층간소음이 조금 있어 악기 연주는 할 수가 없다.
