danji_id,danji_name,age,sex,residenceType,married,totalScore,totalDesc,trafficScore,trafficDesc,aroundScore,aroundDesc,careScore,careDesc,residentScore,residentDesc
4408,주공6단지,30대,여자,자가 거주,미혼,4,"상권 가깝고, 자연환경 좋고, 서울 바로 옆인 하안주공. 오래된 아파트지만 수리해놓은 집이라면 대체로 만족스럽게 생활할 수 있다. 주차 등의 문제가 있어 4점을 준다.",5,"버스 노선 매우 다양함.   서울(구디/가디)로 가는 버스, 철산역 광명역 안양으로 가는 버스가 수시로 온다.  1호선 독산역까지 도보 10-15분이다. 출퇴근 시간에는 독산으로 가는 길이 막히므로 걸어가는게 더 낫다. 2호선 구디역까지 버스 15-20분 소요, 7호선 철산역까지 버스 10분 소요. 우체국 사거리에 지하철이 생길 예정으로 초역세권이 되는 6단지는 교통 여건이 더 좋아질 것임.",5,"대형 상권(하안 사거리) 뉴코아아울렛이 바로 앞에 있다. 그리고 하안동에만 2개 있는 스타벅스 중 하나가 6단지 앞에 있다.   광명시민체육관, 구름산, 안양천.. 도보 5-10분 안에 산책하기 좋은 곳이 참 많다.   상권 가깝고 공원 가까운 하안동 살면서 주변 환경에 대 만족하고 있다.",4,"오래된 아파트지만 나름대로 관리가 잘 되고 있다. 택배도 엄청 많이 오는데 분실된 적도 없다. 관리비는 15평 기준 여름철 8-10만원, 겨울철 15-17만원 정도 나오네요",4,"오래된 아파트. 중앙난방이라 장단점이 명확하다. 여름철에는 일주일 정도 온수가 나오지 않는다. 정남향 아파트라서 햇빛은 정말 잘 들어옴. 수리해서 들어올 경우 거주 만족도가 높다. 특히 1-2인 가구에게 15평, 17평 너무 만족스럽다. 오피스텔 원룸 전월세보다도 저렴한 가격에 거주환경 좋은 곳에 살수 있기 때문."
4408,주공6단지,20대,남자,전세 또는 월세,미혼,3,다소 오래된 아파트이지만 이정도면 주변환경도 좋고 다소 깨끗한 편이어서 추천할만 하다. 지하철이 먼경우만 제외하고는 버스도 많이 있고 교통은 편리하다,3,버스 여건은 비교적으로 가까워서 장점이라 하지만 지하철을 타야할 경우 버스를 타서 10분이상 가서 철산역을 가던 독산역을 가던 해야해서 매우 불편한 사항이다,4,주변에 퍈의점도 많고 아울렛도 있어서 편리한 점이 많이 있다 하지만 개인적으로 롯데시네마나 cgv 같은 영화관이 주변에 없어서 아쉬울 뿐이고 나머지는 만족한다,4,다소 오래된 아파트이다 보니 청결하게 보이지 않을 때가 많이있다 하지만 경비원 분들이 청소도 자주하시고 친철하셔서 별다른 에로사항은 없다. 한가지 아쉬운건 택배보관함 같은게 따로없어서 불편하다,2,오래된 아파트이다보니 겨울에 냉기가 들어오는 경우와 여름에 매우덥다는 단점이 있다 또한 베란다 에어컨 실외기 있는곳에 새들이 많아서 불편한 사항이 꽤 있다
4408,주공6단지,20대,여자,전세 또는 월세,미혼,5,주위에 사거리가 있어 물건을 구라기 쉽고 버스정류장이 많아서 버스정류장을 쉽게 찾을수 있어 매우 편리하다,4,장점은 버스정류장이 많아서 좋고 단점은 지하철역이 살짝 멀다,4,마트나상점이 많아서 매우 좋고 산책로가 잘 반전해서 산책하기가 매우 좋으나 놀이터나 산책로에 쓰레기 봉투가 없다ㅐ,4,택배보관이 매우 좋고 택배 찾기가 쉽지만 겨울에 바닥이 조금 차가워서 발이 시렵다,4,겨울에는 바닥 차갑지만 층간소음이 없어서 매우좋다 그리고 창문에는 바람이 잘 들어온다
4408,주공6단지,20대,여자,전세 또는 월세,미혼,3,"교통편을 중요시하면 나쁘지않은거 같다. 마트 백화점도 있고 다만 유흥주점, 술집등이 아파트 주변에 바로 위치하고 있어 아이들이 있다면 좀 안좋을수도..",5,두군데 버스정류장이 도보 5분이내 있고 버스 두정거장만 타고 나가면 독산역도 바로 있습니다 ㅎ,4,"바로앞에 뉴코아백화점이 있고 편의점도 거의 4-5군데 하지만 산책로나 공원등은 넓지않아서 산책하기엔,,",4,"그냥 보통이다,, 현관비번은 따로 없지만 관리인이 항상있어서 괜찮았다",4,여름엔 통풍도 잘되고 해가 너무 잘들어와서 커텐을 안치면 눈이 부실정도 ㅠ
4408,주공6단지,20대,여자,자가 거주,미혼,5,앞에 공원(놀이터)도 있고 마트도 있어서 장보기에 편리하다. 편의점과도 거리가 밀집해 있어 좋다. 버스 정류장도 많이 분포 해 있어 교통에도 편리하다.,5,버스 정류장이 근처에 많이 분포 해 있어 교통에 편리하다.,5,"아파트 앞에 마트가 있고, 조금 더 나가면 아울렛이 있어 장을 보기에 편하다. 앞에 공원이 있어서 애완견 산책할때도 좋고 애들 놀기에도 좋다.",5,"택배를 시키면 택배 보관함에 보관되어 있어 찾아가면 되기 때문에 편리하다. 잃어버리는 경우는 아직까진 없었고, 경비 아저씨께서 잘 확인해 주셔서 좋다.",5,베란다가 트여 있어서 바람이 잘 들어온다. 햇볕이 잘 들어서 겨울엔 따뜻하다.
4408,주공6단지,30대,여자,전세 또는 월세,기혼,3,신혼부부에게는 좋은거같아요. 저렴하고 주변에 상가도 많고 바로 걸어서 나가면 뉴코아아울렛도있어서 쇼핑하기도 좋아요,5,버스정류장이많고 버스 2정거장가면 독산역이있어요 회사에서 가까워요,4,은행 병원 먹거리 다있네요. 그리고 오래되서 나무들도쿠고 봄에는 벚꽃나무가 어마어마하네요,4,오래된아파트라 보일러 배관이 많이 노후됫네요.그래도 매년 배관청소도 하고 해서 그나마 나아요.  지하 주차장이 없어서 겨울에 추워요,3,3층이여서 나무로 가려져 채광이 안좋아요. 옆에 소리도 들려서 좀 불편하네요. 중앙난방시스템이여서 그런지 난방비가 많이 안나와요
4408,주공6단지,30대,여자,자가 거주,기혼,2,"지하철, 버스노선이 다양해 출퇴근이 편하다  대형 쇼핑몰도 있고 주변에 상가들도 잘되있어 젊은사람이 살기에 좋다",5,지하철 타러 가는 버스가 많고 자주 다님 버스 정류장이 바로 아파트 앞에있다,4,근처에 뉴코아가 있어 편리하고 오래된 나무들이 많아 공기가 좋은편이다 근처에 시민 체육관이 있어 산책과 운동하기 좋딘,3,옛날아파트 이다보니 주차공간이 많지 않아 불편하다 택배는 경비실앞에 전 세대꺼를 모아두지만 잃어 버린적은 없어 불편한건 없었다,3,오래된 아파트라 층간소음이 있다 근데 최근에 건설된 아파트들도 다 층간소음은 있는거같다 햇빛이 잘들어와서 따듯하다
4408,주공6단지,40대,여자,전세 또는 월세,기혼,5,"재건축 3년을 앞두고 있는 아파트 치곤 관리가 잘되어 있고 출 퇴근 하기도 편해서 미래가치가 높은 곳임 수리된 아파트가 거의 대부분이라 삶의 만족도도 높은 편임 학교 및 학원가가 밀집, 다양한 시설들이 많아 생활하기 편한 곳임 재건축과 우체국사거리에 지하철 하안역이 들어서면 초역세권에 소형으로 이루어진 6단지는 재건축에 용이~ 타단지 보다 미래가치가 더 높은 편임 매매, 전세 모두 인기 많은 단지임",5,"6단지 바로 앞으로. 버스들이 많고, 철산역 및 독산역을 이용할수도 있음 우체국사거리에 지하철 하안역.예정임 강남순환고속도로, 안양~수원고속도로가 개통. 서울, 판교가기도 편함",5,상업지역과 가까워 생활하기 편한 시설들이 근접해있고 하안사거리와도 지척이라 도보로 모든 시설이 이용가능함,5,"연식이 오래되어 단지는 낡은 편이나 냉, 온수 배관을 새로고쳐 녹물은 걱정멊음 단지 옆으로 화단엔 나무가 많이 심어져 있고 주변에 산책길이 많아 아이들 키우기엔 좋은 곳임 주차가 문제가 많았지만 잘 사용하지 않는 테니스장을 주차장으로. 만들어 타단지에 비해 주차하기가 그나마 나은편임",5,"소형으로 이루어진 6단지는 20평이 타단지 24평과 대지지분이 같아 투자 순위 1순위로 신혼부부 1인가구도 많이 거주함 단지 근처 초,중이 가깝게 있어 안심하고 아이들을 키울수 있으며 학원가도 밀집되어 있어 교육에도 좋은곳임"
4408,주공6단지,30대,여자,전세 또는 월세,미혼,1,노후된 아파트라 관리비가 많이나오고 벌레가 있다. 올수리된 집이면 모를까 수리안된집은 진짜 살기힘들다.,5,하안사거리에 웬만한버스는 다 있어서 교통이 매우 편리한편,5,뉴코아아울렛이 있고 주변에 많은 편의시설들이 있어서 생활여건은 아주 좋은편이다.,3,분리수거도 언제나 가능하고 경비실에 택배보관이 가능하다.,1,너무 오래된 아파트다보니 내부가 노후되어 쾌적하지 못하고 관리비가 많이나온다.
4408,주공6단지,30대,남자,전세 또는 월세,기혼,4,"주변보다 작은평수 덕분에 저렴하지만, 평수에 비해 저렴하지 않다  환경은 좋지만 가격이 비쌈",5,"지하철 역은 거리가 있지만, 서울 나가기 쉽다  버스는 사통팔달로 틔여있다. 서울로 나가는 길 금천교가 자주 막히는 점은 단점",5,"바로 옆 상업지구가 있어 은행, 병원, 학원, 마트 등 없는 것이 없다",3,"오래된 아파트 답게 나무가 많다  하지만 지하주차장이 없어, 밤엔 이중주차로 몸살이다  배관이 오래되어 녹물이 나온다",5,겨울에도 속옷만 입고 다닐정도로 따뜻하다 (중앙난방)  일조량은 동마다 차이가 있겠지만 604동은 앞에 건물이 없어 일조량이 최고였다
4408,주공6단지,40대,남자,자가 거주,기혼,3,일단 도로가 있어도 조용한편이라 신혼부부와 애들과 같이살기 좋은동네이다.,3,주변에 서울과 안양으로기는 버스가 많아서 교통은 좋은 편이다. 다만 지하철이 없어서 아쉬운감이 있다.,3,거의 모든 편의점이나 패스트푸드점이 적어도 한곳씩은 있어서 편하고 주변산에 약수터와 체육시설이 가까워서좋다.,3,수위아저씨들이 정이많고 친절해서 좋고 불량학생들이 근처에 없어서 좋다.,4,주공아파트로 건축한지 15년이 지나서 재개발 할때가 가까워오고 있지만 건물은 관리를 잘해서깨끗하다.
4408,주공6단지,30대,여자,전세 또는 월세,미혼,4,가산으로 출퇴근하는 분들께는 최적의장소이다 특히 신혼부부에게 좋다 실제로도 많이 산다 공원도 있고 산도 가깝기때문에 애견이들께도 추천한다,5,"용산과 여의도, 합정까지 바로 가는 버스가 있다.5536같은 경우는 아울렛을 가기에 편리하며 독산역과 철산역이 가깝다 출퇴근이 편리하나 차가 막히긴 하는데 이건 경기와 서울이기에 어쩔수없다",5,공원이 가까우며 큰 마트가 두개 위치해 있다 작은시장도 있고 병원도 있다. 학교도 많다,3,오래된 아파트라서 낡았지만 나름 관리는 잘되어있는 편이다,3,층간소음이 심하며 길 바로 옆에 있어 먼지가 많다 나무가 많아 벌레가 많으나 그늘이 많긴하다 주차할공간이 심각하게 없다
4408,주공6단지,30대,남자,전세 또는 월세,기혼,3,"교통만 놓고 생각한다면 추천합니다. 오래된 아파트이다 보니 편리함, 쾌적함 등을 부족합니다. 그러나 워낙 큰 단지다 보니 음식점, 마트, 학원 등 편의시설은 다 잘 되어있습니다.",5,"주변에 버스정류장 있고, 차를 모는 입장에서 고속도로 등 어딜 가도 편리하게 이동 가능",4,"동간 거리가 넓고, 녹지도 잘 되어있습니다.  단지 앞에 뉴코아아울렜과 시장, 하나로마트 등이 있습니다. 그리고 병원, 은행, 학원, 음식점들이 다 갖추어져있어요",2,지하주차장이 없어서 길가에 차들이 많이 있어 도보 및 경관에 안 좋게 영향을 미칩니다.,3,"동간 거리가 넓어 일조량은 풍부합니다. 아무래도 오래된 아파트라 층간의, 벽간의 소음이 존재합니다. 중앙난방인데 자주 고장 나서 매번 보일러실에 수리 요청해야 합니다."
4408,주공6단지,30대,여자,전세 또는 월세,미혼,5,하안사거리 인접하 단지여서 사거리에 있는 상가들 이용하기에 너무 편리하고요. 지하철역으로 가는 버스노선들 많고 10분 내로 도착해서 지하철 이용하기도 괜찮습니다. 가까운 거리에 이케아와 코스크 코가 있는 것도 장점이라고 생각해요. 6단지는 수도 교체 공사해서 녹물 걱정 없습니다.,3,지하철역과는 거리가 좀 있지만 버스 타고 나가면 돼서 크게 문제없어요. 지하철 역 가는 노선 많아요. 10분 내로 도착 가능해요. 철산역 독산역 인접합니다.,5,"3분 거리에 아웃렛 건물 있고 지하에 킴스클럽 매장이 있어서 장보기에 좋습니다. 야채 과일 파는 대박가게들 5분 거리에 있어서 저렴하게 살 수 있고요. 음식점, 병원, 학원, 서점 커피숍 등 편의시설 근접해서 이용하기 좋습니다.",4,택배 경비실에서 잘 받아줍니다. 경비실 앞에 선반 설치해두고 장부로 관리하세요. 단지 내 나무들 많아서 좋아요. 주차는 조금 불편합니다. 지하주차장이 없어서 차 댈 곳이 부족해요.,4,위층에 아이들 소리 조금 들리는데 크게 신경 쓰일 정도는 아니에요. 일층이라 햇빛이 잘 안 들어오기는 하지만 단지 사이 간격이 넓어서 답답하지 않아요. 베란다 문 열어두고 세탁실 창문 열어두면 바람 잘 통합니다.
4408,주공6단지,30대,여자,자가 거주,기혼,3,"대형마트나 백화점은 없지만 사거리에 나가면 없는 편의시설이 거의 없을 만큼 이용하는 데에는 불편함이 없는 편이다 안양천, 실내체육관등의 산책할 수 있는 곳이 있어 좋고, 주변에 초등학교가 많아 아이들을 고민하지 않고 보낼 수 있다",3,"버스 정류장이 많고, 버스 노선이 많은 편이라 자주 이용한다 철산역 독산역이 가까운 편이지만 버스를 타고 가서 이용해야 한다는 단점이 있다",3,"편의점은 곳곳에 있으니 마트가 부족 공원, 산책로 부족한 듯 하나지만 700-800미터 거리에 안양천이 있어 산책하곤 한다  실내 체육관이 있어 트랙 돌면서 운동하기에 괜찮다",3,오래된 복도식 아파트여서 잡상인의 출입이 쉽고 홍보물이 집 현관문에 붙어 있어 불편하다 택배는 1층에 놓는 선반을 만들어 두어 자기 물건에 사인하고 가져갈 수 있다  밤에는 너무 어두워 치안이 걱정되기도 한다,3,앞 동과의 거리가 있는 편이지만 잘 보이는 편이라 신경이 쓰인다 중앙난방이라 난방비 등 관리비 면에서는 만족하나 오래 집을 비우거나 할 때에는 불편하다 바닥 쓰는 소리 옮기는 소리 등 윗 층의 층간 소음이 자주 들여 불편하다
4408,주공6단지,20대,남자,자가 거주,미혼,4,하안사거리에 꽤 많은 상가가 있기 때문에 필요한 물건을 대부분 구할 수 있다. 몇 년 후 코앞 우체국사거리에 지하철 1호선이 들어온다고 한다.,4,"하안 버스공영차고지 바로 옆이고, 7호선 철산역과 1호선 독산역 대략 5분 내외 걸린다. 집 앞에서 아무거나 타면 철산역 도착",3,홈플러스나 이마트는 꽤 멀리 떨어져 있다. 하지만 집 앞 킴스클럽에서 웬만한 물건을 구할 수 있고 단지 내에 영업시간이 아주 긴 슈퍼마켓이 있다. 오래된 아파트라 나무가 커서 그늘이 많다. 철망산 근린공원이나 하안 도서관이 가깝다,4,주차관리가 철저하다. 난방이나 수도 문제가 있을 때 경비소에서 즉시 직원이 와 처리해준다. 택배 보관소가 경비실 바로 앞에 있고 cctv가 있어서 분실 위험은 적다.,3,벽과 바닥이 부실한 지 층간 소음이 조금 있다. 중앙난방인데 조금 춥다. 뜨거운 물 수압이 너무 약하다.
4408,주공6단지,30대,여자,전세 또는 월세,기혼,3,근거리에 정류장도 가깝고 실내체육관이 있어 운동이나 산책 시 용이하다 전철까지 버스 타고 한 10분 정도 가야 하고 소형 슈퍼마켓도 많아 급할 때 방문 가능해서 좋다  단점은 아파트의 주차자리가 좀 협소해 이건 고려해야 할 듯  아파트 간 층간소음은 그다지 없었어 모르겠다,5,정류장이 근거리에 있고 전철은 버스로 한 10분가량 걸린다  버스가 시내 시외버스가 고루고루 있어 출퇴근 시 이용할 버스가 많다,4,편의점 다수 중형마트 몇 군데 있으며 소형 슈퍼마켓도 많아  주변에서 생필품 구입이 쉽다,4,주차자리는 세대수가 많아서 협소한 편임  하지만 출퇴근이 빠른 세대는 좋은 주차자리는 늘 확보할 수 있다,3,중앙난방식이지만 이번엔 오래된 배관을 바뀌서인지 난방은 진짜 잘돼서 추위를 탈 수 없을 정도로 따뜻하며 오래된 아파트지만 층간소음은 그다지 없는 듯
4408,주공6단지,20대,여자,자가 거주,미혼,5,편의시설 용의 하고 다만 오래되었다는 게 단점. 뭐 범죄도 다른 거 없고 이 정도면 살만함,4,버스정류장이 2개나 있어서 골라 탈 수 있지만 주차장이 외부고 주차공간이 협소한 게 단점,4,"소하동 이마트도 근처고 킴스클럽도 있어서 좋다. 공원도 여러 개고 근처에 슈 퍼도 있고,",4,청소도 깔끔하게 하고 공용 현관이 없다는 게 단점이지만 택배 분실 위험도 있긴 하다만 쏘쏘함,3,1층이라 그런지 잘 다니고 있다. 다만 좀 오래돼서 쿵쾅대는 소리 들릴 수 있으나 예민하지만 않다면 괜찮을 정도
4408,주공6단지,30대,여자,자가 거주,기혼,4,"교통이 편리해 출퇴근 및 이동이 용이하며 체육시설과 공원들이 가까워 산책이나 운동하기 편하다. 단지별 학교들이 많고 학원이나 교육.놀이기관들이 밀집해있어 아이키우기에 좋다고 생각한다. 다만, 아파트가 노후하다는 점과 지하주차장이 없어 주차난이 발생한다는 점에 별하나를 뺀다.",5,"1호선과 7호선이 가까이에 있으며 버스도 경기,서울 등의 방면으로 매우 자주 있어 대중교통 이용이 용이하며 서울과 매우 근접해 있다. 서해와도 가까워 바다가 보고싶을때 자가용으로 30분이면 갈 수 있다.",5,"하안동의 중심에 뉴코아아울렛이 있어 마트와 쇼핑, 문화센터 이용이 편리하다. 버스와 차량으로 10분 거리에 롯데아울렛 코스트코 이케아가 있다.",4,동마다 배치되어있는 경비원들이 교대로 근무하며 동주변 청소 및 정리를 수시로 하며 동마다 택배 보관대가있어 편하다. 아파트 입구에 차단기가 있어 외부차량 통제를 하고 있다.,5,8층 거주중으로 겨울은 반팔만 입어야할 정도로 난방 잘되며 남향으로 햇볕이 잘들어 빨래도 잘 마르지만 건조한감이 없지않다. 복도식 아파트로 환기가 편하다는 장점과 함께 겨울엔 현관으로 찬바람이 들어오기도 한다.
4408,주공6단지,20대,여자,전세 또는 월세,미혼,5,무엇보다 교통이 매우 편리하고 편의시설이 다양하여 살기편합니다 서울 경기 어디든 가기 편해서 살기좋은 동네라고 생각합니다,5,"지하철도보15분, 버스가 다양해서좋다 출퇴근이 편리하다 하지만 아파트가 많아 인구수 증가로 버스가 포화상태이다",5,바로 앞에 뉴코아아울렛이 있고 편의점이 많아서 언제든 이용가능하다 아이들이 많다보니 놀이터도 군데군데 위치해있다,3,주변은 깔끔하고 깨끗한편인데 차량이 너무많아서 주차장이 너무 좁아요 확장을 했지만 그래도 좁아요ㅠㅠ,3,층간소음은 별로 없지만 중앙난방이라 춥지도않은데 보일러를 틀어 더워죽겠어요 조절도 못하고 관리비는 관리비대로 나가고 돈아까워요
4408,주공6단지,30대,여자,전세 또는 월세,기혼,2,가격대비살기좋아서그리고교통이나은행가깝고 공원이나음식점실내체육관등가깝고 초등학교나마트편의시설이가까운건좋지만 노후로층간소음과노인들이나혼자사시는분만아서 담배냄새가넘심각해서점수를조금주었네요 그래도다른노후된아파트도거의비슷하리라생각듭니다,5,바로앞에정류장이있어편해요 정류장에서지하철까지거리가있지만 바로버스에서내리면역도가까워서조아유,5,주변에병원이나은행가까워요 그래서이단지에는애기엄마들도많은데 다니기불편하지않고편리한듯합니다,3,경비아저씨들이많이계시지만 나이들이있어서그런지그렇게친절하진않으시고 청소도자주하는거같지않아요 관리비영수증도빨리좀가져오셧으면합니다,1,층간소음심하고난방너무조금틀어줍니다 옆집아저씨가대놓고담배피십니다짜증나요
4408,주공6단지,30대,여자,전세 또는 월세,기혼,4,인근 뉴코아 사거리에 여러 편의시설 음식점 병원이 많아 어린아이 키우기에는 광명시에서 그나마 저렴한 시세로 편의시설을 누리며 생활 하실수 있습니다 ,5,하안사거리와 접근성이 좋습니다 1호선 독산역 걸어서 15분 버스로 5분내외 7호선 철산역 가는 버스 많고 철산역 까지는 버스로 10분 정도 걸립니다. 사거리에 서울외 버스노선이 거의 있어 하안주공 아파트들중 편리성은 상으로 보셔도 될듯합니다 외에 603동은 바로 버스 정류장과 가까와 소하동외 철산역가는 버스들이 바로 있습니다,4,인근에 뉴코아 있어 아이들 문센도 걸어갈수 있고 하안 사거리에 여러음식점 병원 소아과등 편의시설 있습니다,3,복도식 아파트로 겨울에 결로현상이 생길수 있어 주의해야 하며 오래된 아파트라 녹물이 많았으나 작년 온.냉수관 교체로 녹물은 많이 사라진 상황 입니다,4,중앙난방으로 난방 복불복 있을수 있고 아이 키우기에는 좋습니다 단지내 초등학교 길건너 중학교 있습니다
4408,주공6단지,30대,남자,전세 또는 월세,기혼,3,저렴한 가격에는 전세살이에 나쁘지 않습니다 처음엔 이곳에서 시작했는데 편의시설 및 주변 상관이 가끔 그립슴니다,5,독산역이 앞에 있고 버스정류장도 가까이 있습니다.  지역이 걍기도이지 서울이라고 보시면 됩니다 ,5,안양천이 가깝고 편의시설이 주변에 다 있습니다 광명에서 다 해결가능해요,3,오래된아파트라 주차장이 협소하지만 자주 주차딱지를 붙이고 쵠엔 주차장 증설 및 차단기를 살치했음,2,베란다가 좁지만 중앙난방으로 인해 겨울은 매우 따뜻합니다 관리비는 보통 20만원 미만으로 나옵니다 15평기줔
4408,주공6단지,20대,여자,전세 또는 월세,미혼,4,하안동은 서울시에 인접하여 솔직히 교통편이 용이하여 살기에는 만족스럽다 근처에 사거리에 큰 아울렛과 상가가 잘 형성되있어서 만족하고 안양천 같은 자연환경이 있어서 산책하기에도 좋다 다만  아파트가 조금 오래되고 주차공간이 협소한편이문제점일것같다,5,"집근처로 버스정류장이 오분거리고 다양한 버스노선이 잘구성되어있다. 또 지하철역을 버스를 타고 10분정도 이동하여 2(구로디치지털단지),7(철산),1(독산)호선 다양하게 이용할수 있어서 만족한다 ",4,바로옆사거리에 큰 아울렛이있어서 장보기에는 용이하다. 또 10분정도 걸어가면 안양천이 있어서 가족이나 친구와 봄에 벚꽃 구경도 하고 저녁에 배부를때 산책하기 좋다,3,우리 단지는 출입에 대한 통제는 강한것같지는 않다 또 지하주차장이 없어서 주차공간에서는 차는 없지만 만족스러운편은 아니다 택배보관함이 경비실앞에있어서 안전하게 맡길수있다,4,중앙난방이 되있어서 다른곳보다 요금이 덜 나온다 가끔 공사할때 소리가 조금 크게들리는것같다 
