danji_id,danji_name,age,sex,residenceType,married,totalScore,totalDesc,trafficScore,trafficDesc,aroundScore,aroundDesc,careScore,careDesc,residentScore,residentDesc
336,남서울럭키,30대,여자,자가 거주,기혼,3,아파트가 편리하긴 하지만 아기 키우는 입장으로 요즘 사람들은 이해라는 게 거의 없는 거 같아 아파트는 별로 인기 같음,1,버스가 별로 없다. 두 갈래 길로 나눠지는 구간이 있는데 대부분 버스가 반대쪽으로 가는 노선들이라 우리 집 기준으로 보면 많이 불편하다,3,공원이 잘되어있다 공원에 놀이시설도 잘되어있고 길도 잘 만들어져 있다 버스로 15분이면 백화점 마트 등이 있어 좋다,3,오래된 아파트라 요즘 아파트에 비하면 관리가 잘되는 편은 아님. 가로등도 어두워서 특히 겨울에 초저녁만 되어도 나가기 무섭다,2,오래된 아파트라 방음 전혀 안되고 일조량이 부족하다 거기다 외풍도 심해서 난방비도 조금 많이 나온다
336,남서울럭키,40대,여자,자가 거주,기혼,4,다양한 것을 생각해 봤을 때 매우 추천한다! 교통도 편리하고 주위에 아파트며 병원 마트 등 다양한 편의시설들이 가까이 있기 때문에도 더욱 더 추천할 수 있는 거 같다,5,근처 버스정류장이나 지하철역이 가까이 많이 있어서 왔다 갔다 하는데 매우 편하다. 하지만 너무 차가 많이 다녀서 복잡할 때가 많이 있어서 불편함을 느낄 때도 있다!,5,좀만 가면 가까이에 병원이나 백화점 홈플러스나 롯데마트와 같은 마트들이 많이 있으며 뿐만 아니라 숙박시설이나 놀이시설 등도 많아서 편리하고 좋았다,5,불편한 점은 거의 없었으며 언제나 친절한 경비원과 이웃주민 덕분에 단지는 깨끗하고 편리하고 좋았다 누구나 와도 좋다고 느낄 수 있을 거 같다고 생각이 든다!!,4,다른 아파트와 크게 다른 점은 없으나 위층의 소음이 조금 커서 문제가 종종 있었다! 어쩔 수 없는 문제라고 생각이 드나 이 점이 크게 문제였다고 생각든다
3794,동양1차,50대,여자,자가 거주,기혼,5,작은 도로하나  사이로  서울 ㆍ광명이며 지하철 1호선(금천구청역 ) 도보  20 -30분으로 서울  가산디지털ㆍ독산 등   출퇴근  가능하고ㆍ 초ㆍ중ㆍ고 밀접하며  ㆍ주변에 유흥ㆍ시설등이  없어  교육여건  매우좋음,5,단지  바로 앞  버스정류장  다양한  경로의  노선  (구로디지털 ㆍ안양  ㆍ신림ㆍ영등포등) Ktx 근접  강남순환 ㆍ서해안 고속도로ㆍ광명ㆍ수원고속도로 등  교통요지,5,단지내에  홈플러스   근처에 이마트 ㆍ뉴코아아울렛  차량 십분 거리에  롯데아울렛 ㆍ이케아 등 쇼핑  ㆍ장보기  편리하며ㆍ 구름산 이 있어  공기가  좋으며 한내천 안양천 등이 근접해 있어 운동 ㆍ산책이  용이하며  ㆍ비교적 주변이  조용한 주거환경 이다,4,근무하시는  경비 분들이  부지런하여 단지 내  환경이 매우 깨끗하고ㆍ 조경 관리를  자주 하심 건축 년도가  오래되어  부분적 (복도 ㆍ계단)등  이  노후되어 보여  별 하나 뺌ㆍ,5,생활하기 편리한  구조ㆍ 베란다가  넓어  식물 키우기 용이함ㆍ 햇빛이  종일 들어와  실내가  밝음ㆍ 튼튼하게  지어져서  층간소음  거의  못 느낌ㆍ
3794,동양1차,40대,남자,자가 거주,기혼,5,2000년 동양시멘트에서 지어 튼튼하고 동수가 적고 주변 아파트에 비하여 지어진지 오래되어서 저렴함,4,"지하철 금천구청과 걸어서 10분거리, 마을버스는 독산역이나 가산디디털역과 연계되어있옴",5,"등산과 산책하기 좋은 구름산이 근츼에있고 안양천이 옆에있어 환경은 좋음.주변 구름산 초등학교, 소하중고교, 운산고가 있어 학군은 잘 형성되어있고 이마트와 쇼핑하기 좋은 가계들이 많이 입점하여 영업중이며..구름산 주위 맛난 음식점이 많이 분포되어있어 외식하기 좋음",5,"단지는 크지 않음. 제일 작은 평수는 24평이며, 소하동에서는 제일 먼저 지어진 아파트임. 도로 바로 건너는 독산동으로 서울이며, 경기도 광명시이지만 전화시에 경기도 지역번호는 안누르고 서울 자역번호인 02븬 사용함",4,"대형마트인 이마트있고 조그만 대형 프렌차이점 마트(홈플러스,노브렌드...) 산적해있고,그렇게 먼거리는 아니지만 자동차로 10~20분 거리에 위치한 광명시장이있음(단점은 시장에 주차장 여껀이 안좋음)"
3794,동양1차,40대,여자,전세 또는 월세,기혼,4,가까이에 인프라형서이 잘 되서 추천해요..도서관 한내천공원이 있음,5,"버스정류장 3분거리이고 철산역,금천구청역 가까이에 있어서 교통편이 편함.",4,이마트가 도보로 15분 가까이에 초중고가 있음 20분거리임,4,단지가 크지 않아서 관리가 잘 되고 택배도 경비실에서 보관하며 주차차단기가 있어서 외부인 출입이 거의 없음,4,평수가 넓어서 난방비가 많이 드는게 흠임.그러나 여름엔 시원함.
3794,동양1차,20대,여자,자가 거주,미혼,4,주변환경에 만족한다. 거주하기에 나쁘지 않다. 대중교통이용에 나름 편리하고 자동차 이용시에도 강남 순환고속도로를 이용하기 좋다. 가까이에 도서관도 2개 있고 광명역세권 인근이라 은근 좋다. 단지가 작아 좋다.,4,"광명역,코스트코, 롯데아울렛 그리고 철산역쪽으로 가는 버스정류장 도보 1분 이내.  도보 3분 이내에는 1호선 독산역으로 가는 마을버스와 2호선 구로디지털단지역으로 가는 버스 탑승 가능",4,아파트앞 상가에 홈플러스 익스프레스 입점. 소하동 이마트도 가까운 편. 한내천공원과 안양천 뚝방길도 가까이에 있어 가볍게 운동하기 좋다. 이마트 근처에 청소년수련관과 시립도서관이 있어 이용하기 편리하다.,3,매일아침 청소해주시는 아주머니들 볼 수 있다. 택배보관은 경비실에서 맡아주시고 분실된적 없음. 지하주차장 널찍한 편이나 지하2층은 냄새가 있는 편,3,"층간소음 있는 편. 윗집 아이들 뛰어다니는 소리, 피아노소리, 바닥에 놓인 핸드폰 진동소리 잘들림. 구조에 따라 다르겠지만 베란다쪽으로 낮동안 햇볕 잘 들어오는 편. 통풍시 바람순환 잘 됨"
3794,동양1차,30대,여자,전세 또는 월세,기혼,5,바로 앞에 홈플러스 익스프레스도 있고 인근에 노브랜드 매장과 이마트가 밀집해 있어 쇼핑이 편리해요 그리고 교통도 편리하고 공원도 있어 무척이나 좋아요~,5,서울로 나가는 버스와 안양 및 광명으로 나가는 버스 노선이 많아 교통이 편리합니다!  다만 버스정류장까지 좀 걸어야 되는 점이 단점이네요,5,버스로 3 정거장에 이마트가 있으며 걸어서 10분 거리에 노브랜드 매장이 있습니다  그리고 단지 앞에 홈플러스 익스프레스가 있어 쇼핑은 정말 편리합니다,5,경비원 아저씨들이 하루 종일 청소를 열심히 해주셔서 항상 단지가 깨끗하고 불법 주차에 대한 단속도 잘 이루어져 주차문제도 걱정 없어요,5,바로 앞이 도로여서 매연 등이 좀 들어오지만 집 앞을 방해하는 건물이 없어 햇빛은 잘 들어와 좋아요~
3794,동양1차,30대,여자,자가 거주,미혼,4,"지하철, 버스, ktx 등 이 근거리에 있어 가는데 문제없음  마트 등도 조금 거리는 있지만 문제 없음  강가 산책이나 운동 등 힐링을 중요시한다면 강추  다만 위층이 시끄러운지 등은 확인 후 입주 추천",3,"1호선 역까지 도보 15분, 광명 ktx역 까지 20분, 철산역 7호선까지 20분, 버스정류장에 안양, 서울로 나가는데 불편함 없음  단지 역에서 가깝지도 멀지도 않은 거리",3,"대형마트 이마트가 있으나 도보로 다니긴 조금 멀음. 걸어서 약 25분  홈플러스는 버스 타고 15분 정도 거리  단, 안양천이 근거리에 있고 넓어서 산책이나 자전거등 운동하긴 최적",5,"관리비 저렴한 편이고 관리도 잘 되어 사는데 불편함 없음.  택배도 잘 받아주시고, 잡상인이 벨 누른 적은 없음.",3,베란다를 열면 구름산? 의 차가운 바람이 불어 여름에도 타 아파트 대비 시원한 편임.  겨울에도 햇빛이 잘 들어오고 결로 같은 거 안 생김.  층간 두께가 조금만 더 두꺼웠음 괜찮았을 뻔.  애 있는 집 혹은 쿵쾅대려면 절대 1층으로...
3794,동양1차,30대,남자,자가 거주,기혼,4,"장점으로 조용한 위치, 버스노선 다양, 공기 좋음, 가산 쪽 직장인들은 출퇴근도 괜찮음. 단점으로 거의 20년 정도 되어 리모델링 안된 집은 별로, 층간소음 조금 있음",5,"정거장이 도보 1분 거리에 두 곳 있어서 버스 타기는 용이, 단 출근시간 버스는 상당히 막힘",5,"집 앞 홈플러스가 있고 근처에 이마트 코스트코 이케아 등 있어 편함, 그리고 근처 한내천, 안양천 있어 산책하기도 좋음",3,"대단지는 아니어서 편의시설은 부족, 그래도 2년 전에 도색을 해서 관리상태는 좋음",4,"개별난방이라 따뜻, 살짝 서향이나 단지 앞 고층건물 없어 저층도 햇빛 충분, 주변 모두 아파트 단지라 조용하고 생활하기 좋음 단 층간소음은 있는 편"
3794,동양1차,30대,여자,자가 거주,기혼,5,"주변에 한내 근린공원, 달맞이 공원 등 아이 키우기에 너무 좋고요, 동네 조용하고 교통이 광명시내, 서울 쪽 어디든 가기 좋아서 추천합니다.",5,"바로 앞에서 이쪽은 광명시내, 저쪽은 서울방향 버스들이 있어서 어느 쪽이든 편리하게 이동 가능해요",5,"아파트 상가에 홈플러스 익스프레스 입점, 걸어서 15분 거리 대형 이마트 있고요, 근처에 지오 마트 등 저렴한 마트 체인 있어요. 한내 근린공원도 길 건너면 금방이고요",4,"단지 청소는 매일 하셔서 깨끗한 듯하고, 경비실에서 택배 받아주시고요. 출입통제는 특별히 잘되는지는 모르겠어요. 주차장이 지상, 지하에도 있는데 차단하지는 않으시는 듯.",4,계단식이고 (동에 따라 복도식도 있어요) 냉난방비가 많이 나오지는 않는 것 같아요. 층간소음은 아파트라 어쩔 수 없이 있어요.
3794,동양1차,20대,여자,전세 또는 월세,미혼,3,버스정류장이 집에서 바로 나가면 2~3분 정도 걷다 보면 바로 있어서 좋은 거 같다,2,집 앞에 버스정류장이 있지만 간격이 너무 넓고 근처가 너무 어두워서 약간 무섭다,3,주변이 시골 느낌 나고 곁에 공원이나 놀이터가 없어서 약간 불편하다,3,그냥 보통이지만 아파트 계단 쪽에 약간 담배냄새가 많이 난다 잡상인이 안으로 들어올 때도 가끔 있어 불안하다,3,어두워 여름에는 시원하고 겨울에는 춥다 오래된 아파트라 그런지 층간소음이 없지 않아 있어 좀 답답하다
3794,동양1차,20대,여자,자가 거주,미혼,5,다 편리해서 살기 좋다. 대중교통 이용이 편리해서 살기 좋고 근처에 편의점 마트 등 필요한 것들이 거의 다 있어서 좋다.,5,버스 정류장이나 지하철역이 근처에 있어 교통이 편리하다,5,걸어다니기 좋은 거리에 이마트가 있어 편리하다. 그리고 조금만 걸어가면 많은 편의점 들과 문구점이 있어 좋다.,5,청소도 깨끗하고 주차장도 편리하다. 또 비밀번호도 편리하다. 택배도 경비 아저씨가 잘 관리해 주셔서 좋다.,4,따뜻하고 햇빛도 잘들어온다. 바람도 잘 통해서 시원하기도 하다 층간소음이 살짝 있어서 가끔 시끄러울때도 있다.
3794,동양1차,30대,여자,전세 또는 월세,기혼,3,교통편이나 주변 환경 등은 그럭저럭 괜찮으나 아파트 자체는 노후된 편... 세대수가 좀 작은 것이 흠이라면 흠일 수 있음 세대수가 적으면 그만큼 나가는 관리비가 많은 것,3,지하철 1호선 금천구청역 도보로 약 십분 소요 버스정류장은 단지 앞 바로 있음,4,주위에 안양천으로 쭉 산책로 있고 이마트 가까움 차로 7-8분 10분 안쪽으로 초중고 도서관 있음,3,큰 불편 없음 지상주차 시 전면주차해야 하는 것이 좀 불편함 항상 후진주차만 하여 전면주차가 어렵고 지하주차장 자리 없을 때가 많음,2,위층 층간 소음 심해서 스트레스받았음 이건뭐 복불복이라 딱히 단점이라고 할 수 없고 햇빛은 잘 들어왔음
3794,동양1차,40대,여자,전세 또는 월세,기혼,4,안양천 한내천 가까이 있어 산책하기 좋고 교통 편리하고 일조량도 좋고 살기 편합니다..,4,서울로 가는 버스정류장 도보 2분이면 가능하고 아파트 앞이 버스정류장이어서 편리하다. 강남 고속도로 진입 5분이면 가능하다.,4,이마트 버스 두정거장 아파트 앞에 홈플러스익스프레스 있어서 장보기 편리함,3,경비아저씨가 청소는 자주 하시는 거 같지만 청소하시는 분이 복도를 깨끗하게 안 하신다..,4,난방 잘되고 일조량 4계절 좋습니다 층간소음 그리 심하지 않습니다. 복도식이라 조금 불편한 거뿐입니다
4306,현대,30대,남자,자가 거주,기혼,5,역세관 아파트로 매우 저렴하고 추천합니다. 난곡선이 만들기 시작하면 가격이 더 오를 것이라 생각합니다.,5,신대방역까지 5분안에 걸어갈 수 있습니다. 신대방역 앞에 버스정류장이 있습니다만 탈일은 없습니다.,3,대형마트는 없으나 초등학교가 바로 옆이고 시장이 5분거리에 있습니다.,4,단지수가 200세대가 안되다보니 단지관리에 매우 좋지는 않습니다.,5,정남향이고 아파트 내에 놀이터가 매우 잘되어 있습니다.
4306,현대,20대,여자,전세 또는 월세,미혼,4,다소 언덕배기에 아파트가 위치한 거 빼면 자연를 좋아하고 조용한 주변분위기를 좋아하는 나는 만족했다  주변 물가도 저렴해서 먹을거리를 사거나 공부하기도 좋았고 대중 교통도 아침에 다소 부지런하게 나가야한다는 점을 제외하고는 좋았다,4,아파트 내로 배차간격이 짧은 5515가 들어와서 편리하다  하지만 역으로 나가기까지는 시간을 넉넉히 잡아야한다,4,바로 입구에 관악공원이 있어서 산책하거나 바람쐬기좋다  이어진 등산로도 있다 공기도 좋고 조용하다,4,관리인 분들은 딱히 불친절하시지 않았다  단지관리도 큰 불만이 없었다,3,냉난방이 개별난방이라 좋다  집이 여름엔 시원하고 경치가 아주 좋아서 만족스러웠지만  아무래도 오래된 아파트인데서 오는 불편함이 있긴하다  하지만 엘레베이터도 리모델링하고 집도 리모델링하면되니 나는 별 문제없었다
36950,금천롯데캐슬골드파크2차,40대,여자,자가 거주,기혼,5,"가까운 곳에  대형마트,학원,편의점,헬스장,초등학교,음식점이 있어서 가기 편하고 엄청 좋음",5,"집에서 전철까지3분정도 걸리고 마을버스가 바로 앞에 있어서 교통 편해요. 여의도,강남,지하철때문에 어디든 다 갈수있어요",5,공원이  2분 정도 걸리고 롯데마트도 7분정도 걸리고 초등학교가 4분정도 걸려서 편해요 2차 안에 학원 음식가게 편의점 헬스장 및 골고루 가쳐져 있어서 엄청 편해요,5,택배 보관함이 따로 있어서 편해요 현관이 스마트 형식이라 손을 안대고 들어갈 수 있어서 편해요,5,"주거 환경이 깨끗하고 편해요 햇빛도 잘들어오고 집에서 밖에 풍경을 볼때 이뻐요 여름에 통풍이 잘되고, 겨울에는 단열이 잘되어 따듯해요"
36950,금천롯데캐슬골드파크2차,30대,남자,자가 거주,기혼,5,"마트...먹거리..공원..전철...버스.. 모두 갖췄다.. 신축이라 그런지 신혼부부가 많은듯 ㅎㅎ 단지 분위기 좋고 1,2,3단지가 사실상 하나의 단지로 봐도 무방할 정도로 잘 어울려져 있다.  재밌음. 층간 소음도 없고 출퇴근도 편하고 ~ 대중교통으로는 강북권 다니기 편하다. 강남은 좀 번거로움. 자동차로는 강남순환고속도로가 있어서 자차로 가기엔 편함.",5,"서울역까지 급행 2정거장 ㅋㅋ 돌아올땐 서울역에서 금구까지 1정거장ㅋㅋ 서울역 근처 직장이면 말 다함..  중요한건 역 까지 늦어서 뛴다 치면 1분이면 도착함. 걸어서는 3~5분  마을버스는 그냥 아파트 나오면 바로 앞에 정류장이라 타고 가산디지털이나 구로 가능... 현재론 1,2,3차 중에선 단연 탑..",5,구청앞이라 관리가 잘되는 편 도로 매우 깨끗하고 경찰서도 있어서 치안도 좋음.   3단지에 대형마트랑 먹거리 형성 잘되어 있음.  바로앞 공원이 매우 잘되어 있어 산책 및 애들이랑 놀기 좋음.,5,주차장 널널 함. 현관문 관리 잘되는 편. 3층에 주민시설도 잘되어 있음. 코로나 때문에 이용 못하고 있지만..,5,층간소음에 예민한데 정~말 없는 편. 신축아파트 장점인듯. 앞 뒤로 막는게 없어 햇빛 매우 잘들어옴.  환기가 매우 잘되나 앞에 철도 때문에 창문 열면 시끄러움. 근데 뭐 열고 오래 있을거 아님 괜찮음.
36950,금천롯데캐슬골드파크2차,30대,남자,자가 거주,기혼,5,"가성비, 시설, 초역세권, 주변환경, 각종 관공서, 등등 서울에 이런 조건이면서 이 가격인 아파트 있으면 추천 바랍니다.",5,"지하철 1호선 금청구청역 도보 2분거리에 있어 초역세권이고, 서부간선도로, 강남순환고속도로, 시흥대로 진입이 용이해서 어디든 편리하게 갈수있습니다.",5,"3차 아파트 지하에 롯데마트가 도보 2분거리에 있어 매우 편리합니다. 단지내에도 cu, gs25편의점이 있어서 새벽에 맥주 사러갈때 좋습니다. 그 외에 시흥 홈플, 독산홈플이 차로 5분거리, 빅마켓이 8분거리, 이케아, 코스트코가 15분거리에 있어 쇼핑을 하기에는 환상적인 곳입니다. 가까운 영등포에 백화점을 이용하기에도 좋습니다.",5,"관리상태가 양호합니다. 1층에 쓰레기 분리수거장이 깨끗하고 넓게 조성되어 편리하고, 주차장도 새벽에 귀가하지만 않으면 여유있게 주차 가능합니다.",5,가장 큰 장점이 뷰입니다. 안양천이 보이는 영구 조망권은 이 가격에 이 뷰를 사울 어디에서 볼수 있을까요? 주상복합 아파트라고 겨울에 춥거나 여름에 덥지 않습니다. 그냥 일반 아파트와 거의 비슷하다고 생각하시면 됩니다.
36950,금천롯데캐슬골드파크2차,30대,남자,자가 거주,기혼,5,"가격대비 괜찮은 곳임 공원도 바로 끼고있고  먹거리 단지도 계속 커지고 사람도 많아져 점점 동네가 살아남 젊은 부부가 살기에 재밌음  가산,구로,양재 회사에 있으면 추천",5,1호선 금천구청역 그냥 바로앞  1층 문앞 버스정류장  자가면 5~10분이면 고속도로 및 외각도로..쩔....,5,3단지 롯데마트 및 먹거리 조성 단지 굿..  느낌있는 문화센터 곧 완공..  안양천 및 공원조성 굿........,5,새건물이라 부족함이 없음  주차장 넓어서 주차공간 남음  관리비는 겨울이든 여름이든 비슷한 수준으로 봐서  평균인듯,5,개인적으로 층간소음 중요한데 거의안남  (아예 없진 않지만 매우 준수한 수준 거의 못느낌)  햇빛 잘 들어옴 안양천 뷰가 매우 만족
36950,금천롯데캐슬골드파크2차,40대,여자,자가 거주,기혼,5,교통 최고.다양한 버스노선과 바로앞 금청구청역. 신안선도 착공. 금청구청역사 리모델링 올해 착공예정 등 개발호재만 남이있는 지역. 냉난방도 탁월. 아파트 구조도 굿!!,5,도보로 5분안에 금천구청역이용. 도보로 5분내 다양한 노선의 버스 이용가능해서 매우 편함. 여의도 등 출퇴근 매우 편함,5,초품아. 5분거리 롯데마트이용가능. 매일 슈퍼들리듯 슬리퍼 끌고 하루에 몇번씩 방문. 먹거리 풍부. 시장도 가깝고 홈플러스. 롯데빅마켓등 매우 살기 좋음. 병원들도 밀집해있고 종합병원도 들어올 예정이라 앞으로 더욱 발전될 동네.,4,지하주차장의 넓은 공간에서 주차관리. 경비아저씨 24시간근무하여 아파트 내 안전관리 만족. 공동현관출입통제. 무인택배서비스 등 아파트 관리 효율.,5,서울 서남권의 랜드마크답게 조망권이 최고!  바로 앞 금청구에서 운영하는 공원이 조성되어 있어 평화로운 주말나들이를 가족단위로 할수 있어 주거 환경으로는 최고. 신설 초대형아파트단지라 깨끗한 신도시분위기에서 생활 가능.
36950,금천롯데캐슬골드파크2차,30대,남자,전세 또는 월세,기혼,5,"직주 근접 .대형 마트 ,초품아 ,금나래 공원 등 아이들 키우기에 부족함이 없다. 올해 신안산선과 금천구청역 리뉴얼만 제대로 이루어지면 신길 뉴타운 과 비슷해 질 것으로 보인다. 여의도나 서울역으로 출퇴근하는 맞벌이 직장인에게 강추한다.",5,서울역 출근시 급행열차타고 출근하면 2정거장 20분 소요되고 퇴근시 1정거장이라서 15분 소요된다 직주근접 만족도 200퍼샌트,5,작년 12월 오픈한롯데마트 도보 5분거리 에 있도 홈플러스 이마트 모두 차량으로 10분거리에 있으며 바로 앞 금나래 공원에서 아이들과 놀기 좋다.,4,보안 철저히 관리되고 있으며 무인택배함도 있어서 안전하다. 지하주차장도 넉넉해서 주차 스트레스 전혀 없고 비교적 깨끗하게 관리 되고 있다.,5,신축 아파트 라서 층간소음이 심하지 않고 남서향이라 오후에 안양천 방면바라보며 석양을 감상할수 있다. 2층 상가에 학원가와 키즈카페 등 상업시설도 충분하여 단지내에서 웬만한 부준은 해결 할수 있다.
36950,금천롯데캐슬골드파크2차,40대,남자,자가 거주,미혼,4,마트도5분거리안에있고 바로금천구청뒤쪽에 자전거를무로료대여해줘서 타는곳이있고 안양천이있다. 안양천에서자전거타고몇분가다보면 한강이나온다. 굉장히 좋고 아침에운동하기도좋다.,5,금천구청역이5분이면충분히걸어갈거리다. 마을버스도여러개있어서 간편하다,4,먹거리가많고 홈플러스가있다. 아이들이놀수있게 공원도있다.,4,청소도 꾸준히하시고 입구쪽에 쓰레기도없다 공원도 청결하고 안전하다,4,아이들이 많이사는데 층간소음이 별로 없어서 좋다. 난방은 약간쌀쌀하긴하다.
20055,광명신촌휴먼시아1단지,30대,여자,자가 거주,기혼,5,동네도 조용하고 정비가 된지 15년이내라 정돈이 잘되어 있어 살아보니 더 좋아서 추천함 교통편 학군등 단점이 크게 없이 장점이 더 많음,5,1호선 금천구청역이 도보 15분이내에 있고 버스로 30분이면 2호선 구로디지털단지역 자차는 서부간선도로 지하화로 성산대교가 20분정도면 갈수있고 강남도 강남순화로도 넘어가면 30분이면 갈 수있다 양재역 직행버스가 있어 30분이면 감 광명역이 있어 지방 다닐 때 편리하며 자차로 지방 다닐일이 있어도 고속도로로 바로 빠지고 들어와 편리함,5,차로 5분 소하상업지구에 대형마트 이마트가 있고 아파트 정문에 롯데슈퍼 정문 후문에 야채가게 있음 장보기 편함 안양천 산책로와 한내천 산책로 원하는대로 산책 가능함,5,단지 청소나 아파트 관리는 큰 불편함없이 잘 되어있음 전체적으로 단지가 고즈넉하니 조용하고 크게 문제되는 부분이 없음,5,아파트 총 층수가 낮고 동간 거리가 멀어 정남향에 일조량이 좋아 냉난방효율 좋음 관리비가 많이 나오지 않음
