danji_id,danji_name,age,sex,residenceType,married,totalScore,totalDesc,trafficScore,trafficDesc,aroundScore,aroundDesc,careScore,careDesc,residentScore,residentDesc
1506,명일지에스,40대,여자,자가 거주,기혼,5,주변에 재건축된 아파트가 주변 환경이 깨끗하다  주변시세에 비해 가격이 저렴하다,5,"잠실도 강남도 경기도 하남시도 대중교통으로 30분 정도면 충분하고  지하철, 버스정류장이 가까이에 있다  지하주차장이 있어 눈이 와도 비가 와도 걱정 없다",5,"걸어서 3분 거리에 시장이 10분 거리에 홈플러스, 이마트가 있다  주변에 나무도 많고 공원이 많다",4,관리가 잘돼 깨끗하다  경비아저씨들께서 아이들 얼굴도 잘 기억해 주시고 매우 친절하시다 택배도 경비초소 한편에 모아두는 곳이 있어 분실 걱정 없다  관리비 저렴하다,4,따뜻하고 소음 거의 없다  창문과 베란다를 열면 환기도 잘 되고 시원하다  102동 동향은 경치가 좋다 (한영외고 쪽 까지 쭈~~~ 욱 시원하게 보인다)
1506,명일지에스,30대,여자,전세 또는 월세,기혼,4,솔직히 아이 키우는 집에서는 이만한 아파트가 없다. 특히 30평대 아파트가 더 좋을듯하다. 지하주차장도 굉장히 메리트 있다. 90년대 지어진 아파트지만 튼튼하고 살기 좋아서 적극 추천한다. 나는 1년 넘게 살아보고 있다,5,지하철역이 도보 5분 거리이고 집 앞 버스 정류장까지는 3분도 안 되는 거리므로 교통편이 매우 편리하다. 특별히 교통편에서 불편한 점을 전혀 느낄 수 없었다.,5,바로 앞 전통시장 및 식자재마트 혹은 근처 홈플러스 gs마트가 있기에 너무 편리했다. 집 근처에는 작은 공원 및 경찰서 우체국도 있기에 생활하기에는 아주 적합하다. 하지만 나무가 많이 심겨 있지 않아 공기는 좋지 못한듯하다.,5,엘리베이터를 새로 설치하여 안전지수가 높아졌다. 또한 관리비가 그리 비싸지 않고 경비 아저씨님들도 친절하시다. 택배도 잘 맡아주시기에 부재중에도 안심할 수 있어서 나 역시 만족한다.,4,아파트 방향을 잘 선택해야 한다. 나는 서향이라 어두워서 아침부터 저녁까지 불을 켜고 생활한다. 층간 소음은 그리 심하지 않은 것 같다. 아니면 동 주민끼리 서로 조심하는 분위기라 그런지도 모르겠다.
1506,명일지에스,30대,여자,자가 거주,기혼,4,아이들 학교와 공원 마트 도서관 시장 등 모두 가까워서 생활에 매우 편리하다  주변 아파트에 비해 시세도 저렴하고 이미 재건축이 된 것이라 동네에서는 신축이다.,4,5호선 명일역 평지 4분 거리  단지에서 1분만 나오면 잠실 등으로 나가는 버스 노선도 다양하다.,5,"단지 바로 앞에 구립 수영장 도서관이 있고 우체국 주민센터 치안센터도 다 같이 있어서 편리하기도 하고 안정감을 준다.  단지 바로 앞 마트와 재래시장도 잘 관리되어 있고, 도보 10분 이내로 홈플러스 이마트도 이용 가능하다   아이들이 많이 사는 곳이라 그런지 유해시설이 없다.  주변이 다 평지고 공원이 많은 동네라 만족도가 높다.",3,무인 택배함은 없고 경비실 앞에 택배가 쌓여있는 구조다. 지상에도 주차가 가능하지만 지하주차장이 넉넉하고 집과 엘리베이터로 바로 연결되어 불편함은 없다.,3,복도식 아파트라 한층에 여러 세대가 살지만 특별히 시끄럽다고 느끼진 않는다  앞이 다 트여있어서 답답한 느낌이 없어 좋다
1506,명일지에스,20대,여자,자가 거주,미혼,5,"저는 강동구에서 초등학교 때부터 성인이 된 지금까지 살고 있는데요~ 주공 3단지, 삼환, 9단지 등 여기저기 겪어봐도 명일엘지가 제일 좋은 것 같아요. 시장도 가깝고요. 추천입니다!",5,버스정류장과 전철역이 가까워서 좋습니다 버스 조 다양한 노선 많이 다녀요. 경기버스는 새벽 1시 넘어서도 다니고 늦게 다녀도 걱정 없습니다 (물론 막차),4,"집 주변에 편의점, 마트가 가까이 있습니다. 대형마트 (홈플러스 등)는 걸어서 10분 정도 거리에 있어요~ 아파트 앞에 주민센터, 놀이터, 파출소 있어서 좋아요!",5,경비아저씨들께서 늘 성실하게 활동해주셔서 깨끗합니다. 특히 택배도 호수 적어서 경비실 안에 잘 보관해주세요! 정말 좋아요!,5,볕도 잘 들고 냉난방도 문제없습니다. 최근에 엘리베이터도 바꿔서 아주 좋네요
1506,명일지에스,40대,남자,전세 또는 월세,기혼,3,살기 좋고 대중교통도 좋고 가까이에 마트 대형병원들이 있어 전반적으로 좋다. 다만... 주차문제 때문에 점수가 확 떨어짐,3,"도보 1분 거리에 버스정류장이 있고, 도보 5분 거리에 명일역이 있어 대중교통은 훌륭함. 그러나 주차 공간이 워낙 적어서 매일매일 주차 대란.",4,도보 7분 거리에 홈플러스 도보 10분 거리에 이마트. 도보 12분 거리에 경희대병원. 걸어갈 수 있는 거리에 마트 병원 운집,3,"엘리베이터가 새 거이며, 청소도 잘 돼있고 연식에 비해 관리가 잘된 편임. 그러나 주차문제 심각",5,일조량은 주변에 큰 건물이 없어서 아주 좋다. 개별난방이라 편리하다. 주변 노후 아파트들이 모두 중앙인데 비해 비교 우위
1506,명일지에스,40대,여자,자가 거주,기혼,4,학군도 좋고 주변 아파트에 비해 시세도 낮고 시장 바로 옆에 있고 대형마트도 걸어 다니고 지하철도 가깝고 살면서 불편함을 못 느꼈다,5,지하철역 3분 거리고 버스도 잠실 하남 등 많이 다녀요 차로 이용 시 외과와 올림픽대로 춘천고속도로 등 고속도로 진입 시 최고다.,5,한마디로 주변에 없는 게 없다  대형마트 도보로 이용 가능하고 바로 옆 시장 있고  주로 최고인 듯싶다,4,공용현관이 없어서 불편하다  이곳은 출입구가 많은 게 장점이자 단점이다,3,끝쪽 집 끝쪽 방은 추워요  난방이 잘 안 되는 거 같아요  난방 바는 저렴하게 나오는 듯  주변이 트여서 가리는 거 없어서 일조량 좋아요
1506,명일지에스,40대,여자,자가 거주,기혼,4,"교통이 편리하고 각종 편의 시설(시장, 우체국, 주민센터, 병원) 이용이 편리하여 본 아파트에 거주하고 계시는 입주민들은 만족도가 높은 편이다. 단, 700세대가 101동과 102동 2동으로 나뉘어있어 아파트 설계 구조가 조금 복잡한 것이 단점",4,"명일역 도보 5분 거리로 인해 서울 중심부로 이동 이용 이하며 고속도로 ic가 근접함으로 여행이나 각종 행사 시 쉽게 진출할 수가 있다. 단, 집 앞 단지에 대형 교회(명성교회)가 있어 주말에 혼잡함을 유의",5,"굽은 다리역에 홈플러스, 고덕역에 이마트, 천호동에 2001 아웃렛, 현대백화점이 근접해 있으며 최근에는 하남 스타필드도 차량으로 20분이면 이동 가능해 신세계백화점과 트레이더스도 이용하고 있다.  한강도 가까운 편이며 집 근처에 근린공원과 청소년회관등 저렴하게 이용 가능한 스포츠 시설이 많이 있다",4,"경비실에서 택배를 잘 받아주시며  계절마다 조경에도 신경 쓰심. 현재는 감나무에 감이 예쁘게 매달려 있음  아파트에 차단기 설치로 외부차량 접근을 막아줌  단, 복도식 아파트라 전단지가 자주 붙어있음",4,우리가 거주하는 집은 동남향이라 햇빛도 잘 들어오고 통풍도 잘되나 복도식이라 비가 오면 물이 들이치는 단점이 있음  집 앞에 시장과 동사무소 놀이터 우체국 등 편의 시설이 가까이 있어 살기 편함
1506,명일지에스,30대,여자,자가 거주,기혼,5,시장과 관공서가 가까워 생활하기 편리하다. 근처 지역 아파트 중에는 지하주차장이 있어서 차를 깨끗하고 안전하게 보관할 수 있다. 지하철역과 버스정류장도 가깝다,4,명일역에서 가깝고 버스정류장 또한 가깝다 단지 강동구는 지하철 5호선이 두 갈래로 나뉘어서 지하철 대기시간이 길다,5,바로 앞에 명일시장이 있어 장보기가 편하고 도보로 홈플이나 이마트도 갈 수 있다. 동사무소와 파출소 우체국 또한 바로 앞에 있어서 일 보기가 수월하다.,4,20여 년 된 아파트치고 깨끗하다. 다만 잡상인들 출입이 잦다,5,조용하고 앞뒤로 확 트여있어서 전망이 좋다. 여름에도 바람이 잘 불어서 시원하다.
1506,명일지에스,20대,남자,자가 거주,미혼,3,살기는 좋지만 명성교회 때문에 여러 불편함이 있음.. 다만 주변 환경은 매우 좋음,4,지하철이 5호선 밖에 없음.. 강남으로 가려면 천호에서 갈아타고 잠실에서 갈아타야 됨,5,마트와 경찰서 동사무소 지하철이 가깝고 영화관도 가까움. 주변에 학교가 많아서 치안도 좋고 교육열도 좋음,2,복도식 아파트라 계단식보다 불편함.. 계단식으로 되어있으면 좋았을 거임 다른 건 다 좋음,3,명성교회라는 큰 교회 때문에 조금 소란함.. 일요일에는 교통대란이 있고 사람도 많아짐
1506,명일지에스,30대,남자,자가 거주,미혼,5,최대 장점은 그래도 교통이다  고속도로도 가깝고 대중교통이 꽤나 편하다 다만 명동 등의 중구 쪽은 버스가 없다   주변 상가 등으로 병원 의류 슈퍼 등 거주하기에는 부족함이 없는듯하다,5,서울 어디든 거리가 좀 있어서 시간은 조금 걸리지만 교통이 편리하다  지하철은 5분 거리 버스는 3분 거리 안에 있어서 어디든 대중교통으로 이동이 가능하다  명일동 LG아파트의 최대 장점 중 하나이다,4,주변 공원이 몇 개 있고 가까운 곳에 예술센터가 있어 꽤나 만족스럽다   주변 나무도 많으며 벚꽃축제 시기에는 근처 삼익가든 아파트에서 큰 축제를 열기도 한다,3,단지가 커서 보안상의 문제는 존재하는 것 같다  실제로 자전거를 잃어버린 경험이 있다   단지 내 청소나 조경 등의 문제는 부지런하신 경비아저씨가 해결해주지만 보안의 문제와 근처 거대 교회인 명성교회 때문에 발생하는 주차문제를 제외하고는 만족스럽다,4,일조량의 경우는 단지의 위치에 따라 다를듯싶다  우리 집은 남향이라 안방 거실은 볕이 잘 들어온다  단지의 구조상 (101동) 중앙은 볕이 1도 안 들어오기에 상당히 별로다...   아파트 내 놀이터 역시 노후화되어 이용하는 어린이는 별로 없다 하지만 바로 앞 괜찮은 놀이터도 존재한다
1506,명일지에스,20대,여자,자가 거주,미혼,4,우선 교통편이 좋은 편이고 주변에 생활환경으로는 더없이 좋은 편이다. 그러나 환경이 좋은만큼 아파트 가격이 조금 비싼 편이다. 그래도 살기는 좋은 편이어서 별 4점을 주고 싶다.,4,"명일역 도보 5분 거리이고, 굽은 다리역도 도보 8분 거리이며 잠실, 강남으로 가는 버스도 많다. 그렇지만 광화문/종로 쪽에서 오는 버스들은 없어서 불편한 점이 있고 주변에 명성교회가 있어 주요 요일 교통이 불편하다.",4,"도보 510분 거리에 홈플러스, gs슈퍼마켓, 큰 슈퍼마켓 등이 있고 편의점 또한 510분 거리에 10개 정도의 편의점이 있다. 주변에 공원도 있고 집 앞에 명일 전통시장이 있어 편리하다.",3,보완은 조금 부족한 편이다. 현관 비밀 번호가 없고 아파트 자체가 너무 커서 출입구가 많아서 그것 또한 위험요소라고 생각한다. 택배 역시 경비실에 맡겨질 경우 단지 내 사람이 너무 많아 제대로 관리가 안 되는 경우도 있는 것 같다.,3,겨울에는 난방을 좀 트는 편이고 여름에도 에어컨을 켜는 편이며 일반적인 한국의 날씨의 흐름과 같은 것 같다. 층간 소음이 있어서 불편한 점이 많았고 신경 쓰였다.
1506,명일지에스,20대,여자,자가 거주,미혼,4,진짜 웬만한 곳은 다 대중교통으로 이용할 수 있습니다. 명일역이 약간 서울 끝이어서 나가는 데에 시간이 오래 소요될 뿐 정말 좋습니다. 복잡한 동네도 아니고 저는 될 수 있으면 오래 이 동네에서 살고 싶습니다. 엘지아파트가 아니어도 삼익이나 가까운 아파트들도 추천합니다. 살기 정말 좋아요 진심... 강추,4,살면서 엘지아파트의 최고의 장점은 교통편이라고 감히 이야기할 수 있습니다. 버스 정류장도 매우 가까운 곳에 위치하여 수많은 서울버스와 경기버스들이 다니고 지하철도 5-10분 거리에 위치하여 걷기에 유리합니다. 단지 주말에는 유동인구가 많아 차량으로 이동시에는 시간대별로 막힐 수 있습니다,4,"최근에 굽은 다리역 쪽에 있는 홈플러스에 CGV가 들어오고 맥도널드가 생기고, 버거킹도 근처에 있고 사실상 스타벅스만 입점한다면 웬만한 번화가 부럽지 않습니다. 화장품 가게들이 줄을 서있고 웬만한 편의시설은 다 가깝다고 보시면 됩니다",4,경비아저씨들이 늘 상주해계시고 최근에 엘리베이터도 교체하여 이동시간이 단축되었습니다. 그리고 택배도 경비아저씨들이 늘 맡아주시고 체크해야 가지고 갈 수 있는 체계적인 시스템으로 바뀌었습니다. 또 단지 조성도 깨끗하게 잘 되어있고 매주 일요일마다 재활용품을 버릴 수 있습니다,4,아파트 자체가 ㄷ자 모양이라(102동) 복도에서 집 안이 보일 수 있습니다. 층간소음은 심한 편은 아니지만 아이들이 꽤 많이 거주하고 있습니다. 지하주차장이 있어 소리가 날 수 있지만 거주하기 힘든 정도는 아닙니다. 그렇지만 단지가 101동과 연결되어있지 않고 단독 아파트와 같습니다. 그래도 접근성이 용이해 매우 추천해드립니다
867,길동우성,30대,여자,자가 거주,기혼,4,"리모델링 시공사 선정중입니다 현재도 교통이 편하고 살기 좋지만 9호선 착공 및 개통, 세종 고속도로 개통 및 5호선 직결화 등 각종 호재가 있어 매매를 한다면 주변 아파트에 비해 가격이 눌려있는 지금 추천합니다 다만 오래된 아파트 특유의 낡음이 있어 별점 1점 뺐습니다",5,길동역 도보 7분-10분컷 9호선 4단계 길동생태공원 개통 시 도보10분 컷입니다. 바로 앞에 버스 정류장 있고 서울-세종 고속도로 빠지는 IC도 근방에 있어요,4,"마트, 시장, 우체국, 강동구도서관, 초등학교 모두 도보 5분 내에 있고 길동역 근방에 병원, 상가등이 즐비하게 있어요",4,걍비아저씨들 성실하게 잘 해주세요 관리비는 평이한 수준입니다 평범한 수준입니다 . 특이점 없음,4,남향과 동향이 반반씩 있습니다. 나무 조경은 요즘 새아파트처럼 멋들어지진 않았지만 소담한 맛이 있습니다 따뜻하고 환기도 잘 되는 편입니다
867,길동우성,50대,남자,자가 거주,기혼,5,"길동초. 길동역이 가깝고 외부로 나갈때 상일IC가 가까워 교외이동이 쉽다. 이마트, 천호백화점이용 가능하고 도서관, 우체국이 바로 옆에 있다.",5,"5호선 길동역이 가깝고 버스정류장,공항버스탑승도 옹이하다.상 일IC가 가까워 영동전이나 춘천.속초등 교외로 나갈때 용이하다.",5,인심좋은 전통시장에서 저렴한 물건과 아채등을 구입할 수도 있고사람들이 붐비는 모습을 볼수있다.강동우체국이 바로 앞에 있고 강동도서괸도  후문쪽에 있다,5,청소상태가 양호하고 봄이면 벚꽃목련등 다양한 꽃이피고 택배는 부재시 경비실에 맞기면 추후 수령가능하고 아저씨들이 친절하다,4,여긴 남향이라 일조량이  우수하고 빛이 잘 들어오기에 살기편함. 저층은 어디나 마찬가지로 약간 저렴하면서 야칸의 층간소음이 있을수있음.
867,길동우성,30대,여자,자가 거주,기혼,5,"유아와 초등학교 자녀를 둔 가정, 노부부들이 살기 최적의 장소입니다. 시골처럼 동네 분들의 오고가는 정이 있습니다.",5,길동역과 일직선으로 뻗어 가깝고 천호대로에 위치한 버스를 타기도 유용합니다. 상일ic 서하남ic와 가까워 교외를 가기 편리합니다.,5,복조리 시장이 1분거리에 위치하고 있어 식사를 준비하다가도 재료가 없다면 어떤 재료든 나가서 사올 수 있습니다. 강동도서관이 1분거리에 있어 애들을 잠시 집에 두고 뛰어서 다녀올 수 있습니다. 길동초 역시 1분거리에 있어 등하교가 특히 편합니다.,5,단지를 청소하시는 아주머니 친절하십니다. 경비하시는 분들도 다정합니다. 서울시형리모델링 시범단지에 선정되어 잘 진행되고 있습니다.,5,다른 아파트들에 비해 넓게 빠졌습니다. 서비스 평수가 많아 다른 아파트 30평대에 비해 큽니다. 이곳 살다가 다른 30평대 가려면 좁다고 느껴집니다.
867,길동우성,30대,여자,자가 거주,기혼,4,"아이들이 어리다면 주변어린이집  유치원이 근거리에 많아 좋고,중고등자녀가 있다면 비추,은퇴한 어르신들 사시기엔 최적.생활편의시설이 왠만한건 다있어서 편함.하지만 오래된아파트가 갖고있는 누수,방음,수리가필요한단점이 있어 4점",5,"길동역 도보5분이면되고,버스정류장 주변에많고,경기하남,잠실까지 차로15분이면 들어갑니다.",3,"아파트단지가 작은편이라 산책이나 공원을가고싶으면 10~15분정도 걸어서 일자산공원으로 가야한다.차로가도 되긴한데..단지인근에 공원이나 산책로가 붙어있진않다.편의점 슈퍼마트는 넘처나게 많은편, 지하철역 두정거장이면 천호현대백화점,이마트가 있다.굽은다리역홈플러스가 있다.",3,"아파트가 외래되다보니 유지보수에 신경쓰고있다.공용현관비밀번호식이 아니라 외부인출입이자유로운게 큰단점,관리비저렴,단지는 깨끗하게 관리되는편,주차장협소,밤에는 몇바퀴를 돌아찾아야함.",3,"층간소음 있고,일조량은 층별동별 차이가 많다.중층남향집은 바람이나 일조량은 좋은편.냉난방비는 타아파트에비해 적게나오는수준."
867,길동우성,30대,남자,자가 거주,기혼,4,인근 아파트 시세보다 저렴 신혼부부 어린 아이 있는 부부 추천 자녀 출가시킨 부부 추천,5,5호선 길동역 5분거리  버스 노선도 다양  중부고속도로 영동고속도로 서울외관순환도로  접근성 용이,4,길동생태공원 근접 일자산 공원 근접 허브공원 근접 일자산캠핑장 근접 길동 초등학교 바로 앞 강동 도서관 바로 앞 홈플러스 지하철 한정거정 거리 길동 재래시장 인접 강동 성심병원 근접,4,어린이집 단지내 있음 놀이터 시설 양호 주차 공간도 지상 지하 양호 동별 관리소 운영 택배 수거 용이함,3,층간 소음 약간 있음 동에 따라서 우체국 근접동 재래시장 근접동 소음 있음
867,길동우성,30대,남자,자가 거주,미혼,4,놀이터와 지하 지상주차장이 있어서 좋고 주변에 마트 편의점 등 여러 환경이 편하다,4,버스정류장까지 5분 지하철역까지 10분이니 이동하기 쉽다,3,주변에 마트 편의점 학교 공원 등이 있이서 좋다 그리고 바로 앞에 시장이 있기에 장보기 수월하다,3,오래더ㅣㄴ 아파트 치곤 깔끔하고 주기적으로 청소를 해주셔서 보기좋다,4,베란다를 없애니깐 더 넓게 사용할수이ㅛ어서 좋다 근데 몇몇층은 복도 불이 꺼져있어 밤이 되서 어두워지면 조금 으스스한 느낌이난다
867,길동우성,20대,여자,자가 거주,미혼,5,아파트 근처에 시장이 있어서 편하고 근처에 지하철역과 버스 정류장이 있고 조금망 걸으면 대형 마트도 나오고 고속도로도 근처에 있어서 경기도로 나가기 편하다 교통이 괜찮은거 같다 그리고 주변에 학교도 있어서 학교 보내기에도 편하기 때문에 5점을 주었다.,4,길동역이 있고 버스 정류장이 근처에 많아 어디 돌아다니기에도 편하고 여러 곳을 가기에도 편하다 주차장이 많이 없어서 주차하기 불편할 수 있지만 대중교통을 이용하면 되기 때문에 편하다,4,마을 버스나 그냥 버스를 타면 이마트를 갈 수 있고 10분만 걸으면 홈플러스가 있고 근처에 시장도 있고 길동 생태공원 허브공원이 있어서 운동하기에도 좋고 시장에는 좋은 물건이 많아서 좋고 아파트 안에 어린이집이 있어서 좋다,4,단지 청소는 청소 해주는 분이 있어서 깨끗하고 공용현관 비밀번호가 없어서 안전에는 문제가 좀 있다 하지만 경비 아저씨도 친절하시고 택배 맡기기에도 의외로 안전한거 같아서 편하게 오랫동안 살고있다,4,내가 사는 집은 베란다가 넓어 밖에 물건을 놓기에도 편하고 이용하기도 편하다 하지만 가끔 윗층에서 물건 이동하는 소리가 나서 조금 시끄럽지만 나도 가끔 그래서 이해는 한다 아파트라 그런지 뛰어다니지 못하는게 문제이다
867,길동우성,30대,여자,전세 또는 월세,기혼,4,"단지 바로 앞에 재래시장이 크게 있고, 얼마전 재래시장을 정리해서 더욱 깔끔해지고 물가도 저렴하다. 단지 바로 앞에 초등학교와 도서관이 있어서 좋고, 지하철 버스 노선이 참 다양하다. 오래된 아파트라 재건축 얘기가 돌고 있어서 집값이 많이 올랐지만 주변보다 저렴하다.",4,"길동역 5분거리이고, 시내, 시외버스노선이 매우 다양해서 이동이 편리하며 자가 이용시에도 외곽도로, 올림픽대로 이용이 용이하나 천호 주변과 하남ic부분의 정체가 있다.",4,"단지잎에 재래시장이 있어서 물가가 저렴하고, 도서관과 초등학교 우체국이 단지 앞에 있다. 바로 앞에 공원이 있는건 아니지만 자차 10분내외로 올림픽공원에 갈 수 있고, 더 작은 공원도 여러개가 있어서 아이와 산책하기 참 좋다.",4,택배를 경비초소 앞에 모아두는데 잃어버린적은 없지만 살짝 불안 할 때가 있다. 계단형과 복도형이 집 크기에 따라 있고 관리비는 보통 수준이지만 친절하고 아파트치곤 사람냄새 나는 따뜻한 곳이다.,3,"오래된 아파트라 일자구조이고, 작은평은 따로 거실 안방을 구분지으면 답답해서 보통 거실과 안방 중간에 방문을 없애 트고 지내서 불편하다. 베란다 양쪽으로 수납공간은 넉넉하고 층간소음으로 불편을 겪은적은 없다. 복도식이라 작은방은 사람들 오가는 소리가 다 들린다."
867,길동우성,20대,여자,전세 또는 월세,기혼,5,대체로 행복했던 기억이 많구  편리하다 살기 좋음   관리비가 싸다고 하심,3,지하철역이 조금 멀지만  마을버스 가까움   버스도 대체로 탈만하다,5,편의점도 가깝고 시장도 가깝고   도서관 마트 모두 풍족하서 좋음,5,관리아저씨가 친절하고 좋으심  조경에도 신경 써서 봄마다 넘 행복하다,3,아이들이 놀이터에서 소리치는게 넘 시끄럽다  단지가 겹겹이 있어서 조용하고 좋기도 하다
867,길동우성,30대,여자,전세 또는 월세,기혼,3,편리한 교통과 재래시장은 늘 주변 지인들에게 자랑하는 것 중에 한가지 이다. 그래도 장점보다는 단점이 많기에 적극 추천을 하진 않을듯하다.,5,"5호선 길동역이 도보로 5~6분이고 버스도 하남시에서 나오는 버스, 종로구니 중구쪽으로 가는 버스들이 있어 매우 편리하다 또한 고속도로 접근도 편리해 여러가지 측면으로 교통은 아주 잘 되어 있다",4,백화점이니 마트는 도보로 이동은 조금 멀지만 주변에 가장 좋은 건 재래시장이 있다는 점이다. 값싸고 질 좋은 물건들이 많다. 도보로 조금 멀지만 근처에 허브공원 일자산공원 생태공원이 있어 날씨 좋을때는 아이들과 놀러 나가곤 한다.,2,외부인이 쉽게 주차를 할 수 있다. 돈들여 설치한 주차 차단기는 무용지물인것 같다. 또한 외부인의 접근도 너무 쉽다. 잡상인들의 잦은 출입은 생각 보다 많은 스트레스를 기져온다  청소도 아주 쾌적하게는 하지 않는다.,3,오래된 아파트다보니 방음은 물론 단열도 잘 되지 않는다. 다행히 살고 있는 집은 남향이라 햇빛이 잘들어와 다른 집들에 비해 따뜻하긴 하다. 층간 소음 뿐만 아니라 외부 소리도 잘 전달되어 신경쓰인다.
