danji_id,danji_name,age,sex,residenceType,married,totalScore,totalDesc,trafficScore,trafficDesc,aroundScore,aroundDesc,careScore,careDesc,residentScore,residentDesc
814,아남,20대,여자,전세 또는 월세,기혼,3,한마디로 주변 아파트들 중 싸고 그럭저럭 살 수 있는 아파트들이다.,4,암사대교로 인해 아파트 앞 차가 빨리 달리지만 역세권이고 집앞에 버스 정류장이 있는것도 좋다,5,"아파트 어느 동이나 5분 내로 위치한 아파트 상가애 슈퍼가 있고, 뒤에 생긴 래미안힐스테이트 아파트가 공원같이 생겨 가볍게 산책도 할수있고 한강공원도 가깝다. 하지만 큰 마트나 편의점(gs슈퍼마켓 등)에 가려면 10분정도 걸어야 하고, 집 앞에 대형마트(e마트 등)가 있으면 좋겠다.",5,관리는 그럭저럭 돌아가서 만족 하고 경비원 분들도 친절하시다. 다만 아파트 차단기 문을 열 때 쉽게 열어주지 않아서 집을 방문하는 이들이 하나같이 불편하다구 입을 모았다,3,"화장실 난방이 안 되어 겨울에 샤워를 할때 늘 춥고, 꼭대기층이다 보니 여름엔 덥고 겨울엔 춥다. 양옆에 있는 아파트가 모두 2010년대 이후 지은 아파트 들이다 보니 아파트 외관이 상대적으로 지저분하다."
814,아남,30대,여자,자가 거주,미혼,2,위에 기재한 조건들로 그닥 추천하지 않는다.다른곳에서 사세요~~~,3,마을버스만 아파트 앞에 정차하고 일반 시내버스는 명일역 부근에만 정차 하기에 교통편이 불편하다.,2,편의점에 가려면 걸어서 10분정도 가야있고 단지 앞에 작은 슈퍼가 있긴 하지만 24시 영업이 아니라서 밤늦게 이용할수가 없다.,3,"단지 안은 깨끗한 편이나, 출입통제는 딱히 이뤄지지 않고 있다.택배보관은 해준다.",3,겨울엔 보일러 가동하면 집 안 전체가 따듯하다. 방음처리가 그닥.. 층간소음이 있다.
814,아남,30대,여자,자가 거주,미혼,4,"교통편도 괜찮고, 상가에 슈퍼도 있어서 편하다. 아이 키우는 사람들은 아파트 내에 유치원이 있어서 좋을듯. 주변에 학교도 많다.",3,"마을버스거 있어서 명일역, 암사역으로 이동이 가능하다. 구리암사대교가 바로 앞에 있어서 자가용을 갖고 나가면 바로 올림픽대로를 탈 수 있으며, 중랑구로 빠른 이동이 가능하다. 2312번 버스도 바로 있어서 중랑구꺼지 이동이 편리하다.",3,"편의점, 약국이 근처에 없어서 급할 때는 불편하다. 뒷편에 고덕래미안힐스테이트가 생겨서 원하면 그쪽 상가로 가면된더. 그래도 아남 상가에는 슈퍼가 있어서 웬만한 물품들은 다 살 수 있다. 공원은 걸어나가면 까치공원이 있고 주변 아파트들에 녹지가 잘 조성되어 자주 산책간다.",4,단지내는 깨끗하다. 경비아저씨들이 잘 관리해주신다. 주차장은 지하에 있어서 편하다. 택배는 부재시에 경비실에 맡길 수 있어서 좋다. 다만 1층횬관 인터폰에 카메라가 없이 소리만 된다는게 아쉽다.,4,냉난방은 개별난방이라 조절 가능하다. 햇빛은 베란다를 통해 어느정도 들어와서 어둡지는 않다. 층간소음은 평소에는 잘 없는데.. 윗집 아이들이 뛰거나 물건을 떨어뜨리면 쿵쿵 소리가 나서 신경쓰인다.
814,아남,30대,여자,자가 거주,기혼,5,"가까이에 대형마트가 많으며 교통편 (지하철,버스)가 잘 되어있어서 편리항",5,"바로 앞버스정류장   걸어서 가능한 명일역  버스로 4,5정거장 암사역",5,명일역근처 gs마트 뒤로 농협마트가 있으며 근처에 이마트 홈플러스 등이있음.,5,매일청소해주시는분이 계셔서 단지가 깨끗함  공용현관비밀번호가 각집마다 다름,5,베란다가 넓고 양쪽창문이 있어 여름에 시원하며 겨울에는 개별난방을 사용함
814,아남,30대,남자,전세 또는 월세,미혼,3,대중교통은 중간 육아환경 매우 만족  주변 아파트가격이이 대비 저렴  노후아파트라서 기타편의시설은비추천,3,아직까지 지하철이 아파트 근처에없어 서버스 이동후 전철이용해야함 버스도많이있지않아서대중교통은불편하나 자가이용은잠실도가깝고좋다,3,아파트주변은 한참공사중이고강동구끝이기때문에 큰건문이나 마트는 좀더 나가야함 하지만버스이동시 용마산쪽에시장과 근처 2정거장안에 마트가있다,5,단지관리는 안심이다 우선 외부인이많이들어오지않고 아파트입구에서 중앙통제를하기때문에 아이들키우는데도움이된다,5,아파트가오래되서 노후된거만빼고는 시설이나 위치등앞으로개선될여지가많다 학교도주변에많아서 하군때문에라도 많은사람들이이사온다
814,아남,20대,남자,전세 또는 월세,미혼,3,교통편은 좋지만 아파트가 노후된 측면이 있어서 3점을 줌,4,단지 입구에 버스정류장이 바로있고 명일역도 도보10분 거리에 있음,4,"편의점이나 gs마트가 역 근처에 있어서 버스를 타면 5분, 걸어서 10분이면 갈 수 있음  공원은 멀리있고 산책로는 옆에 있는 고덕산을 이용할 수 있음",4,단지는 깨끗하고 출입시 차는 주민은 등록해놓으면 게이트가 바로 열리고 외부인은 방문증을 작성해야함  건물은 비밀번호를 누르고 들어가게되있음  주차장은 넉넉하지는 않은편이고 택배가 없어지거나 한적은 없음,5,해가 잘들어서 여름에는 거실이 조금 덥지만 겨울에는 낮에 따뜻함  층간소음은 거의 없음
814,아남,30대,여자,자가 거주,미혼,5,"깨끗하고. 사람들 좋고. 교육 여건 좋고 주변에 학교많고 학군도 좋은편, 편의시설도 멀지않고 한강도 가깝고 바로 구리로 빠질수 있고. 나무많아 공기좋고 바로앞에 유치원도 있고",3,"지하철역이 도보 7~10분정도 걸리나 마을버스 2개의 번호가 번갈아와서 자주오고 바로 구리시로 빠지는 초록버스도 있고-,차가 있다면 좋은듯 없어도 크게 불편하지않음~ 다만 5호선 상일동행을 봐가며 타야한다는 것이 시간도 걸리고 불편",4,"슈퍼 바로앞에 상가 안에 카페, 치킨호프집, 방앗간. 김밥집과 수선집등이 있고 산책로는 코앞에 학교나 아파트단지안을 걸어도좋고 대체로 나무가많아서 그냥 어디든 걷기좋아요",5,동마다 경비아저씨가 주변환경 정리며 분리수거 등등 잘해주시고 친절하심 공용현관 번호누르고 들어가야하므로 잡상인 들어오지 않음,5,자연 냉난방 됨 그렇게 덥거나 춥지않은편이나 베란다 튼곳은 추움 햇빛 잘들어옴
814,아남,40대,여자,자가 거주,기혼,4,"자식 교육에는 적합한 단지인 듯하다. 원체 동네가 조용하고, 사람들이 여유가 있다. 가까이에 잠실도 있어서 놀러 갈 곳이 많고, 음식점이나 문화생활이 가능한 공간도 제법 있다. 주변에서 요즘 공사를 많이 해서 4점을 주었다.",4,아파트 정문에서 1분 거리가 채 안 되는 곳에 버스 정류장이 있어 마을버스와 2312 버스를 바로 탈 수 있다. 배차 간격도 짧고 역 중에 지하철 명일 역도 있어 이동이 비교적 편리하다. 하지만 고덕역 쪽으로 가는 교통수단은 조금 걸어야 한다. 그래도 앞의 도로가 올림픽대로와 이어져 있어 자가용 이용에는 편리하다.,5,"단지 내에 슈퍼마켓이 있고, 명일역 쪽으로 가면 온갖 음식점(예를 들어 아이스크림, 냉면, 중화요리, 찐빵 등) 들과 시장, 각종 가게들과 더불어 조금만 가면 홈플러스와 이마트도 위치한다. 때문에 장 보기가 편하고, 동네가 시끄럽지 않다.",3,"최근에 외부인 출입 통제(?) 검사(?)를 강화해서 조금 나아졌지만, 보안은 사실 조금 허술한 편이다. 택배를 경비 아저씨가 초소 한편에 몰아 두고 문도 열어 놓으실 때가 많아서, 택배 훔치기도 쉽겠다는 생각이 들었다.",3,"앞에 높은 아파트가 있어 햇빛이 잘 들어오지 않는 동도 많다. 층간 소음은 다른 아파트만큼 나는 편이고, 보일러는 따뜻해서 좋다. 다만 확장은 안 하는 것을 추천한다."
814,아남,20대,남자,자가 거주,미혼,5,"가까이 역이 있고 바로 앞에는 정류장이 있어 어디든 가기 용이하고 , 주변 환경에 만족하는 편이다. 가격은 어느 정도 있지만 주변 아파트들에 의해 조금은 위축되어있는 모습이지만 그와 다르게 살다 보니 정말 편한 아파트라는 것을 새삼 느끼는 부분이다.",4,집 앞에 바로 버스정류장이 있어 버스를 타면 주변에 역이나 근처 큰 마트나 대형 할인점들은 쉽게 갈 수 있다.  가까운 명일역 역시 걸어서 10분 정도에 위치해있어 부담 없이 지하철을 탈 수 있다.,4,"명일역을 기준으로 개발이 많이 되면서 대형 로드샵에서 취급하는 브랜드 올리브영, 롯데리아 , 크리스피 , 나뚜루, 엔제리너스 합쳐진 복합 건물 , 버거킹 , 주유소도 아파트 단지에 근접해 있어  여러모로 많이 안나가도 되는 좋은 위치 지형과 건물 포지션을 가지고 있다.",3,공용 현관 비밀번호가 있어 1차로 한 번 안심은 할 수 있다. 다만 아파트 도색을 1년 2년 단위로 한 번씩 하는데 지금까지 딱히 세련되었다고는 느끼지 못한 디자인 정도를 제외하면 만족하는 편이다.,4,"베란다가 있고 의외로 방음은 잘 되는 편이라고 생각하며 , 정남향 아파트라 햇빛은 정말 잘 들어온다.  아파트 바로 문 앞에 운동장과 정자가 있어 친구들을 잠깐씩 만나기도 나쁘지 않다."
814,아남,20대,남자,전세 또는 월세,미혼,5,곧 재개발될지도 몰라요.  주변에 좋고 강동구도 좋으니까 이사 가세요,4,"근처에 버스정류장이 있다.  05,03범 버스 10-15 붐 걸어서 명일 고덕역 지하철 있음",4,상가가 하나 있고 뒤에 새로 아파트가 생겨서 좋을 거라 예상됨,5,앞에 키로 보안돼있어 안전함  그리고 경비원도 있음  이중구조 좋다.,5,집은 오래됨 하지만 나름 살만하다  깔끔하지만 바퀴벌레가 나온다 조심
814,아남,20대,남자,자가 거주,미혼,3,지하철 역도 멀지 않고 버스정류장도 매우 가까이에 있지만 아파트가 오래돼서 추천은 그리 하지 않는다. ,5,마을버스가 아파트 바로 앞에 있고 지하철역도 도보로 10분 거리여서 매우 좋다.,4,"일단 주변에 산이 있어 등산을 할 수 있고, 지하철역도 가깝고 이마트도 15분 거리에 있어서 좋으나 pc방이 20분 거리로 좀 걸어야 한다.",5,"살면서 별 불편함을 못 느꼈다. 하지만 광고지는 많이 붙는 편이다. 그리고 단지마다 경비원들이 있어 든든하고, 택배를 못 받으면 경비실에 맡겨 찾아갈 수 있으니 안전하고 편하다.",3,"아파트에 화장실이 2개인 곳과 1개인 곳이 있는데 내 집은 1개다. 그래서 많이 불편하고, 다른 아파트에 비해 방음이 잘 안 되는 편이다."
814,아남,20대,여자,자가 거주,미혼,2,주변에 편의시설이없다.지하철역이 많이멀다.집앞에 버스정류장이 있지만 버스가많이없어서 불편하다.아파트상가가 많이낡았고 편의시설들이 많이없어서 불편하고 문구점이너무작아 물건들이많이없다,2,학교로갈아타지않고 가는버스가 집바로앞에있어서 좋다.하지만 지하철역이 애매하게멀어서 버스타기에는 돈아깝고 걸어가기에는 조금먼감이 없지않아있어서 불편하다.,1,대형마트는 가려면차타고5분이라편하고 버스타고도10분~15분정도 밖에안걸려서 편하다.하지만 급하게편의점을갈때 편의점이 집에서멀리있어 불편하다,4,단지가점점갈수록 많이꾸며지면서 좋아진다. 출입통제도 입구에서한번 공용현관에서 한번되서 좋다.,3,다좋은데 윗집에서 얘기하는소리가너무잘들린다. 방마다 어떤방은 바람이잘통하고 어떤방은 너무안통해서 어떤방은 겨울엔따뜻하고 여름엔시원하지만 어떤방은 겨울엔 춥고 여름엔덥다.
814,아남,30대,여자,자가 거주,기혼,5,조용하고 살기 좋은 곳이다.  주변 아파트들에 비해 가격이 저렴하다,3,"지하철이 멀어 불편하지만 5번, 2번 마을버스가 수시로 있어 괜찮다",5,마트가 있고 유흥업소가 없어 아이들 키우는데는 좋다.  다만 단지내에 편의점과 약국이 없어 불편할 때가 종종 있다.,5,"주변에 롯데캐슬과 레미안, 힐스테이트 등 고가의 아파트가 있어서 그런지 아파트 관리가 최고다.  전혀 불편함을 느끼지 못하고 있다.",5,가까이에 고덕산이 있고 공원과 놀이터가 많다.  유흥업소가 전혀없고 초등학교와 중학교가 바로 붙어있어 아이키우는데 좋다.
814,아남,30대,여자,자가 거주,미혼,4,조금만 걸어가면 창신역과 보문역과 동묘역과 동대문역이 있어서 교통이 편하고 사람들이 가족단위로 살아서 조용하다. 아파트가 관리가 잘되어 깨끗하다. 경비아저씨들도 좋다. 그러나 바로 앞으로 다니는 시내버스가 없고 마을버스밖에 없어서 어디 가려면 마을버스를 타고 다시 지하철이나 버스로 갈아타야 하는 번거로움이 있다.,4,보문역과 창신역 중간에 있어 편하다. 가까운 곳에 동묘역도 있고 동대문역도 있다. 마을버스가 가까운 곳에 있다. 버스정류장을 가려면 좀 걸어가야 한다. 택시가 주변에 별로 안 다닌다.,4,편의점이나 마트가 가까운 곳에 없다. 마트에 가려면 지하철이나 버스를 타야 하거나 많이 걸어가야 한다. 차가 있으면 마트나 편의점이 멀지는 않다. 공원은 가깝다. 강아지들 산책 많이 다닌다.,5,"경비아저씨들이 일을 열심히 하시고, 청소아줌마도 따로 있어 깨끗하게 관리되는 편이다. 택배는 경비아저씨가 관리 잘 하시고 분실된 적도 없다. 출입통제에 대해서는 안전한 편이다.",4,냉난방은 개별로 해야 해서 관리를 잘 하면 잘 되고 그냥 놔두면 고장 나고 그런다. 빛은 특별히 어둡다거나 밝다거나 하지 않고 무난하다. 층간소음은 약간 있다. 가족단위로 살아서 많이 시끄럽지는 않고 생활소음이 있는 수준이다.
814,아남,40대,여자,자가 거주,기혼,5,아이들 키우는 집들은 여기 한번 들어오면 못나갈 정도로 오래 살게 되는 곳이다. 주변 아파트 시세 대비 저렴한 시세로 주변의 쾌적한 환경을 누릴 수 있다는 것은 행운인 것 같다. 다만 새 아파트를 선호한다면 약간의 불편함은 있을 수 있지만 상대적으로 가격이 저렴하기에 적극 추천한다,5,"단지 앞 버스정류장, 도보 10분 거리 5호선 고덕역, 명일역이용 가능, 향후 8호선 도보 이용 가능",5,"고덕산 인접하여 산책 및 운동하기 좋음, 주변에 녹지가 많음.",5,"단지 내 청소 아저씨, 아주머니가 계셔서 매일 청소하시고, 경비아저씨들도 좋으심.",5,"주변에 유해시설이 없어서 조용하고 초, 중학교가 가까워서 아이들 키우기에 좋다. 유치원, 어린이집이 단지 내에 있어서 맞벌이 가정에서는 정말 안전하게 아이를 키울 수 있는 곳이다. 다만 아파트가 오래돼서 주차장 연결이 안 되는 것이 조금 아쉽다."
814,아남,30대,남자,자가 거주,미혼,3,주변에 학교가 많고 구리 암사대교가 바로 앞이라 자가 차량 운행이 편리함,5,구리 암사대교가 바로 앞  마을 버스정류장이 있고 택시가 항상 대기 중,3,상가에 슈퍼가 하나 있지만 대형마트와는 거리가 떨어져 있음,1,옛날식으로 관리되다 보니 조금 취약함  잡상인이 자주 들어옴,2,3층까지는 담벼락이 높아 지하나 다름없고  외풍이 있어 겨울에 춥고 여름에 시원함
814,아남,30대,여자,전세 또는 월세,기혼,4,주변에 가까운 초중고가 있고 학군이 좋다. 그리고 지하철과 버스 정류장이 가깝고 자가용으로는 올림픽대로 타기에 편리하다. 큰 대형마트와 재래시장도 잘 형성되어있어 좋다. 다만 새시가 오래되어 조금 춥다는 점 때문에 4점을 주게 되었다,4,단지 바로 앞에 마을버스 노선이 있고 10분 거리에 지하철역이 있기에 어디로 가든 편하다. 하지만 5호선 끝부분에 있기 때문에 갈아타야 하는 점은 조금 불편하나 대체적으로 만족한다,5,아파트 단지의 상가가 그리 활성화되어있진 않아서 옆 아파트의 큰 상가를 주로 이용한다. 하지만 가깝기 때문에 큰 어려움은 없다. 한정거장 거리에 홈플러스와 이마트가 있고 하남의 스타필드 등 대형 마트와 가까워 좋다,4,경비실에서 택배를 받아주셔서 편하고 좋다. 차량 출입 시 예전에는 직접 몇 동 가는지 경비실을 찾아가서 방문증을 받아야 하는 불편함이 있었는데 이번에 자동 인식을 통해 입주민 차량과 외부차량을 자동으로 구별해내니 편리해지고 출입 차량 관리가 더 잘 된 것 같다,3,오래된 아파트라 베란다 새시가 쇠로 된 새시로 찬바람이 많이 들아오고 먼지도 많이 들어온다. 그리고 옆집 화장실 물 트는 소리도 잘 들리고 안방과 붙어있는 화장실 소리가 크게 들려서 안 좋다. 복도에 네 집이 함께 사는데 복도에서 말하는 소리가 엄청 크게 들린다.
814,아남,30대,여자,자가 거주,기혼,5,층간소음이 있어서 좀 아쉽다 학군이 좋아서 들어가면 아이 클 때까지 키울만하다,5,도보도 정류장이랑 가깝고 일단 학군이 최고  주차장도 질구비되어읶음,5,녹지 형성이 잘되어있고 주변 환경은 좋은 편 층간소음이 있는 편이라 그게 아쉽다 아이가 있는 집이면 비추천,5,현관 비번을 자주 바꿔서 번거로움 택배 아저씨가 한 곳에 다 모아놓음,5,작은 편이다 다른 아파트보다 소음도 있고 그렇다 하지만은 좋은 편이라 감수하고들어갈만 하다
814,아남,30대,여자,자가 거주,미혼,4,서울에서 공기가 깨긋한편이며 8 학군이고 생활하기에 주변 환경이 좋음. 지역발전이 좋아지고 있어 가치가 올라갈 것으로 판단.,3,"지하철(명일역) 도보 10분, 마을버스 2 정거장 거리로 교통은 보통이며 5분 정도 4거리에 위치한 정류장은 강남, 마천동, 삼성동으로 가는 버스가 위치하여 강동 송파를 연결하여 주요 역까지 가는 것이 편함",5,"도보 15분 거리에 이마트 홈플러스 gs슈퍼마켓, 명일시장이 위치하여 쇼핑이 용이하고, 고덕선과 한강 고수 부디가 가까우며 cgv 영화관이 위치하여 여가활동도 우수함",4,"2동마다 경비원 적외선 카메라 등 아파트 보안이 우수하며, 택배보관 용이, 조용한 환경이라 휴식할 수 있는 환경",4,예전 아파트라 서비면적이 넓음 남향이라 햇빛 통풍이 잘됨 층간소음운 거의 없음
814,아남,30대,남자,자가 거주,미혼,4,주변에 대형마트와 지하철 그리고 아이들과 생활할 수 있는 초. 중. 고가 전부 걸어서 갈 수 있는 근처라 좋은 점이 있다. 하지만 아파트 단지 옆에 신규 아파트가 들어서고 있어 4점을 주었다.,4,교통여건 장점- 마을버스가 아파트 앞에서 타서 나갈 수 있으며. 걸어서 명일역 고덕역 등 쉽게 진출 가능하다. 단점- 택시가 잘 없다,4,고덕역 부근에 이마트가 있으며 걸어서 편하게 나가다 보면 명일역 방면에 lg마트도 있으며 아파트 뒤편에 산이 있어 공기와 평상시에 등산을 할 수 있는 좋은 조건을 가지고 있다.,5,항상 엘리베이터 검사와 1년에 한 번씩 배관 청소 등 아파트 관리에 정말 최고인 곳이다.,5,베란다가 넓게 잘 빠져 있으며 바람도 잘 통한다 하지만 층간소음이 약한 점이 있다
38062,고덕아르테온,40대,남자,자가 거주,기혼,5,"가까이에 대형마트가 있고 고덕산이 옆에 있어서 주변환경에 만족한다. 지하철과 버스, 택시등 교통이 편리하고 충간소음이 심하지 않아서 5점을 줬다.",5,도보 1~2분이면 상일동 역에 도착할 수 있고 버스도 편리하게 이용 가능하다.또 택시 같은 것도 단지 주변에 많이 다닌다.,5,옆 아파트에 GS THE FRESH가 있고 도보 10~15분 자동차5~10분이면 이마트에 도착할 수 있다. 또 고덕산도 옆에 있어서 산책이 가능하고 단지 안도 조명이 잘 켜져 있어서 단지 안도 산책이 가능하다.,5,엘리베이터 청소가 깔끔하고 입주민들만 들어올 수 있게 보안이 완벽하다. 또 단지가 깔끔하다.,5,난방이 잘 되어 있고 하루종일 햇빛이 들어와 겨울에는 따듯하다. 또 층간소음은 그리 심하지 않다
38062,고덕아르테온,40대,남자,자가 거주,기혼,5,대단지에 공원처럼 잘 꾸며져있어서 저녁마다 운동삼아 산책하기도 좋으며 조경도이뻐서 만조감이큼 내부구조도 타아파트보다 잘나옴,5,상일동역이 도보3분안에있습니다 창문에서바로보이고 앞으로의 9호선4단계확정되서 진행중이며 5호선 직결화 서세도로건설중 호재가 너무많아요,5,조경이 끝내줍니다 공기도좋고 이마트 병원 스타벅스 가족공원 대단지라 단지내에서 아이들놀기에 너무좋음 물놀이공원 석가산연못 등,5,최첨단 스마트시스템으로 입주민이 아니면 들어오지못하구 단지도 항상 깨끗하고 창문에서 보일정도로 편의점도가까움,5,샷시가 최고급이라 난방이 잘되고 거실창을 열면 놀이터인데 문을 닫으면 소리가 하나도 안들리며 일조량은 적당해서 좋은거같아요
14384,강동역SK허브,50대,남자,자가 거주,기혼,5,집안에서 바라보는 경관이 너무 훌륭 특히 야경 굿. 역세권 백세권. 공원이나 산책할 곳 부족. 그래도 이사 안감 집사람 만족도가 높음.,5,사통팔달. 올림픽대로 억세스 편함. 지하철 5호선 코앞. 버스정류장 코앞. 교통 나무랄데 없음,5,"이마트, 백화점 가깝고 예전엔 지하에 수퍼가 있었는데 지금은 있는지 모름. 300미티 반경에 롯데슈퍼가 있다고 들었음.",5,소장님 포함 경비원님들 모두 아파트 관리에 최선을 다하시는 느낌이 좋다. 부담될 정도로 친절하시고 다만 관리비가 평균 30~40만원(개인차 고려 필),5,4베이 정남. 겨울에 보일러 없어도 땀이 줄줄(개인차 있음). 여름엔 주간 커튼 치는건 필수. 충간소음은 못 느낌(윗집 운이 좋은 듯)
