danji_id,danji_name,age,sex,residenceType,married,totalScore,totalDesc,trafficScore,trafficDesc,aroundScore,aroundDesc,careScore,careDesc,residentScore,residentDesc
3873,은천2단지,30대,여자,자가 거주,미혼,4,"저렴하게 2호선 라인에서 신혼부부들이 스타트하기 좋은 단지. 저렴한 만큼 단점도 있지만, 그걸 상쇄할 정도의 교통여건은 된다고 보는 편.",4,역이 조금 멀다고 느껴질 수 있지만 샛길로 오면 도보 10분 정도에 마을버스가 단지 앞에 와서 편리하다. 2호선 라인 출퇴근 용이하고 향후 들어올 신림선/서부선도 환승으로 이용 가능할 예정.,4,"단지 오는 길에 물가 싼 시장이 있고, 단지 코앞에 편의점이 있어서 불편하지는 않다. 다만 대형마트는 인근에 없고 중소규모의 낙성대 gs마트가거나 남현 홈플러스/용산 이마트 까지 가야 하는 정도. 근데 왠만한 건 시장 및 인터넷 배송으로 대응 가능해서 나쁘지 않다. 바로 뒤가 관악산 올레길 및 낙성대공원이라 공원 산책하기 좋음.",4,"단지 청소 잘 되고 관리 잘 되는 편. 공동출입비번이 없는게 단점인데, 이는 복도식 아파트가 있는 특성상 어쩔 수 없는 듯.",3,"전 세대 동/서향 배치에 동간 간격이 좀 답답한 편. 생각보다 집은 겨울에 따뜻한 편이고 여름엔 시원하다. 다만, 층간소음이 취약한데 소음 안 심하다는 주민들도 있어서 이웃을 잘 만나야 하는 건지..."
3873,은천2단지,30대,남자,자가 거주,기혼,5,"이 아파트의 가장 큰 장점은, 주차가 용이하다는 점이다. 분명히 아파트 정보에는 세대 당 주차수가 1대가 안되는 것으로 나오는데, 아파트 주차장에는 차가 비교적 텅텅 비어있는 편이다. 아마도 이 아파트는 노년층과 신혼부부들이 많아서, 차량을 보유하고 있지 않은 세대가 많아서인 것 같다.",4,"낙성대역까지 남자 걸음으로 도보 10분정도 걸리나, 마을버스 정류장이 바로 앞에 있어서 대중교통 이용하기 나쁘지는 않다.  자동차 운전의 경우, 낙성대 터널을 이용하면 편리하다.",5,"낙성대공원까지 가까워서, 밤에 산책하기 좋다.  편의점이 단지 바로 앞에 있어서, 간단한 쇼핑정도는 무난하다.",5,단지관리는 꽤 잘돼있는 편이다.  아파트 단지 내에 쓰레기 같은 것들이 얼마 없다.  택배는 경비실에서 맡아주는 편이다.,5,"주변 경관을 막는 건물들이 없는 편이라서, 일조량은 괜찮은 편이다.   산속에 있어서, 여름에는 매우 선선한 편이다. 달리 말하면 겨울에는 조금 춥긴 하다."
3873,은천2단지,40대,여자,전세 또는 월세,기혼,4,어린아이들과 같이 사는 분들이라면 이 아파트에 사는것도 좋을거같다,4,버스정류장이 아파트 가까이 있어서 편리하지만 지하철이 멀어서 좀 불편하다,5,아이들이 뛰어놀기에 넓고 좋은공간들이 많다 놀이터 운동기구 등 다양하다,5,관리실에서 택배를 관리해주고 관리실에서 방송으로 안내방송도 해준다,4,베란다 앞에서 봤을때 산이 보이는곳도 있고 바로앞에 아파트가있는곳도 있어서 조금 답답한면도 있다
3873,은천2단지,40대,여자,전세 또는 월세,기혼,4,가까이에 시장도 있고 편의점도 있어서 편하고 2단지 쪽 터널을 지나고 쫌만 걸으면 낙성대공원 과 과학관이 나와서 거기서 놀수 있는것도 좋다,4,2단지는 버스 정류장이랑 아주 가깝기 때문에 교통이 편리하고 터널만 넘으면 낙성대 공원이 쉽게 나오기 때문에 놀러갈때도 편하고 좋다 ! 교통은 주차장도 자리가 넓어소 주차를 하기도 좋다 !,4,CU 편의점이 생겨서 거기서 구매를 손쉽고 편하게 할 수 있고 마을버스를 타서 몇 정거장이면 시장이 나와 짐을 쉽게 가지고 올수 있고 편하게 갈 수 있어 좋다 !,4,단지 관리는 저녁에 놀이터에서 청소년 들이 놀고 시끄럽게 하면 경비 아저씨가 나가라는 말도 해서 저녁쯤엔 편하고 출입 통제는 그냥 그럭저럭인거 같다,4,층간소음은 살짝 있지만 이웃주변이 착해서 너무 편하고 오후에는 놀이터가 앞에 있어 아이들이 놀이터에서 재미있게 논다
3873,은천2단지,20대,여자,전세 또는 월세,미혼,4,좁지만 아이들을 키우기에 좋은 시설이 많아서 높은점수를 주었다,4,버스정류장이 가까이 있지만 지하철과는 거리가 멀어 좀 불편함이 없지않아있다,5,어린아이들이 놀기에 좋은 시설이 많다 놀이터와 운동기구 시설 등 다양한 놀거리가 많고 뛰어다니기 좋다,5,경비실이 있어서 편리하고 경비실 방송으로 많은 정보를 얻을 수 있었다,4,베란다에 서면 반대편에도 아파트가있어서 답답하지만 햇빛도 들어오고 좋다
3873,은천2단지,40대,여자,자가 거주,기혼,5,환경이 좋아 아이가 있는 가족에겐 최상의 아파트 입니다.,3,낙성대역에서 조금 멀어요. 도보 8분 정도...마을버스는 다닙니다.,5,관악산 바로 아래 쪽에 있어 공기 맑고 좋습니다. 주차장도 지하에 있어 아이들 놀기 좋은 곳입니다.,4,공용 현관이 따로 없어서 잡상인들이 들어올 가능성이 있어요. 복도식이라 많이 추울때는 수도를 조심해야 합니다. 동 호수 찾는데 처음 오신 분들은 조금 헷갈릴 수 있습니다.,4,여름에도 시원한 바람 불고 좋습니다. 겨울에도 그렇게 춥지 않아요. 단지 아파트가 오래되서 층간소음이 좀 있습니다.
3873,은천2단지,30대,여자,전세 또는 월세,기혼,5,강남에서 출토ㅣ근하기 매우 좋고  근처에 학교도 많고  주거지역이라서 좋다,3,역에서 마을버스를 타고 접근하는데  버스정류장에서 거리가 가깝지 않아서 약간 불편하나  역에서 걸어서도 15분이면 접근가능한 인접한곳,4,관악산이 바로 뒤에잇고  쥬변이 주거지역이라 조용하며  유흥가가 없어서 좋다,4,단지가 오픈되어잇어서 안전하지는 않은편이다    아파트의 규모가 작아서 어쩔수없는 문제라고 생각한다,5,공기가 좋고 전통시장이 가까우며 대형마트도 인접해서 매우좋다  공기가 좋고 주변에 높은건물이없다 ㅎㅎ
3873,은천2단지,20대,여자,전세 또는 월세,미혼,4,말소리가 복도에 들리기도 해서 4점을주었다 그리고 가까이에 시장이 있어서 걸어서 가기도 편하고 좋다. 주변환경도 매우 만족한다. 대중교통이 발달되어있어서 어디에 갈때 이용하기 편리하다,4,장점은 관악04 버스를 타는곳이 약 5분거리여서 가깝다  단점은 관악04버스를 타면 군인아파트쪽에서 환승을 하거나 그곳에서 바로 안가서 불편하다 또한 걸어서 지하철까지 가는것이 20분 정도 소요된다,4,"1단지 쪽으로 가면 약 2분거리에 CU편의점이 있어서 멀리까지 안가고 먹을것을 사기가 편하다. 1, 2단지 모두에 놀이터가 있어서 뛰어 놀수도 있고 2단지 쪽에 은천방방이 있어서 친구들과 재밌게 놀수있어서 좋다 공기도 맑고 좋다",3,공용현관에 비밀번호가 설치되있지 않아서 간편하게 들어올수 있어서 좋다. 경비아저씨가 잘 관리 해주셔서 좋다. 눈이 올때 항상 치워주셔서 좋다 그리고 쓰레기도 바닦에 버려져 있지 않아서 좋다,3,엘리베이터가 열릴때 소리가 집안 까지 들리고 집안에서의 소리가 복도까지 들려서 불편하다. 냉난반은 아주 잘되서 좋다 그리고 넓어서 물건놀곳이 많아서 좋다.
3873,은천2단지,30대,남자,자가 거주,기혼,5,"젊은 신혼 부부, 어린이들이 있는 가정, 강남권 직장인들 나쁘지 않은 아파트 입니다. 충간소음등등 비난할 수 있지만 상대적으로 오래된 아파트 이니까 감안해야 하겠죠? 근데 아파트는 겉이 중요할뿐 간단한 리모델링으로 완전 다른 아파트가 된다는걸 감안하면 추천합니다.",4,낙성대역까지 걸어서 10분 마을버스가 아파트 앞까지 오는걸 고려하면 강남권에 직장을 가진 신혼에 젊은 직장인들에겐 이만한 입지가 없는거 같네요. 또 낙성대 역까지만 가면 서울 곳곳까지 가는 버스들이 많으니 나쁘지 않은 교통인거 같아요,5,관악산이 정원이에요. 등산로가 바로 앞에 있습니다. 등산을 좋아하는 저는 토요일에 새벽에 두시간 잽싸게 다녀옵니다. 이게 제일 장점인거 같아요. 그리고 애들이 있는집이면 걸어서 서울대도 갈수 있고 과학놀이터도 있고 어린이 있는 집에게는 너무 좋습니다.,4,나름 깔끔하게 관리합니다. 관리비도 워낙 저렴하고. 나름 관리사무소가 열심히 합니다.,4,층간소음을 말하는 집도 있지만 조금 오래된 아파트라는 점을 감안해야 합니다. 요즘 세상에 아파트 내부는 중요하지 않은거 같아요. 리모델링 조금만 투자하면 바로 새아파트 됩니다.
3873,은천2단지,30대,남자,자가 거주,기혼,4,"낙성대역까지 도보 거리가 있긴 하지만, 그래도 상대적으로 저렴한 가격을 고려하여 4점을 산정했습니다.",3,"제 기준으로는,  은천2단지->낙성대역 1번출구까지 8분정도 걸리고,  낙성대역 1번 출구까지 11분 정도 걸립니다.  위 차이는, 은천 2단지와 낙성대역까지 언덕이 있기 때문입니다.    참고로, 네이버 지도를 이용하여 최단거리 검색을 하면, 낙성대역 1번 출구까지 돌아가는 길을 가르쳐 줍니다.  은천 1단지 쪽에 있는 관음정사?를 통해 낙성대역을 가면 빠릅니다...",4,"바로 뒤에 관악산이 있어서, 조용합니다. 공기 좋아요.  도보 5분 거리즈음에 인헌시장이 있습니다. 나름 있을 것은 거의 다 있습니다.    대형마트의 경우, 차가 없으면 가기 힘듭니다...",5,"2000년대 초반에 지어진 아파트라서, 연식이 적지는 않은데, 관리가 진짜 잘 돼있어요.",4,"베란다의 배관을, 윗집 등과 공유하고 있는데요, 윗집에서 세탁기 돌리면, 배관에 흐르는 물소리가 상당히 크네요...  물론 샷시를 완전히 닫으면, 큰 소음은 들리지 않긴 합니다...    주차 공간은 매우 넉넉합니다."
3873,은천2단지,30대,여자,전세 또는 월세,기혼,5,"미세먼지가 심한 요즘 공기가 아주 좋고, 산책로가 마련되어 있으며 아이들이 많이 살고 있어 아파트가 살아 있는 듯한 느낌이 들어요 ^^",3,낙성대역1번출구에서 마을버스를 타고 올라오면 됩니다. 마을버스가 자주 있어서 좋긴 하나 한 번더 갈아타야한다는 의미에서 불편하다고 할 수도 있겠죠?,5,아파트 바로 뒤로 관악산이 있고 공기가 매우 좋아요. 인헌시장이 가까이 있어서 장보기도 편리합니다.,5,주차장이 매우 넓어 주차 걱정이 전혀 없어요! 지하로 주차장이 있고 단지 내에는 차가 들어갈 수 없도록 통제하고 있기때문에 아이들이 뛰어다녀도 자동차 걱정은 없답니다. 청소도 동마다 미화원 1분씩 배치되어 아주 깨끗해요!,3,산 아래라 매우 시원해서 여름에 에어컨 없어도 될 정도예요!
3873,은천2단지,30대,남자,자가 거주,기혼,3,"강남 출퇴근하는 사람 , 서울대생, 아이가 있는 가정들은 살기 좋은 것 같아요. 그 외적인 사람은 그냥 그런 것 같네요.",3,"낙성대역 도보로 15분, 마을버스로 10분 정도 소요됩니다. 남부순환로라서 자가용으로 출퇴근할 시 엄청 많이 막힙니다.",3,gs 슈퍼 하나 있고요. 편의점은 다 있습니다. 특히 gs25가 많이 있습니다. 낙성대공원은 걸어서 10분 정도 걸려요 그리고 과학전시관도 있고요. 아이들 키우는 입장이시라면 더할 나위 없이 좋죠. 그리고 서울대 근처라서 서울대생에게 적극 강추합니다. 바로 앞에 관악산이 있어서 공기도 좋아요.,3,아주머니께서 청소는 자주 해주시는 편이라서 깨끗해요. 주차장도 넓어서 자가용 있으신 분 편하세요. 택배도 경비실에 맡기거나 문 앞에 두어도 안전합니다.,3,근데 여름에 엄청 찌고 겨울에는 많이 안 추운 것 같아요. 냉난방은 잘 돼요. 일조량은 안방에는 잘 들어오고요. 거실에는 보통이네요. 층간 소음은 없어요.
3873,은천2단지,30대,여자,자가 거주,기혼,3,"1층만 아니면 살기는 좋을 꺼같네요. 엘리베이터 있는 층이면 더할 나위 없이 좋죠. 관리비도 생각보다 많이 안 나오네요. 산 근처라서 공기도 좋고, 공원도 가깝네요. 근데 대형마트로는 gs슈퍼 밖에 없다는 점이 조금 걸리네요. 완벽하게 다 갖춘 곳은 엄청 비싸잖아요. 어쩔 수 없죠. 가성비 대비 괜찮은 것 같네요.",3,꼭대기라 지하철 역까지 버스 타고 가야 됩니다. 지하철역까지 걸어서는 약 15분 정도 걸립니다.,3,"GS슈퍼 하나 있고요. 중소형 마트 2개 정도 있습니다. 편의점은 GS, 세븐일레븐, cu 있는데요. gs 편의점이 많네요. 1인 가구가 많다 보니 편의점이 많습니다. 낙성대 공원은 걸어서 10분 정도 걸립니다. 관악산은 바로 코 앞이라서 공기도 굿입니다.",3,청소해주시는 아주머니께서 청소를 잘 해주셔서 깨끗해요 그리고 주차장도 이번에 입주민만 쓸 수 있게 보안 장치 새로 세팅했고요. 택배는 문 앞에 두셔도 되고요. 아니면 경비실에 맡기셔도 돼요. 경비실이랑 가까운 단지라면 경비실에 맡기는 게 낫겠죠. 근데 예수 믿으라고 오시는 분들도 종종 있어요.,4,냉난방은 잘 되는 편입니다. 3층이라 일조량은 조금 잘 들어와요. 아주 많이 들어오는 편은 아니에요. 1층은 일조량이 잘 안 들어오는 편 이예요. 그래서 곰팡이가 필 경우도 있으니 자주 환기를 시켜줘야 합니다.  층간소음은 별로 없어요. 제가 사는 동은 신혼부부가 사는 동이라서 그런지 층간 소음은 별로 없어요.
3873,은천2단지,40대,여자,자가 거주,기혼,4,조용하고 공기도 좋음 생활하기에 편리함  주변 환경이 아이들 키우기에 안성맞춤  아파트 시세도 좋음  놀이터가 있어 아이들이 좋아함,3,마을버스 타고 10분이며 걷기에 좋은 거리이다. 출퇴근할 때 마을버스 자주와 큰 불편함이 없다,4,시장 가깝고 마트도 가까운 곳에 많이 있어 생활하기 편리하여 관악산 가까이에 있어 산책로가 잘 되어 있다,4,"관리비 저렴, 깨끗하며 택배도 관리실에서 잘 보관해 주시며 관리 아저씨도 좋음.",4,"여름에 시원하며 공기가 너무 좋음  전기세, 수도세도 많이 나오지 않으며 생활하기에 좋음"
3873,은천2단지,30대,여자,자가 거주,기혼,3,제일 좋은 점은 아파트 주위에 공기가 너무 좋고 산책로가 잘 되어있고 인헌시장이 가까워서 좋다 낙성대역도 10분 거리라서 강남권이랑 출퇴근이 좋은 지역이다  다만 백화점이나 대형마트는 차로 이동해야 하는 게 단점이다,3,역까지 10분 안쪽이라 편하다 근데 오르막길이라서 별점을 낮게 줬다,3,관악산 때문에 산책로는 좋고 근처에 서울대학교와 낙성대공원이 있어서 좋지만 백화점이나 홈플러스는 차로 이동해야 해서 불편하다,4,단지 주변은 항상 깨끗하고 주차장도 넓어서 주차에 어려움은 없다.,4,입주할 때 거실은 확장해서 외풍이 좀 있다. 산이 바로 옆에 있어서 공기는 좋다. 층간소음은 없는 편이고 아파트 주위에 불빛이 없어서 밤에는 어둡고 숙면에 좋다
3873,은천2단지,30대,여자,전세 또는 월세,기혼,3,걷는 거 좋아하고 공기 좋은 곳이 살고 싶으면 괜찮음. 2호선 낙성대역에 가까워 2호선이나 4호선 이용하는 사람도 살기 좋음. 단 평수에 비해 가격이 비싼 편이고 15년이 넘은 아파트라 낡은 느낌은 있음. 서울대 후문에 가까워 교직원도 선호하는 듯.,3,낙성대역까지 도보 15분 정도인데 경사가 있어 역에 갈 땐 편하지만 집에 올 땐 좀 힘든 느낌. 마을버스가 있지만 좀 돌아가고 붐비기 때문에 짐이 많지 않을 땐 걷는 게 편하기도 함. 남부순환로에 인접해서 교통은 편하지만 교통량이 많은 편임,3,낙성대역에서 아파트 가는 길목이 전통시장이 있어 편리함. 시장 안에 꽤 튼 규모의 마트가 있고 편의점도 많음. 아파트에 붙어서 관악산 등산로 산책로가 있어 공기도 좋고 산책하기 편함. 단 관악산이 바위산이라 산책로라도 위험한 구간이 있어 조심해야 함,3,복도식 아파트라 복도가 항상 깨끗하진 않음. 아파트 현관은 누구나 드나들 수 있고 택배는 경비실에서 잘 받아줌  찾아가라는 연락은 잘 안 함. 한 번은 음식을 받았는데 2주 있다가 보낸 줄 알아서 찾았더니 다 상해서 버린 적도 있음  알아서 챙겨야 함,3,개별난방이라 본인이 알아서 냉난방관리하면 된. 고층이 아니면 일조량이 많지 않음. 평수에 따라 다르지만 옛날 아파트라 베란다는 적절하게 있음. 층간소음이 좀 있지만 지상에 주차장이 없어 안전하게 다닐 수 있어 좋음.  주차장이 지하에 여유 있게 있음
3873,은천2단지,20대,여자,자가 거주,미혼,4,"원당시장, 공기 좋고 서울대 출퇴근하기 좋아서 추천한다",4,"지하철역에서 마을버스를 타야 한다는 점은 단점이지만 마을버스가 자주 오고, 또 낙성대역은 편리한 교통 요지이다.",5,원당시장이 가까워서 엄청 좋다. 원당시장은 웬만한 마트보다 훨씬 더 좋다.,3,"단지 내 청소는 잘 되는 편이고 주차장이 넉넉하다. 외부인 출입통제는 잘 안되지만 그다지 외부인이 많이 들어오지 않는다. 층간소음은 지옥처럼 심하다. 간혹 개념 없는 입주민들이 있는데, 이 사람들은 공중도덕의 개념이 아예 없어서 은천에서는 층간소음 가해자의 천국이다.",3,층간소음만 아니면 살기 좋은 곳이다. 어떤 이웃을 만나느냐에 따라 다르지만 이 아파트는 대체로 타인에 대한 배려심과 공동주택 생활에 대한 매너에 대한 인식이 많이 부족하다. 착한 사람들만 착하고.
3873,은천2단지,30대,여자,전세 또는 월세,기혼,4,사당에 근접하지만 저렴한 가격과 관악산 바로 옆이라 공기가 좋아서 아이 없는 신혼은 대만족,4,"낙성대역에서 아파트까지 마을버스로 5분,   집에서 사당역까지 차로 5분",4,"관악산과 붙어있어서 여름에도 너무 시원하고 공기가 좋고,  재래시장 걸어서 5분, 사당 홈플러스 차로 10분",3,복도식 아파트라 오픈되어있지만 동네가 워낙 조용해서 살기 좋음,3,"19평에 방두 개인데, 거실과 안방이 넓어 신혼에 적합  작은방은 매우 작음;  가장 큰 단점은 방음이 약함"
51431,방배그랑자이,40대,여자,전세 또는 월세,기혼,5,서초그랑자이보다 쾌적하고 삶의질이 좋다 조용하게 럭셔리한삶  외부인 출입 없다 클럽자이안 호텔급 모든 커뮤니티 활용,5,방배역 8분  사당역 마을버스 10분  대중교통좋고 자차로 이동하기 너무좋음  차가막히지않음,5,쾌적하고 조용함 품격이느껴짐  이마트 아파트에있음 산이 너무좋고 단지도 리조트같음 강남에 이런 숲이있다니  예술의전당 좋음,5,커뮤니티 호텔급 새단지라 아직까지 깔끔하게 관리됨 주차장 아주 널널 지상에 차없어 애들 안전,5,숲세권  강남에 이렇게 좋은 공기를 느낄수있다니 단지와 연결된 매봉재산 강추 길건너 우면산
51431,방배그랑자이,40대,남자,자가 거주,미혼,4,"자차 이동을 주로 하면서 숲세권에 여유롭고 한적하니 신축아파트의 편리한 라이프스타일을 희망하는 분들에게 추천함. 다만, 집 근처에 맛집과 카페, 쇼핑몰이 있는 시티라이프를 즐기는 라이프스타일과는 거리가 있음. 중고교는 괜찮으나, 초등학교는 거리가 좀 있음.",4,"남부순환로, 방배로 접하고 있어 도로 교통 우수. 방배역 도보 8분, 사당역 마을버스 5분 거리로 지하철 접근성 양호. 마을버스는 많으나, 간선버스 노선이 2개인 점이 아쉬움.",4,"아파트상가 내 이마트에브리데이, 건너편 임광아파트 상가에 유마트있음. 매봉재산, 우면산이 에워싸고 있어 공기 매우 좋고, 산 조망 가능한 숲세권. 우면산 산책로를 따라 예술의전당 마실건가 좋음. 우면산 쪽으로 경사가 있으나, 걸을만 함.",5,"신축아파트라 커뮤니티 시설 좋으며, 단지 규모에 비해 넉넉하게 스카이라운지가 2개 있음.  단 대단지가 아니라서 수영장, 조식서비스 등은 없고 관리비가 싼 편은 아님.",5,"겨울에도 난방 인해도 22도 밑으로 내려가지 않음.  층간소음은 윗집에서 뛰거나 못을 박는 수준이 아니면 어지간한 생활소음은 느끼지 못함. 주차장 진입로가 넓고 지면에서 바로 주차장으로 이어져 진입이 수월함. 또한, 세대당 주차대수가 2대 정도라서 여유롭고, 주차장도 넓어 주차하기 매우 편함. 다만, 일부세대 결로 등 하자는 여느 신축아파트와 같이 존재함."
9900,방배한화,20대,여자,자가 거주,미혼,5,편의시설이 다 가까이에있어서 좋다. 교통시설도 많아서 출퇴근 길도 편함.,5,아파트 밑에 바로 버스정류장과 도보 10분내로 지하철 역이 두 개 있어서 교통이 편리하다.,5,아파트 밑에 홈플러스와 편의점이 있고 산책로도 있어서 좋다.,5,한동짜리라서 나쁘지않음.. 쓰레기도 매일 버릴 수 있어서 좋다.,3,윗층 애기 울음소리가 매일 들리는걸로 보아 소음이 좀 심한편
19247,이수자이,40대,남자,자가 거주,기혼,5,"가성비가 정말 좋은 아파트, 강남권 생활 환경에 생활하기 편리합니다. 편의시설도 잘 갖추어져 있고, 주변 환경도 만족스럽습니다.",5,"교통은 정말 최고입니다. 강북과 강남 모두 접근이 매우 쉽고, 서리풀 터널 있어서 강남역까지 차로 10~15분 내외입니다.",5,맛집이 정말 많아 생활하기 매우 편리합니다. 이마트도 지하에 있어 쇼핑도 쉽습니다. 영화관도 매우 가깝습니다.,5,"단지 관리도 잘되고 관리소 직원도 매우 친절합니다. 헬스클럽도 관리가 잘되고, 골프 연습장도 괜찮습니다.",5,"집에 어린 아이가 있으면 다르겠지만, 아이들이 다커서 생활하기 편리합니다. 전망도 정말 좋고, 통풍도 잘됩니다."
