danji_id,danji_name,age,sex,residenceType,married,totalScore,totalDesc,trafficScore,trafficDesc,aroundScore,aroundDesc,careScore,careDesc,residentScore,residentDesc
334,라인,20대,여자,자가 거주,미혼,3,"무엇보다 주변동네가 참 살기좋은 동네입니다. 자연과 가까운 환경이고 교통도 그리 나쁘지 않은 편입니다. 아침 출근시간에만 좀 고생이지 다른 때는 괜찮고, 출근 때 힘든 건 어디나 마찬가지 일 것 같습니다.",3,역과는 거리가 좀 있지만 시내로 나가는 많이 버스들이 지나는 정류장이 5분 거리에 있습니다. 그러나 하남시에서부터 타고 오는 인원이 많아 버스에 자리가 그리 넉넉한 편은 아닙니다.,4,"솔직히 강동구는 정말 살기 좋은게 일자산 허브공원있고, 산책로도 잘 되어 있어 자연과 친화적인 동네입니다. 특히 아파트들이 매우 가깝게 붙어있는 느낌이 아니고 공간적인 여유가 있어 좋고 홈플러스나 이마트는 버스를 타고 나가야하지만 하모니마트나 가락 공판장처럼 중간 정도 규모의 마트는 많이 있습니다",3,나홀로 아파트이다 보니 관리비는 조금 많은 편인 것 같습니다. 하지만 그래도 관리비를 내는민큼 주차공간이나 엘레베이터 들 편의 시설을 활용할 수 있어 좋습니다.,3,"빨래를 널 수 있는 옥상이 있는 것이 큰 장점인 것 같습니다. 그 외에는 어느 아파트난 비슷비슷할 것 같습니다. 남향이라 집이 여름에 문을 양쪽으로 열어놓으면 시원하고, 겨울에는 햇빛이 들어 따뜻한 편인 것 같습니다."
334,라인,20대,여자,자가 거주,미혼,4,아파트의 가격대비 주변환경이 나쁜퍈도아니고 공영주차장 공사와 지하철역 공사를 하고잇어서 좋은거같아요~ 버스타기도 편하고 서울이 바로옆이라 너무 떨어져잇지도않고 좀 걸어가몀 먹을데도많고 시장도 가까움,4,가까운 버스정류장이 2군데라 편하고 배차도 긴편이 아니라서 좋아요~ 주차는 좀 부족하지만 옆에 공영주차장 공사중이라 더 편해질것같네요,4,산책코스가 있는건 아니지만 가볍게 산책하기는 괜찮고  단지 바로밑에 편의점이 두개나 있고 편리해요. 다만 대형마트는 차로 5분정도 가야 있음..,4,청소 자주 하시고 주차통제도 남친이랑 자주올땐 불편하지만 잘 되고잇어서 어디왓는지 번호랑 남겨야하고~ 택배 보관 잘해주셔서 편해요,4,층간소음이 없지는 않지만 심하지도 않고. 102동 라인은 햇빛도 잘들고 현관이랑 베란다 열어놓으면 바람도 잘통하고 여름에도 다른집보다 덜 더운편이에요
334,라인,20대,여자,자가 거주,미혼,3,대중교통도 가깝고 마트랑 시장이 가까워서 편리한데 단지가 많지 않다는 점이 아쉽고 아파트가 오래돼서 층간소음도 심합니다.,5,교통수단이 가까워서 좋아요. 아침에 출근길에 지하철이 가까워서 수월하게 출근할 수 있는 것 같아요.,5,"마트, 도서관, 초등학교, 산책로 등등 편의시설이 많아요.",4,경비아저씨가 두 분이서 격일로 돌아가면서 일을 하시는데 워낙 친절하시고 순찰도 많이 돌아다니셔서 안전하고 좋아요,3,오래된 아파트라 층간소음이 심합니다.  또한 방 곳곳에 곰팡이가 많이 있어요
334,라인,20대,여자,자가 거주,기혼,5,우선 첫 번째 지하철역과 버스가 가깝다  두 번째 초등학교가 도보 5분 거리 내에 있고 길도 안정적이다  세 번째 시장하고 가깝고 3분 거리 내에 강동 도서관이 있어 문화생활을 즐기기 좋다  주변 아파트. 단지에. 비해 한동이라 아파트 가격이 단지 크기에 비례하여 많이 오르진 않지만 놀이터 소음 역시 방음벽이나 방음문을 통해 막고 생활한다면 다시 이곳으로 이사 가고 싶을 정도로 좋은 생활터전이다,5,지하철 역이 매우 가깝고 가까운 만큼 주택단지 약간 뒤여서 시끄럽지도 않아 좋았습니다.  뒷문으로 차가 출차 할 수 있었으며 자가용으로 움직이기에는 어려움이 없었습니다,5,5분 거리에 길동 시장이 자리 잡고 있어 장을 보기 편했고 도보 10분 거리에 홈플러스 하이마트도 있어 아이들과 문화생활을 즐기기도 좋았답니다,4,택배는 경비실에 보관을 했고 공동 현관은 열려있어서 외부인의 출입이 잦아 홍보성 광고글이 많아 조금 불편하긴 했지만 이웃들과 더 가깝게 지낼 수 있었습니다,3,일조량과 층간소음은 좋았는데 안방 쪽이 놀이터를 마주 보고 있어 여름에는 밤늦게까지 떠들고 노는 사람들이 많아 소음에 시달렸습니다. 베란다에는 화분도 기를 수도 있고 좋았지만 놀이터 소음이 이사의 원인이 되었답니다
334,라인,30대,여자,자가 거주,미혼,5,"주변 다른 아파트보다 시세가 저렴합니다  초등학교, 도서관, 시장 등등 가깝고 살기 좋습니다  현관문 앞 복도 공간이 폭이 꽤 넓어서 짐 놓고 살기도 좋습니다",5,길동역 도보 5분이면 지하철 탈 수 있어서 좋습니다. 다만 아파트 주위가 일방통행이다 보니 조용한 건 좋지만 콜택시 불렀을 때 기사님들이 좀 싫어하십니다.,5,길동 재래시장이 도보 3분쯤 걸립니다.  재래시장 중에서도 저렴한 편이고 요즘은 천장 공사나 간판공사도 새로 해서 쾌적합니다.  지하철 2 정거장 거리에 천호 현대백화점 있고  1 정거장 거리에는 홈플러스  4 정거장 가면 이마트입니다,3,"공용현관에 비밀번호 차단문이 없어서 간혹 무서울 때가 있습니다  지상에는 10대 남짓 주차 가능하고  지하 1,2층 주차장 있는데...  엘리베이터는 지상층부터 있어서 그 점이 매우 불만입니다",5,베란다 방향에 높은 건물이 없어서 일자산 보이고 시야가 확 트여 있습니다  저희 집이 꼭대기층이라서 층간소음을 모르겠네요
334,라인,40대,여자,자가 거주,기혼,3,아파트도 깨끗하고 관리를 잘해서 더러운 곳은  없습니다.  5분 거리 안에 지하철역 버스 타는 곳도 있고  시장도 가까이 있어서 살기는 편합니다.,4,길동역 지하철이 5분 거리 안에 있어서 편리하지만  버스 종류가 많지를 않아요.  멀리 가려면 환승을 해야 해서 조금 불편해요.,5,라인아파트는 걸어서 5분 거리 안에 길동시장이 있어요.  재래시장이 요즘은 찾아보기 힘든데 여긴  신선한 과일 야채랑 맛있는 음식들이 많아요.  시장 안에 강동도서관도 있고 초등학교도 바로 있어서 편해요.  걸어서 10분 거리 안에 강동 홈플러스도 있고  살기 좋은 동네입니다.,3,여긴 단일 단지라서 한동 밖에 없어요  입구는 3곳이고 입구에 경비아저씨가 계십니다.  단일 단지지만 옆에 놀이터가 있는데 운동기구도  있고 넓어서 좋아요.,3,집 방향이 여름엔 괜찮은데 겨울엔 햇빛이 잘 안 들어와요.  그래도 춥지 않아서 살기 좋고 층간소음도 전혀 없어서 살기는 편합니다.
334,라인,30대,여자,자가 거주,기혼,4,교통 좋고 가까이 시장도 있고 초등학교 가깝고 전반적으로 만족하지 대단지가 아니고 주변에 찻길이 많고 산책로가 없어 아이들 키울 때 늘 아쉬움이 남아서 4점을 주었다,5,버스정류장과 지하철 모두 집 앞 5분 이내 거리이고 조금 더 나가면 경기권 버스까지 대중교통은 매우 편리한 편이다,3,시장 가깝고 주변에 상가들이 많아 장보기 편하고 편리성이 높다. 집 바로 앞에 놀이터가 있어서 아이들과 자주 이용하는 편이다. 집 근처로 찻길이 많아서 늘 아이들 안전이 신경 쓰이는 것은 단점이다,4,단독 아파트라 그런지 단지 주변은 깨끗한 편이고 관리가 잘되어있다. 공용현관 비번이 따로 없어 잡상인 관리가 잘되는지는 모르겠지만 바로 경비초소가 위치해있어 비교적 잘 관리되는 것 같다. 택배는 분실된 적 없이 외출 시 관리실에서 맡아주어 만족한다,4,동향이긴 하지만 높아서 바람이 잘 들어와서 엄청 더운 날만 아니면 문만 열어놔도 시원한 편이다. 아침에만 해가 잠깐 들어오긴 하지만 하루 종일 많이 어두운 편은 아니다. 층간소음은 조금 있는 듯 하다.
334,라인,30대,여자,자가 거주,기혼,5,"가격 대비, 주변 환경, 시장, 도서관, 은행, 지하철, 학교 등이 가깝고, 살기 좋다.  실제로 살던 사람들은 그 가치를 아는 아파트라고 생각한데.  이사 왔지만 언젠가 다시 가고 싶은 아파트",5,"지하철이 3분 거리, 버스정류장도 가깝다.  잠실, 종로 쪽, 사가정, 명일, 고덕과도 연결되어 있어 이동성이 좋다.",4,"공원이 조금 멀리 있는 것이 아쉽지만 대체로 만족한다.  학교와 도서관, 놀이터, 유치원 등이 가깝게 있어 아이들 키우기 좋고, 은행 및 전통시장도 가기 좋다.",4,1층이 오픈되어 있어서 조금 불안하나 다른 부분 만족한다.  주차장이 지하 2층까지 있어서 넉넉히 주차할 수 있으나 엘리베이터가 연결되어 있지 않아서 아쉽다.,5,"남향이라 밝고 따뜻하고, 빨래도 잘 마른다.  층간소음이 있으나, 주민들이 많이 이해해주는 편이다. 아파트 앞마당도 넓은 편이라 편하다."
334,라인,30대,남자,자가 거주,미혼,5,주기적으로 관리를 해서 그런지 매우 깔끔하고 교통편리 학교 가깝고 마트 장보기 매우 편리함,5,역 가깝고 바로 앞이 경인로 도로라 인천 및 서울 중심부로 가는 버스노선 편리하고 서울 경기권 1시간 이내 거리임,5,장점은 주변 백화점 마트 시장 등 19분 거리에다 있고 역및 버스 이용 편함 단점은 모텔이 많음,5,20년 된 아파트이지만 건물 노후가 심하지 않고 관리실에서 주기적으로 보수 교체 및 주변 환경에 신경을 많이 쓰고 깔끔함,5,주기적인 관리로 매우 깔끔하고 24시간 경비 및 cctv작동으로 치안문제 걱정 없습니다 살기 좋아요
7119,금호,30대,여자,전세 또는 월세,미혼,3,전세면 2년정도는 주상복합느낌으로 살기 좋다.   그러나 1인만 살기좋다. 큰 1.5룸원룸아파트이다. 그래고 아파트라 나중에 집빠질때 좋고 전세금보전도 안전하다. 관리비는 세대수에비해 싸지는 않다. 오피스텔보다는 저렴하다. 집앞은행도 있고 동네번화가다. 나름.   1인가구 살기엔 적합하다. 여자살기에 좋다. 경비아저씨가 철통보안이다. 버스별로고 5호선 직장 가까우면 추천이다. 남향집만 추천한다. 도로가 호수는 매연이 너무 심하다. 직장인 추천한다,5,5호선 굽은다리역.홈플.cgv 30초.초극역세권입니다. 그러나 5호선도 갈라져서 안올때는 12분에1번와요. 강동역에비해는 별로이나 전세집이면 추천함.그러나 강남가기도 멀고 다 멀다. 왕십리나 광나루는 가기좋다. 그나마. 잠실권이지. 강남권은 아님. 서울구석이라 그나마 전세가격으로 극소형아파트에서 살수 있다.  공항버스.나이트버스. 잠실가는 버스 2개.중랑구방향1개. 버스는 정말별로다.,5,30초거리에 지하철역과 연결되어 홈플러스. Cgv 연결되어 가성비 좋다. 직장이 잠실이나 강동. 왕십리면 추천한다.,4,최근 정문후문에 번호 자동문 생겨서 안전하다. 경비아저씨 매우친절하시고. 과대관심 있으셔서 외부인 못들어온다. 분리수거도 잘되고 비오면 복도창문도 다 닫아주신다. 야간도 경비서신다. 여자관리소장님이 철마다 꽃도 이쁘게 정원에 심어 관리해주신다. 다만 실평수 9평치고 관리비는 매우비싸다. 극소형인데도...,2,복도쪽말고 안쪽 남향아파트는 전세면 추천한다. 그러나 수리된집으로 구하시길..세대간 간격이 매우좁다. 오피스텔느낌. 그러나 벽간소음은 좀 있다. 밤에만 잠만자면 괜찮을듯. 샷시랑 내부 어느정도 수리된집이면 살기는 좋다. 소장님이 세심하게 관리하신다. 1인가구나 할아버지.할머니가 많다. 신혼부부조금..
7119,금호,30대,여자,전세 또는 월세,미혼,5,위치 편의시설이 좋아서 대 만족 관리실이 잘되어있고  살면서 크게불편한 건 없었다  혼자 살기 좋음,5,지하철 1분거리  여긴 교통이 대박임  공항버스도 바로 앞,5,홈플러스 영화관 30초 거리  심야영화 가끔 보러가기좋음 강동구민회관도 있고 최적의 위치,5,깨끗하고 택배 관리 잘됨 관리실 소장님이 일 잘하심 매우 만족,3,방음이 잘 안됨 옆 집 티비소리 가끔 들림 위 아래 개 키우는 집 걸리면 좀 시끄러움  방음빼고는 완벽함 여름보다 겨울에 적합한 집임 겨울엔 정말 따뜻하고 여름엔 에어컨 없이 보내기 힘들다
7119,금호,30대,여자,전세 또는 월세,기혼,3,혼자 살긴 괜찮음. 공사나 이사가 잦은데 낮에 집에 있으면 소음이 심할 때 있음. 낮에 출근하거나 일하면 전혀 불편함이 없음. 두 명 이상 살기는 불편,5,굽은 다리역 지하철과 버스 1분도 안 걸림  버스정류장도 가까움 택시도 아파트 앞에 항상 서있어서 이용이 편리함,5,홈플러스가 있어서 장보기 편하고 홈플 안에 영화관도 있음,5,"택배관리나 아파트 환경, 재활용 관리 잘 돼있음  경비아저씨들이 열심히 일하심",2,30년 된 아파트임.  층간소음 많고 오래된 아파트라 공사가 잦음  세대 간 간격이 너무 가까워서 불편함
7119,금호,30대,여자,전세 또는 월세,미혼,4,교통과 주거환경이 매우 편리하고 도로가에 위치에 안전한 편입니다.,5,"지하철역까지 3분이면 충분하고 시내버스 버스정류장, 공항버스 정류장이 바로 5분 거리에 있어 대중교통을 이용해 출퇴근하시는 분들에게는 매우 편리한 위치에 있습니다.",4,홈플러스가 바로 옆에 있어서 장보기가 편리하고 10~15분 거리쯤에 전통시장과 도서관도 있어서 편리합니다.,4,택배보관이 편리합니다. 경비원 아저씨들이 열심히 근무 서십니다.,3,일조량은 좋지만 도로 주변이라 먼지가 좀 많습니다. 복도 형식이라 겨울에는 조금 추울 수 있습니다.
7119,금호,30대,남자,자가 거주,미혼,4,"서울 아파트 값이 전국에서 매우 높은 수준인데 비해 적정선을 유지하고 있어 실거주 목적으로 좋음. 근처 학교나 마트 등 편의, 교육시설도 좋고 서울 어디든 가기 좋은 교통시설이 강점",4,"버스, 지하철 등 교통시설 편리하고 마을버스도 있어 출퇴근이 편리하다. 하지만 출퇴근 시간 교통체증이 많음",4,대형마트는 많지 않지만 중소형 개인 마트들이 많아 이용하는데 크게 불편함은 없음. 산책로도 있어 강아지 데리고 나가기 좋음,3,출입은 카드나 비밀번호가 있어 출입통제도 되지만 단지수에 비해 경비실 직원이 부족한 느낌. 또한 외부 주차도 상당수 되는듯하여 주차공간이 부족한듯하다,4,일조량은 크게 문제 되는 점은 없다. 층간 소음은 오래된 아파트가 아니어서 그런지 화장실 물소리 빼고는 불편하진 않을 정도임. 냉난방은 개별난방으로 좋음
7119,금호,20대,여자,전세 또는 월세,미혼,4,일단 지하철 근처인 게 큰 이점이다. 은행도 가까이 있고 소음이 크지 않은 곳이라 좋다. 다만 노후된 아파트라 치안은 조금 신경 쓰인다.,4,역이 가까워서 좋지만 잠실이나 천호처럼 환승역이 아니라 조금 아쉽다. 그래도 마을버스나 시내버스가 많아 천호역으로 가는 건 어렵지 않다,4,중학교가 근처에 2곳이 있어 아이들이 있는 집이라면 추천해줄 만하다. 공원도 멀지 않은 곳에 있고 번화가가 아니라 시끄럽지 않다.,3,택배보관은 경비원분들이 해주시고 한꺼번에 모아두어 살짝 분실이 걱정된다. 단지는 깨끗하고 전체적으로 무난하다.,3,베란다가 좁아서 불편하지만 햇빛은 잘 들어온다. 오래된 아파트라 아랫집 눈치를 봐야 한다.
7119,금호,30대,여자,전세 또는 월세,미혼,5,교통도 편하고 소형 아파트 원하시는 분들이라면 강추예요 집 근처 홈플러스 있고 사는 건 편해요 다만 대로변이 옆이라 매연이 있고 아파트가 오래되긴 했다는 점이 단점이라면 단점이에요,5,5호선 굽은 다리역 바로 앞에 있어서 현관문 나서서 지하철 탈 때까지 12분이면 충분했어요 짱이예요 많이 안 걸어도 되니까 비 오거나 눈 오거나 햇빛 짱짱한 날 너무 편해요 큰 대로변 바로 근처기 때문에 자가용 이용도 편하고요,5,지하철 버스정류장 다 가깝고 바로 옆에 걸어서 30호 거리에 홈플러스가 있어서 너무 좋아요 그리고 집 근처에 웬만한 식당 편의점 다 있고요 홈플러스는 여름에 놀러 가면 시원하다 못해 춥고 거기 서점에서 책 보면 너무 좋았던 기억이 있네요,5,아파트 경비아저씨 너무 친절하셨고요 깨끗하게 시설 관리도 잘하셨어요 주차문제도 도와주시고요 택배보관도 잘 해주셔서 물건 잃어버린 적 한 번도 없고 택배 왔다고 연락도 해주시고 갑자기 비 오면 복도 창문 금세 닫아놓으시고 복도에 쓰레기 하나 본적 없이 깔끔했어요,4,제가 살던 곳은 동향이라 새벽부터 햇빛이 들어와서 늦잠을 못 잘 정도였어요 암막커튼 필수였죠 냉난방은 문제없었고요 층간소음은 거의 없었는데 다른데서 집 리모델링이나 공사하는 소리는 평일 낮에 집에 있다면 어쩔 수 없었던 거 같아요 층간소음으로 불쾌했던 기억은 없네요
7119,금호,20대,여자,전세 또는 월세,미혼,3,"교통도 편리하고 주변 환경도 좋으나, 아파트가 오래되었다는 점이 아쉽다",5,버스정류장 및 지하철이 도보 1분에 있고 공항버스 및 나이트 버스도 지나간다,4,홈플러스 영화관 24시 마트 카페 등이 집 주위에 가까이 위치해있다,5,경비 아저씨의 엄격한 관리. 택배도 무조건 1층에서 수령,5,"방음은 약한 거 같고, 겨울에는 난방을 덜 해도 따뜻하다고 느껴짐"
80,고덕현대,50대,남자,자가 거주,기혼,5,"1. 재건축 하면 고덕지구 4인방이 원탑이 될 것으로 예상 (고덕상업지를 바로 끼고 있음) 2. 고덕역 5,9호선 더블역세권, 학원가, 쇼핑, 병원, 금융 등이 다 근처임",4,"고덕역 6-7분 거리 9호선 개통 시 더 편리할 것으로 예상 강동구 거쳐 하남 가는 버스라인들 대부분이 현대아파트 앞 경유  교통 편리, 특히 고덕동 상일동 신축아파트 인구.및 차량증가로 그 안에서 약간씩 정체되고 있지만 여기는 아직 그런 거 없음",5,"1. 고덕지구 학원가 : 학원버스 대신 걸어다닐 수 있는 아파트임.  저녁 10시 되면 학원차들 줄 서 있고 중고생들이 거리에 넘쳐남 2. 쇼핑 : 5분 거리 이마트, 2분 거리 에이스마트(한양아파트 상가), 편의점 등이 많음 3. 대학병원인 강동경희대병원이 바로 옆에 있음 4. 우체국, 은행, 동물병원등이 가까히 존재 5. 주양쇼핑 재건축 예정 + 명일1동 동사무소 이전 예전 ",4,1. 공용현관 비번 눌러야 들어올 수 있음  2. 단지 청소는 매우 수준급 (매일 아침 쓸고계심),5,"1. 47평 전용면적이 40평이라 넓고 쾌적함 2. 정남향에 판상형이라서 여름에 맞바람불면 시원, 겨울엔 해가 마루 깊숙히 들어와 따뜻함 3. 층고가 신축이랑 동일한 2400 임. 옆 한양은 2300이라 답답했었는데 2.4미터라 개방감 높음 4. 다만 층간소음은 좀 있음 (윗집 누가 사느냐가 중요) 5. 입주민 수준 높은 편 : 중장년층이 많아 보임. 회사 사장님인지 G90차량 기사 대기 및 픽업 광경 많이 봄 (2대)"
80,고덕현대,30대,여자,자가 거주,미혼,3,살기는 괜찮고 좋지만 관리비 난방비가 되기 비싸다 관리비가 전체작으로비싸 60만원 안팍으로 나온다,5,바스 정류장이 후문에서 나가면 바로 앞에 잇음 신호등이 잇어 위험하지 않다.,5,나무 냄새가 남 참새가 지저귀는 소리가들려시골 깉은 기분이 들때도 잇다,1,차 빼기 힘들고 현관문에 비번은 있지만 그냥 열린다 난방비가 비싸다 사람 어뵤을때 나무빵빵하게 튼다,5,햇빛이 계속 들아온다 앞에 나무도 잇고버스 정류장이 보이긴하지만 도둑이들어 올수 없는정도다
80,고덕현대,30대,남자,자가 거주,기혼,3,주변환경이 중고등학교 학생키우기엔 좋음. 그러나 노후 아파트고 주변 상가들 재건축중이라 시끄러움.하지만 강동구에서 가장 안정적이고 포근한 느낌의 주거지역임.9호선이 들어오면 교통조건도 좋음,4,지하철 도보 7~10분  그러나 기차 간격김. 곧9호선 들어선다함,5,완벽한 주거지역. 유해환경 없고 녹지 많음. 강동그린웨이와 이마트 온조대왕체육관 고더평생학습관 경희대병원 강동아트센터 도보이용가능.,3,출입통제 있지만 부실. 주차는 헬. 지하주차장이 아니라 주차공간협소. 고양이 많아서 놀람. 주민공동시설은 신축아파트랑 비교불가함. 관리비 비싼편이고 중앙난방.,2,30년 넘은 아파트라 신축 아파트와 비교하면 많이 떨어짐. 층간소음은 양호
80,고덕현대,20대,여자,전세 또는 월세,미혼,3,근처에 다양한 시설들이 있고 교통편도 편하다.  살기에 정말 괜찮은 곳이다.,5,버스 탈 곳이나 지하철역이 걷기에도 부담스럽지 않은 곳에 위치하고 멀리 나가기에도 편하다.,4,"학교가 가까이 있고, 도서관, 경찰서 등등 주변에 문화생활이나 필요한 기관이 많다.",3,택배를 잘 보관해주신다.  그리고 청소가 늘 되어있고 깨끗하다. 화분관리도 잘된다.,3,방음이 잘된다.  그리고 베란다가 있어 식물을 키우기가 수월하다. 또 집 넓이 또한 넉넉하다.
80,고덕현대,40대,남자,자가 거주,기혼,4,정주환경은 좋은 편이다. 강남 접근성이 다소 떨어지지만 차량 보유자라면 문제 되진 않을 것이다.,3,지근거리에 지하철역이 없고 버스는 강남 접근성이 좋지 않다,4,서울시내에선 쾌적하고 바둑판 모양의 도로 구획이 유리하다. 유흥업소도 별로 없어 양육에 적합하다,3,깔끔한 편이지만 경비아저씨를 관리사무소장 위주의 인물들로만 운영해서 능력 있는 분들이 없다,4,방향이나 쾌적함은 좋다. 동네가 소음도 없다.. 다만 주차전쟁이 장난아니다.
80,고덕현대,50대,여자,전세 또는 월세,기혼,2,주변에 녹지공간이 많아서 공기좋고  병원 이마튼 공연장이있어서 아주 좋다  장점일수도있고 단점일수도있는 주변 중고등 학교가 엄청많다  명문고인 배재나 한영외고도있다,3,전철. 고덕역이 칠분거리이고 구호선도 생긴다니 좋을듯..  버스정류장도 가까이 있어서 강남은한시간 시내도한시간정도 소요되고 오호선이 상일동 마천동 방향이 달라서 아주불편함,4,조용하고 바로 병원도 가까이있고 이마트도 오분거리  단점은 지대가 약간 경사가있어 들어가는 입구가 어두움  지하주차장이없어 매우 복잡하고 다른동앞에 세우면 경비아저씨 호출있는편..대체적으로 괜찮음,3,지상주차장만 있어서 경비아저씨가 키를 가지고 직접 빼거나 해주신다 그점은 편리하고 신경이 안쓰이지만 매너없는 운전자들땜에 복잡하게 꼬일때가있어서 문제..봄에는 꽃이만발이고 놀이터가 없어 그게아쉬움. 한야아파트와같이사용,3,중앙난방이라서 겨울 난방비 장난아님..  오래된아파트라서 수돗물이 가끔 녹물이 나오고 웬만한 집들은 수리를 했지만 그렇지않은 집들때문에 보일러관이나 수도관으로 공사가 자주있는편
