danji_id,danji_name,age,sex,residenceType,married,totalScore,totalDesc,trafficScore,trafficDesc,aroundScore,aroundDesc,careScore,careDesc,residentScore,residentDesc
15984,잠실엘스,30대,여자,전세 또는 월세,기혼,5,교통편리 종합운동장개발로 인한 호재 한강가깝고 롯데몰 이용 편리,5,"2,9호선 이용 용이함,버스정류장 가깝고 김프공항과 인천공항으로 가는 공항버스정류장이 집앞에 바로 있다. 버스노선은 안가는 곳이 없을 정도로 많다",5,"삼성동 현대백화점 잠실롯데 모두 가까움. 석촌호수, 잠실한강공원, 아시아공원, 잠실 종합운동장이 가까워서 환경이 정말 좋다",5,"보안 철저 , 대단지라 관리비저렴, 공동현관은 키가 없으면 들어오지 못해 안전하다. 유리창 청소와 요일을 정해 그날만 분리수거가능하게 해놓았다. 분리수거도 경비아저씨들이 정리해주신다",5,일조량 양호한 편이고 보일러같은 건 고장난 적이 없다 다만 에어컨 실외기는 바깥이라 에어컨 설치하시는 분이 너무 힘들어보였다. 에어컨 실외기 두는 장소만 실내였으면 좋겠다
15984,잠실엘스,40대,남자,전세 또는 월세,미혼,5,"잠실이 생활하기가 정말로 편한게 병원,백화점,대중교통등 이용하기가 너무나 편하고  다시 살고싶은 아파트이다.",5,서울시내어디서든 잠실오는버스는 많이있으며 지하철도 바로단지앞에 있어서 너무나 편하고좋았다.,5,바로뒤에는 한강이있으며 단지내 파인애플상가도 좋았고 걸어서 조금만 가면 신천 재래시장도 있어서 장보기에 편했었다.,5,지상으로 차가 다니지못하게해서 어린아이들이 자전거를 타고 다니기에 좋았었고 공기도 생각보다 좋았다.,3,햇빛은 상대적으로 잘들어와서 좋았었고 지하주차장이 상대적으로 잘되어있다.
15984,잠실엘스,20대,여자,전세 또는 월세,미혼,3,좋지만 그만큼 비싸다. 가격 대비 만족도는 적다. 편리한 건 인정. 평지여서 걸어다니기도 편하다. 하지만 단지가 커서 안쪽에 사는 사람들은 나가는데 오래 걸릴듯. 자전거를 많이 애용들 한다.,5,"잠실새내, 종합운동장 역이 둘 다 가깝다.  버스 아무거나 타면 한 정거장만 가도 역에 도착하고 걸어가도 된다. 주차장도 넓어서 자리 없을 염려는 없다. 하지만 좀 너무 넓어서 길이 헷갈릴 수는 있다.러시아워 때만 아니면 버스도 좋은데 그 시간대에는 지하철을 이용하는 것이 좋을듯.",4,집 앞에 없는게 없다. 상가에는 편의시설이 다 있고 외식도 충분히 집 앞에서 해결가능하다. 좀 더 가면 시장도 있어서 쇼핑하기도 좋다. 공원도 바로 있어서 산책하기도 좋다.,3,단지 여는 키가 비싸다. 관리비도 비싸다. 출입통제는 어딜가나 비슷하겠지만 누가 나올때까지 기다렸다가 들어가고 하니까 그렇게 큰 의미는 없는 것 같다.,4,도로에 가까이 있어 폭주족들 때문에 밤에 시끄러울 때가 있다. 전망도 좋고 야경도 좋다. 일조량도 좋았다. 이건 단지 위치마다 다를 듯.
15984,잠실엘스,40대,여자,자가 거주,미혼,5,"앞에는 바로 한강이 있고 옆에는 종합운동장이 있고 버스 전철등 교통이 편리하고 무엇보다 단지내에 초,중,고등학교가 2개나 있어서 학군도 매우 좋아요.",5,버스 지하철이 가깝고 편합니다.지하철이 2호선이라 서울 어디든 나가는데 불편이 없습니다.,5,앞에는 한강 뒤에는 마트와 시장이 있어서 매우 좋아요.아프면 의월들도 많고 송파 영어도서관을 자유로 맘꺽 이용 할 수 있고 회원갑입만 하면 책도 무료로 빌려줍니다.,5,지상주차라 택배보내는거 빼고 최적입니다.초소가 많아서 밥 늦게라도 편하게 다닐 수 있습니다.,5,단지 중앙에 푸른 공원이 있고 나무들이 많아서 쾌적합니다.여름에는 시원하고 겨울에는 매우 따뜻합니다.
15984,잠실엘스,30대,여자,전세 또는 월세,기혼,4,"한강,백화점,쇼핑몰 등 교통이나 주변 편의시설은 매우 만족하지만 아파트 관리 및 비둘기,쥐 등의 문제로 4점을 주었음",5,"2,9호선 더블 역세권이고, 버스도 노선이 많아 아주 편리함",5,"한강,석촌호수,잠실 롯데,삼성동 코엑스,현대백화점 무역센터가 가까워 아주 편리하고 좋습니다.또 올림픽 공원도 인근에 있습니다.",3,"종합운동장 옆이라 야구 경기나 공연이 있는 날에는 외부인 주차가 잦고,관리가 완벽히 되지는 않습니다.",3,"층간 소음이 있는편이고,한강에 인접하여 쥐,비둘기가 많은편임"
15984,잠실엘스,30대,여자,전세 또는 월세,미혼,5,역세권에 바로 근처에 잠실야구장도 있고 신천역 주변 먹거리상권도 있고 상가건물도 커서 거주하기 편리하다,5,신천역이 바로 앞이라 교통편이 편리하고 버스정류장도 바로 앞이라 편하다,5,아파트 상가가 큰편이라 큰 마트도 있고 각종 상가들이 밀집해있어서 멀리 안나가도 쇼핑을 다 할 수 있을 정도이다,5,지하주차장으로만 유지해서 지상에 차가 없고 단지내에 공원 기타 편의시설 학교까지 있어 단지내부가 상쾌하다,5,단지가 큰편이라 건물은 많지만 해가 잘 들어오지 않거나 하진 않고 창이 큰편이라 햇빛을 많이 받을 수 있었다
15984,잠실엘스,30대,남자,전세 또는 월세,기혼,4,10분거리에 마트랑 백화점이 있어서 접근성이 좋으며 아파트의 군처 소음이 약하다,5,접근성이 좋고주변에 편의시설이 많아서 쇼핑이나 마트가기 편하다,4,버스도 좋고 주변에 공원도 근처에 있고 아파트의 접근성이 매우좋다,4,관리비가 비싸지만 경비나 환경정리 모든것이 말끔하고 좋다 입구관리랑 잡상인이 많긴하더,2,베렌다는 춥고 단열 방음이 잘안되고 수압이 약해서 물의 사용감이 안좋다
15984,잠실엘스,30대,여자,전세 또는 월세,기혼,4,학군이좋고 단지내 초중고가 있어서. 교통편리함.  상가가 가깝고  호재도많은편,5,"2호선, 9호선 모두 5분 내에 있다. 출퇴근에 아주 편리함",4,집앞 상가에 없는게 없을정도로 잘되있다.  다만 물가는 조금 비싼편,3,현재 관리사무소가 일을잘 못하는듯하다. 단지 주변이 덜깨끗한편. cctv가 노후됨,3,층간소음은 별로인듯.. 아파트간의 거리가 짧은편으로 저녁때는 밖에서 보일까봐 신경쓰임
15984,잠실엘스,30대,남자,자가 거주,기혼,5,"살기 좋아요. 교통, 편의시설, 교육, 향후 주변 환경 발전 가능성..  실거주 목적으로 추천합니다.  다만, 가격이 문제이지요.",5,"2호선, 9호선 급행이 지척이고, 단지 앞에 각종 시내버스와 공항버스가 정치하며, 수서역 srt까지도 차로 금방입니다.  올림픽대로는 단지 나오면 바로 올릴 수 있고요. 교통으로는 서울에서도 최상입니다.",5,"마트 가깝고, 공원 가깝습니다. 단지 안에 공원도 잘 되어 있고요.  종ㅎㅂ운동장은 곧 개발되어 더 좋게 바뀔 예정이라 기대하고 있고요.",4,"택배나 관리비 등은 만족합니다.  다만 그동안 입주자 대표회의 내 갈등으로 관리가 덜 된 측면이 있는데, 요새 해결의 기미를 보이는 거 같긴 하네요.",5,"초중고 단지 안에 있고, 단지 안 공원 잘 되어 있어서 좋습니다.  주변 단지인 리센츠처럼 가운데 큰 공간이 있는 형태로 지어진 것이 아니라 2-3동이 공유하는 앞뜰이 있는 형태로 지어지다 보니, 밖에서 보기엔 동간 간격이 좁아 보이기는 하는데, 실제로는 간격이 좁지는 않은 편입니다."
15984,잠실엘스,40대,남자,자가 거주,기혼,5,학생이 있다면 최고의 조건임  비싸서 못 오지 최고임  교통 교육 주변 환경 다 빠질 것이 없음  서울시내에서 이 정도 여건의 아파트 잘 없을 것임,5,버스 지하철 모두 편리하게 이용 가능  올림픽도로도 바로 들어갈 수 있어 편리   하지만 주말에 길이 좀 밀림,5,한강공원 올림픽 경기장 롯데마트 홈플러스 다 있음  단지가 커서 가장자리로 조깅코스 잘되어있음,4,공용현관 번호로 못염  택배는 경비실에서 맡아줌  대단지라 관리비 상대적 저렴,4,10년 안된 아파트여서 아직 깔끔하고 초대형 단지여서 주변여건 좋음  층간소음은 좀 있는 것 같음
15984,잠실엘스,30대,남자,전세 또는 월세,기혼,5,"완벽한 주거시설, 완벽한 문화시설, 완벽한 교육환경, 완벽한 주변환경. 완벽한 교통환경.  가격이 매우 비싸지만 주변 자체가 비싼지역이라 어쩔수없고 살기에는 최고의 아파트같음.",5,"9호선, 2호선, 버스 등 대중교통 완벽.   자차이용시 올림픽대로 진출입로가 가까워 편하고 대로가 넓어서 시원하다.",5,"제2롯데월드, 롯데월드, 롯데월드타워, 롯데백화점, 삼성동현대백화점, 코엑스 등 알아주는 시설들을 도보로 이용가능. 쇼핑의 천국 같음.",5,관리비 싸고 난방잘됨. 니무들이 울창하고 단지안에 차가 없다. 단재안에 차가 없다는게 가장 큰 장점,5,"뒤로는 한강공원, 좌우로는 롯데타워, 종합운동장, 현대타워등 진정한 강남의 핵 같다."
15984,잠실엘스,20대,여자,전세 또는 월세,미혼,4,사람이 딱 살기 좋은 아파트  교통편리 단지 시설 매우 좋음,5,매우 편리하다 단지와 지하철이 매우 가깝다  버스 정류장도 근처여서 교통이 정말 정말 좋다,3,조금 시끄럽다 사람이 많고  이동량도 많고 주변에 경기장도 있고 해서 그런 듯,4,깨끗하고 음식물 처리도 체계적이다  재활용하는 곳도 깨끗한 편,5,햇빛도 잘 들어오고 단지 내 편의시설도 좋다  운동시설 학교 다 괜찮다
15984,잠실엘스,40대,여자,전세 또는 월세,기혼,4,근처에 롯데 잠실점과 월드타워가 있고 마트는 홈플러스에 롯데마트가 경쟁하고 있으며 단지 내에도 롯데슈퍼와 이마트 에브리데이가 있는 등 주변 인프라 훌륭함,5,지하철 2호선과 기타 광역 교통망 강남 생활권의 위치는 정말 편리,5,롯뎨백화점이 근처에 있고 현대 무역센터도 멀지 않은 위치며 학군도 훌륭,4,경비아저씨가 없는 중앙관리시스템을 통한 방범과 기타 첨단 관리시스템,4,아파트 단지가 공원 같을 구조로 운동과 산책이 용이하며 아이들과 함께 운동하기 좋음
15984,잠실엘스,30대,여자,전세 또는 월세,기혼,5,가격 빼곤 다 좋아요 위치 학군 편리성 등 최고  ,5,교통은 최고입니다. 가끔 마라톤 할 때 빼곤 매우 좋음! ,5,"롯데월드, 롯데몰, 현대백화점 외 아파트 상가도 좋음. 살기 엄청 좋아요",1,"주변 타 단지에비해 관리가 잘 안됨. 경비, 아파트 관리는 별로",2,노후가 시작되고 있으나 아직까지는 괜찮음. 아파트 사정으로 인해 관리가 잘 안되어 불만
15984,잠실엘스,30대,여자,전세 또는 월세,미혼,4,전세금이 많이 올라서 나왔지만  지하철이나 버스도 근접하고  주변시설이 많아도  주거하기엔 시끄럽지 않아서  살기 좋았어요 근처에 시장도 있어서  여러모로 편리했습니다  아파트 관리도 잘되어있어요 조용하고 깨끗하고  바로 앞 상가에 병원도 많아서 아이 키우면서 살기 좋을 것 같아요 신혼부부나 젊은 부부가 살기에 좋을 것 같아요,5,신천역에서 3분 거리이고 잠실역이나 종합운동장역도 가까워서 교통 편리해요,5,롯데백화점 롯데마트가 근처에 있고  아파트 바로 앞에 상가가 있어  편의시설 근접했어요,5,무인 택배함 있어 편해요  쓰레기 분리수거도 날짜 지정해서 해주셨고  주차관리나 청소도 깨끗하게 되어있는 편이라  관리비가 비싸긴 해도 만족했어요,4,5층이었는데 층간소음이 조금 있어 불편했어요  햇빛이 잘 들어 따뜻한 편입니다
15984,잠실엘스,30대,여자,전세 또는 월세,미혼,5,"마트와 편의점 시설도 잘 되어있고, 버스나 지하철을 타고 나가면 30분 내로 백화점이나 영화관에 쉽게 접근할 수 있습니다. 무엇보다도 지하철과 버스역이 가까워서 출퇴근하기 편리합니다. 학생이 있는 가정은 단지 내에 학교가 있기 때문에 굉장히 좋을 것 같습니다.",5,"아파트가 신천역 6번 출구로 나오면 바로 있어서 지하철로 다니기 아주 편리합니다.   버스정류장도 바로 근처에 있고, 운행하는 버스도 굉장히 많습니다. 강남역으로 가는 버스가 많아 버스 고도 교통이 아주 편리합니다.",5,"아파트 상가에 편의점과 마트가 있어서 장보기에 편리합니다. 버스로 조금만 가면 석촌호수가 있습니다. 건대입구와 코엑스와도 가까워서 백화점, 영화관 가기에도 편리합니다.",5,단지관리가 잘되고 있습니다. 깨끗하게 관리가 잘되고 있어 아이들과 어른 모두 산책하러 나오기 좋습니다. 현관은 출입문이 통제되어 있어 외부인 출입이 힘들어 안전하게 관리되는 편입니다.,5,층간소음은 잘 느끼지 못하고 잘 살고 있습니다. 고층이어서 창문을 열어놓으면 여름에 굉장히 시원하기 때문에 냉반비를 아낄 수 있습니다.
15984,잠실엘스,20대,여자,자가 거주,미혼,5,"역세권이고 근처 장보기도 무난히 좋으며 , 밤늦은 귀가에도 꽤나 안전하다.  대중교통으로 출퇴근하기도 편리할 만큼 교통이 편하다",5,역에서 가깝다  버스를 타고 어디든지 갈 수 있으며  야간 버스 공항버스 다 있어서 좋다,5,"대형마트가 근처에 있지만 큰 상권들이 동네에 있어서 더 좋다. 새마을 시장, xx마트 등 싸게 물건을 구매할 수 있고...  한강과 호수가 매우 가깝다",4,무난히 마음에 든다  8년간 살며 별 탈 없었다  초반에만 이상한 사이비들이 왓다갓다 했고  지금은 그런게 전혀 없다  집 문 열어놓고 나와도 걱정이 안 된다,4,바람이 잘 드는 반면 햇빛이 많이 들지 않는다  방하나가 엄청 춥다... 난방이 잘 되지 않는지 겨울엔 춥다  우리 집만 그런 줄 알았는데  12x동 그 방라인은 다 춥다고 하는 걸 보면 문제가 있다
15984,잠실엘스,30대,여자,전세 또는 월세,미혼,5,강남 강북 모두 가깝고 지하철 버스 대중교통 이용시 편리하고 주변 백화점 마트 공원 모두 있음,5,지하철역이랑 가까워 대중교통 이용이 편리하고 버스 노선도 많음,5,"가까운 거리에 롯데백화점, 롯데마트가 있고, 프랜차이즈 음식점등 최고의 주변환경 자랑",4,"외부인 철저히 관리되어 인전하고, 단지도 깔끔하게  관리되어 있음",4,단지가 넓어서 걸어서 이동시 불편하지만 단열이 잘 되어 난방비가 많이 들지 않음
15984,잠실엘스,30대,남자,자가 거주,미혼,5,전체적 주변 교통 등 환경이 좋습니다.  지하철역이 가깝고  버스정류장이 가깝고  잠실 종합운동장이 가깝습니다,5,잠실새내역이 가깝습니다.  버스정류장이 가깝습니다.  차가 자주 막힙니다.  자가용은 불가능입니다,5,주변에 잠실 종합운동장이 있고  큰 거리가 있어 좋습니다.  아파트 사이의 간격이 좁습니다!!,5,좋습니다.  택배가 지하에서 와서 보안이 철저합니다.  단지가 깨끗합니다  잡상인 등은 전혀 없습니다,4,층간소음이 조금 있습니다.  난방이 잘 됩니다  핫빛이 잘 들어옵니다.  양호한 정도입니다
15984,잠실엘스,30대,여자,전세 또는 월세,미혼,4,교육 여건 및 쇼핑 주변 환경이 매우 편리하기 때문에 주변 환경에 매우 만족함 다만 집 값이 계속 오르는 것에 비해 그 정도 가치가 있는지는 고민해봐야 함,5,지하철 역 바로 앞에 위치하고 지하철 역 통로가 아파트 단지와 이어져서 편리하다. 집 앞 버스 정류장에 서울 대부분으로 이동 가능한 버스들이 다양하게 있음,4,단지 내 학교들이 위치해 교육여건이 좋으며 학원가 대치동과도 지리상 가까움 한강시민공원이랑도 매우 가까워 산책이나 운동 그리고 간단한 캠핑등에 적합함,4,단지 내 대형 상가가 있어 편리하고 공용 현관 역시 개별 키로만 출입이 가능하기 때문에 보안이 좋음 단지 내 조경이 잘 되어 있음,4,새로 지은 아파트라 깨끗하지만 고급 자재로 지어진 느낌은 덜하다 상가 근처에는 소음이 있는 편이다 관리비가 타 지역 대비 비쌈
15984,잠실엘스,40대,여자,자가 거주,기혼,5,특히 저학년 자녀가 있는 경우 교통도 안전하고 만족도가 높다 그러나 가격 시세가 비싼 단점이 있다,5,2호선 잠실 시내 9호선 종합운동장역이 5분 이내며 버스도 많아 강남권 이동에 편리하나 강을 건너는 경우는 시간이 걸릴 수 있다 종합운동장에서 경기가 있을 때는 불편할 수 있다,5,교통이 편리하고 학교가 단지 내 있어 편리하다 잠실 백화점과 코엑스가 10분 이내며 새마을 재래시장 물건도 싸고 좋다 고수부지로 산책 운동가는 사람도 많다,4,대단위 단지라 잘 관리되며 나무라 많아 공기도 좋고 단지 내 차량 진입금지라 안전하다 음식물 처리도 카드로 처리되어 음식물 봉투를 별도로 구입할 필요 없다,4,강변 근처라 시원하다 지역난방으로 운영되어 난방비는 저렴하나 개별난방처럼 따뜻하지는 않다 겨울에 강바람이 차가울 수 있다
15984,잠실엘스,40대,여자,자가 거주,기혼,3,일단 교통이 편리하고 주변에 대형마트 및 쇼핑몰이 있어서 살기 좋지고 한강도 가까워 산책하기도 좋습니다 하지만 차들이 많아 차가 많이 막히고 층간 소음이 조금 있습니다,4,2호선 신천역이 5분 거리이며 근처에 버스 정류장도 가깝고 배차간격도 짧으며 출퇴근하기도 편리하지만 잠실 쪽은 차가 자주 막히는 단점이 있습니다,4,근처에 재래시장도 있고 잠실역에는 백화점과 마트 등 대형 쇼핑센터가 있어 장을 보거나 볼거리도 많이 있지만 사람들이 많아 주차장이 부족한 단점 있습니다,3,단지가 커서 관리비가 적게 들고 경비 초소도 곳곳에 있어서 안전하며 파출소도 단지 옆에 있어 좋습니다. 또 단지 안에 도서관이 있어 책 빌리기도 좋습니다,4,한강과 가까워서 전망도 좋고 단지 안에 공원도 있어 산책과 운동하기 좋지만 층간 소음이 있고 아파트 공간에 간격이 좁은 단점이 있습니다
15984,잠실엘스,50대,남자,자가 거주,기혼,5,단지 주변에 롯데 123층 건물 롯데백화점 면세점  서촌 호수 잠실운동장 한강 산책길 대형병원인  아산병원 국제업무단지 조성으로 강낭 못지 않게 될 것이다,5,. 잠실 새 내역 종합운동장역 2호선 9호선 더블역세권  강남 걸어서 15분 사통팔달 도로 연결  되어 교통여건 매우 우수합니다,5,주거환경은 단지가 대규모 단지이고 지하주차장이 2층으로 되어 있어 매연이 없고 공기가 맑다  아파트 주변이 나무로 녹지화되어있어 자연스러운 느낌이 매우 좋다,5,단지관리는 대단지라 자동문 열림 경비초소 운영  택배 받기 쉽고 단지에 녹지화가 많아 노인들이나  입주민들 산책하기 좋다,5,베란다가 넓고 배치가 남향이 많아 햇빛이 잘 들고  통풍이 잘된다  메이저 그룹이 공사를 해서 구조물이 튼튼하고  자재가 고급으로 사용해서 고급스럽다
15984,잠실엘스,50대,남자,전세 또는 월세,기혼,5,상기 모든 상황을 종합하여 볼 때 전혀 부족한 게 없음 단지 내 초중학교도 만족,5,지하철 버스 모두 편리하고 넓은 도로여건 지방을 가기에도 아주 훌륭한 위치,5,녹지 충분하고 한강 고수부지도 인근에 있으며 백화점 마트도 풍족함 편의시설도 최고,5,통합시스템 운영으로 단지마다 경비원이 없는 무인관리면서 원격제어시스템,5,소음 적고 편안하고 단지 만이 쾌적하여 살기에 아주 좋음
15984,잠실엘스,40대,여자,자가 거주,기혼,5,"입지, 생활편익성, 교통, 교육, 미래가치 등 아파트 결정요인 모두가 우수함. 특히 단지 내에 초중고가 있어 아이들 키우기 좋은 아파트라고 생각됨",5,"잠실새내역세권으로 버스노선 다양하고 강남 오피스 권역 접근이 매우 편리하나, 교통체증이 심하고 출퇴근 시간 자가용 이용은 불편함",5,"단지 규모 5678세대 대단지이나 중심상가 1개 동으로 단지 끝 동은 편익시설 이용이 불편함  버스정류장 2 정거장 거리에 롯데월드 몰, 롯데마트, 롯데백화점, 코엑스몰, 현대백화점 등 각종 편익시설이 다 있음",4,5678세대 대단지로 중요 사안 의결에 시간이 걸리나 관리비는 저렴한 편임.  33평 관리비 14~20만 원 수준으로 관리비 만족도 높음,3,맞통풍이며 한강변 바람이 불어서 여름에 시원한 편임. 난방은 잘되는 편이나 층간소음이 있어 위 아랫집 이웃을 잘 만나는 것이 너무 중요함.
15984,잠실엘스,20대,여자,전세 또는 월세,미혼,5,신천 먹자골목과 롯데월드가 가깝고 강남 갈 때도 편함. 학생들이 거주하기 좋은 곳,5,지하철역과 버스정류장이 많아서 좋다. 하지만 잠실이라 차가 많이 막힌다.,5,편의점과 편의시설이 많아 좋지만 차가 많이 다녀 공기가 안 좋다.,5,주차장에서 담배냄새가 좀 많이 나서 별로고 낮에는 괜찮지만 밤에는 무섭다.,5,단지 안에 아파트가 너무 촘촘히 있어서 답답한 느낌이 좀 있다. 그만큼 가까워서 다니가 쉽다.
15984,잠실엘스,20대,여자,전세 또는 월세,미혼,4,초등학교 상가 지하철역 학원 많아서 애들 키우기 좋을 듯 한강공원도 있고,5,도보 10분에 잠실새내역 있음 버스정류장 있고 도로도 넓다 근처에 잠실 롯데월드가 있어서 출퇴근 시간대에는 좀 막힌다,5,단지 내에 초등학교 고등학교가 있고 바로 앞에 한강공원이 있다 역 근처에 웬만한 상가는 다 있다,4,대체적으로 깨끗하고 안전한 편이지만 놀이터에 낙서가 너무 많아서 지저분한데 관리가 잘 안되어있다,4,층간소음은 거의 없는 편이고 일조량도 적당하고 소음 없음 바퀴벌레 없고 모기 없어서 쾌적함
15984,잠실엘스,20대,남자,자가 거주,미혼,5,"쇼핑, 웰빙 등 모든 주거 환경에서 만족도가 높다 하지만 전체 동 수가 72개에 달하고 거주민이 약 2만 명이 되는 상황에 이웃 간에 정을 느끼기는 어렵다",5,잠실 새 내역과 종합운동장역을 끼고 있어서 교통이 매 우편 하다. 다만 단지가 너무 넓어 역까지 가는 게 가끔은 지친다.,5,잠실역까지 걸어서 10분이면 도달할 수 있어서 그곳에 있는 롯데 산하 모든 쇼핑몰과 백화점 등을 이용 가능하다.,4,물론 1층 현관의 경우 카드키가 없으면 들어오지 못하지만 가끔 집 앞에 놓인 택배를 보면 불안하다.,4,층간소음이 가끔 있다. 하지만 한강이 보이는 뷰와 풍부한 일조량은 충분히 좋다.
15984,잠실엘스,30대,여자,전세 또는 월세,기혼,5,"어린아이가 있는 집, 승무원(단지 바로 앞 공항 리무진 다님)들, 회사가 삼성 쪽이신 분들 거주하기 좋아요.",5,지하철 2호선 9호선 더블 역세권에 버스 이용도 편리합니다.,5,"한강, 석촌호수, 롯데몰, 재래시장, 대치 학원가 모두 가까워요",2,관리 사무소의 서비스에 대해 만족하지는 않는다. 교체되었으면 좋겠다.,3,"단지가 워낙 대단지라 일조량 및 경관 뷰 차이가 심합니다. 좋은 동/층은 매우 좋고, 아닌 곳은 나쁘고.."
