danji_id,danji_name,age,sex,residenceType,married,totalScore,totalDesc,trafficScore,trafficDesc,aroundScore,aroundDesc,careScore,careDesc,residentScore,residentDesc
17664,암사e편한세상,50대,남자,자가 거주,기혼,5,이편한세상이지만 단지가 작아 알려지지 않은곳 그러기에 매매 또는 전세가 저렴함(2021년 10월기준으로는 매우 많이 오른상태) 단지가 너무 조용해서 좋음 엘리베이터 운행도 움직이지 않는 시간이 더 많음,5,아파트정문에서 버스정류소까지 거리가 30미터 임. 그곳에서 천호역 잠실역 동서울터미널 가는 버스가 있음 명일역사거리에는 더 많은 버스노선이 있음 사가정역 또는 망우역 가는 버스도 있음 집현관(10층)에서 지하철 승강장까지 여유있게 걸으면 10분 걸림,4,"편의점 다수(2분거리) 동네마트(2분) 홈플러스(12분) 이마트(2키로 이내) 임 가벼운운동은2분거리에 있는 프라이어팰리스 이용가능하고 암사역 또는 구리암사대교 앞 방향으로 한강 산책, 운동할수 있음. 고덕산을 거처 보훈병원쪽으로 트레킹 코스있음",5,경비아저씨(2명) 미화원(2명) 모두 친절함 관리소는 소장님 1명이나 거의 입주부터 있던 분이라 최고임,5,햇빛 잘들어오고 발코니에 있는 화단을 철거했을경우 폭이 1.5미터 이상이라 빨래건조에 너무 좋고 자전거도 보관함(다른곳에 사는 사람들이 제일 부러워하는 곳임) 층간소음은 조금 있음
17664,암사e편한세상,40대,남자,전세 또는 월세,기혼,4,"출퇴근하기 좋은 교통입지와 생활시설 금융.학원,병원등이 근접하여 좋고 이편한세상브랜드와 건물은 만족하나 세대수가 조금 아쉬워요",5,"명일역에서 가깝고 단지앞에 버스 정류장이 있어 좋아요 강남,강북 접근이 장점,버스도 여러 노선이 있어서 이동시 대중 교통이 요이합니다",5,"홈플러스.CGV,명일시장, 단지앞의 마트등 생활편의시설 가까워 편리합니다",5,관리비 아주 저렴한데도 관리가 잘 되고 있는 것 같습니다,5,남향에 사는데 2M 넓은 베란다가 빨래 건조와  확장시 넓어 좋아요
17664,암사e편한세상,30대,여자,자가 거주,미혼,4,"가까이에 대형 마트, 백화점도 있고, 한강공원도 걸어 갈 수 있다. 대중교통 및 자가용 이용도 편리하다. 두 동 뿐이라 단지가 적다. 모든게 좋지만, 처음 살아보는 아파트여서 4점을 주었다.",5,"명일역 도보 7분, 서울 끝부분으로 각종 도로 ic가 많아 자가용도 편리",5,"길건너 G마트가 있고, 걸어서 십분이내에 홈플러스와 cgv가 있고, 한강공원에 도보 30분, 버스로 10분이면 갈 수 있다. 버스로 10분이면 이마트와 현대백화점도 있고, 버스로 20분이면 잠실에 갈수 있어 롯데백화점 등도 이용가능하다.",4,"주차공간이 부족하진 않지만, 넉넉하지도 않다. 경비실에서 택배를 잘 보관해주신다.",4,베란다가 매우 넓은편이다. 바람이 시원해 여름에 에어콘 없이도 생활가능하다. 남향인 라인에 살고 있어 좋다. 층간소음은 조금 있다.
17664,암사e편한세상,30대,여자,자가 거주,기혼,4,"대중교통 이용이 편리하고. 단지가 작아서인지 아담하고 조용한 편이다. 전반적인 관리도 잘되어있고, 근처에 대학병원이나 큰 마트도 있고. 고덕산 등산도 도보로 가능하다. 근처 대단지 아파트에 비해 가격도 저렴하여 가격 대비 넓은 평수에 살 수 있다.",4,"집에서 3분 이내에 버스정거장이 있어서 하남 쪽이나 천호 쪽으로 가기용이하고, 10분 정도 거리에 5호선 명일역이 위치해있어서 지하철 이용이 용이하다.",3,"집에서 길하나 만 건너면 꽤 활성화된 마트가 있고, 근처에 홈플러스, 이마트 등 큰 마트도 있고, 버스로 이동시 아웃렛, 백화점도 바로 이용 가능하다. 단 가까운데 공원은 없어서 아쉽다.",4,단지는 작지만 관리비도 비싸진 않은듯하다. 청소하시는 분. 경비아저씨. 모두 3년 동안 바뀌신 분 없다. 특히 청소는 깔끔히 잘 되는듯하다. 단지 주차장에 차가 늘어나 주차공간 아닌 곳에도 주차되어있는 경우가 많다.,4,층간소음이나 옆집의 작은 소음 등으로 불편한 적 없다. 특히 저층임에도 남향으로 확트여있어 해 잘 들고 곰팡이나 결로가 없어서 좋다. 단지가 작아서 놀이터도 한눈에 다 들어와 아이들 놀기에는 안전한듯하다
1280,한신,30대,남자,전세 또는 월세,기혼,3,가격이 저렴하지만 주변 시설이 낙후되어 있음. 차량으로 생활하는 사람에게는 큰 문제 안됨. 주차난 있는편이나 구축은 다 마찬가지.,2,역과 역의 중간쯤이라 걸어가기 가깝지는 않음. 굽은다리역 가는데 작은 오르막 있이 있어 불편. 암사역은 살짝 내리막이지만 걸어서 10분 거리.,3,"굽은다리 역 옆에 홈플러스가 있으나 도보 10분이고, 가까운데는 편의점 뿐. 근처에 시장이 2개 있어서 먹거리 물가는 싼편",3,잘 관리하지만 오래된 아파트. 소단지라 관리비가 싸지는 않음. 놀이터 기구가 더러워서 거의 사용하지 않음. 주차 이중이라 아침저녁으로 차빼는 일 잦음.,4,가리는 아파트 없어서 일조량 좋음. 남향 세대 거주해서 더욱 좋은 듯. 통풍도 잘되어 여름에도 에어컨 없이 지냄. 층간소음 심하지 않음. 가끔 리모델링 소음 정도...
1280,한신,30대,남자,자가 거주,미혼,5,"실거주하기에 정말 좋은 집입니다. 아파트/주변환경 좋고요. 교통같은경우에는 특히 자차 이용하실에 정말 편합니다. 제가 집고를때 우선순위로 보는게 교통이랑 환경이어서, 그점이 너무 좋아 별5개로 추천합니다.",4,"- 자차 있으시면 정말 편한 곳입니다. 올림픽대로까지 가는데 5분도 안 걸리니 강남 갈때도 너무 편하고 서울근교도 편하게 다니네요. - 대중교통 이용해보니 좋습나다. 버스 바로 집앞에 있고 그리고 잠실갈때는 암사역, 종로갈때는 굽은다리역, 천호역 이용했었는데 역들이 멀지 않더라고요. 천호/암사역은 한 10분정도 굽은다리역은 7분정도 소요되었습니다.",5,"홈플러스, 영화관 걸어서다닐수있는점이 너무 좋아요. 또 하나 15분정도 걸으면 한강이 있다는점에 최고네요. 좀만 나가면 백화점, 이마트 있으니 정말 좋아요. 그리고 아파트근처에 마트, 편의점, 헬스장, 병원 등 편의시설은 바로 집근처에있어서 편했네요.",5,소장님부터 경비아저씨분들께서 관리 진짜 잘해주십니다. 분리수거도 요일 제한없이 버리는것도 아주 좋구요,4,"집 환기가 잘 되고, 햇빛 잘 들어오는게 아주 좋습니다. 층간소음은 위아래집에서 이야기 나온적이없었고, 제가 불편하다고 느낀점은 없었습니다. 별하나는 주차장관련으로 뺐습니다. 실거주하시면 느끼실텐데 주차는 생각보다 넉넉합니다. 다만 새벽에 들어올경우 이중주차 하실 가능성이 있기에 하나 뺐습니다."
1280,한신,50대,남자,자가 거주,미혼,2,위치는 좋습니다 역하고 나름 가까운편이구요 가까운곳에 있을꺼 다 있구요 다만 층간소음이 심해서 저같은경우는 너무 예민해지고있네요 이점도 신경써야될부분같습니다,3,걸어서 15분거리에 암사역이있고 또 10분거리에 굽은다리역이있어요 코앞에 사거리로 나오면 버스타는곳도있습니다,4,10분거리에 홈플러스가있습니다 정문앞에 편의점도있구요 집앞사거리에 먹을거리도 좀많고 식당도 다양한편입니다,1,출입통제는 기본적으로 안하구요 택배는 모든택배회사가 문두들기거나 벨한번누르고 복도 문앞에 놓고가는 시스템입니다 경비할아버지들은 너무 연세가많으세요,2,집 구조는 상당히 좋아요 다만 층간소음이 심해요 윗집발소리도 들리고 새벽에 떠드는소리도 들리고 옆집말소리도 들리고 특히나 화장실에서 씻는소리는 화장실 바로 옆방에서 너무 잘들립니다 베란다와 창문이 나무로되어있어 다른집 여닫는소리도 심한편입니다
1280,한신,50대,여자,전세 또는 월세,기혼,5,보안이 완전 철통보안이고   경찰서도 가까워서 안심이 된다  다른 아이 엄마들도   만족하시는것 같다,5,지하철이나   버스이용이 조금 불편하지만   자가용 사용이 편리하게 된 시설이다,4,자가용이나 버스 지하철을 타고   가야하고 조금 멀리 있다는   느낌이 없지않아  있다,4,택배보관이 용이하고  관리비가 보통이다.  경비아저씨께서도  친절하시다,5,층간소음이 조금 크고 조금만   소리내도 아랫집에서 올라노는 경향이 있다.   아이들이 많이 살아서   시끄러운것도 있다
1280,한신,30대,여자,전세 또는 월세,기혼,4,교통이 편리하고 아파트 단지 안에도 깨끗하다   그래서 다른 분들에게도 추천하는 아파트이다  아파트 중에서도 잘 관리가 되지않이서 더러운 아파트들도 있는데 한신 아파트는 그렇지않다,3,버스 정류장이 별로 멀지않다 그래서 매움을 편리하다  그렇지만 차가 조금 막히는게 조금 불편하기도 하다ㅠㅠ  그렇지만 참을만햐서 나쁘지는 않다,4,작은 마트여도 마트가 가깝다 큰 마트로 가야된다면은  단지 근처에 있는 버스 정류장에서 버스를 타고 큰마틀을 가서 물건을 사면 될거같다,5,단지에 경비아저씨가 있으셔서 좋고 복도니 엘리베이터 ?  그런곳들에 쓰레기들이 별로 많지 않아서 좋다  앞으로도 이렇게 잘 관리 되살면 좋겠다,4,햇빛이별로 잘 들지 않아서 조금 그렇다  하지만 햇빛은 집 앞에있는 공원에 가서 충분히 받을수이ㅛ기 때문에 별로 큰 문제는 없다
1280,한신,40대,남자,전세 또는 월세,기혼,5,주변 상가나 교통이 괜찮아서 이용하기에는 큰 불편이 없을거같다 나는 추천한다,4,집앞에서 버스를 바로 탈수 잇으며 주변에 샹각보다 상점이있다,4,주변에 공원이잇어 애완동물을 산책시키거나 애기를 대리고 나가기 좋다,4,택배를 보관하기에 정말 좋운것 겉다 또 주차장은 관리가 조금 안되는거같기도 허지만 다른 아파트에 비하면 괨찮은 편이라고 생각한다,4,햇빛이 잘들어오며 바람리 잘 둘어오지않라 여름에는 덥고 겨울에는 좀 춥다
1280,한신,30대,남자,전세 또는 월세,미혼,3,"전체적으로 작은 단지이고, 비 역세권이지만 그만큼 가격이 저렴한편이라서 가격대비 살기좋은 아파트인것같다.",2,"지하철역과 멀지만, 자가용이 있다면 편리한위치이다. 올림픽대로와 가깝고, 외곽순환 고속도로와도 가깝다.",3,"마트, 백화점, 전통시장등이 가깝다. 근처에 도서관이나 공원등의 위락시설은 부족하지만 한강이 멀지않다.",4,작은단지고 관리비가 저렴한편이나 관리가 잘되는느낌. 경비원이나 관리소 직원들이 친절함,2,전체적으로 나쁘지않은편이나 복도식아파트여서 겨울철에 동파가 빈번히 일어나니 주의해야한다. 지하주차장이 없어서 불편한점이 있으나 생각보다 주차공간이 부족하지는 않다.
1280,한신,20대,남자,전세 또는 월세,미혼,4,집은 그렇게 좋은편은 아니지만 위에 말햇듯이 교통시설과  강동구의 중심들이 매우 가깝고 마트와 학교가 가까워서 가정집이 살기에 매우좋다,5,길동 굽은다리 명일 암사 모두 걸어서 이동가능  바스정류소 버로앞에 있고 암사역 명일역 천호역 걸어서 10분정도,3,집앞바로 대형마트가 두개가 있고 걸어거 10분거리인 홈플러스굽은다리점이 있고 버스터고 5분거리인 이마트도있고 천호시장 암사시장 고분다리시장 모두 걸어거 이동가능,3,관리비도저렴하고 경비원들이 친절하다 하지만 지하주차장이 없는 관계로 주차장이 부족한 경향이 없지 않아 있다,3,오래된 아파트인지라 더럽김 하지만 약 1젼전에 페인트칠을 새로해서 겉으로보기인 깨끗하지만 내부는 좀 더럽다 집 안은 새오 인테리어 하는것을 추천
1280,한신,20대,여자,전세 또는 월세,미혼,3,장점은 집 앞에 바로 버스 정류장이 있고 몇분만 걸어가면 역이 나와서 지각을 하거나 늦잠을 일어났을때 택시 타지 않고도 갈 수 있어서 좋고 주변환경은 편의점이 진짜 유용한데 근처에 있고 집에만 있기 답답했을때 몇분만 가면 공원도 나와서 답답함도 해소 할 수 있어서 좋았지만 아쉬운점은 층간소음이 진짜 심하고 여기에는 아이들이 좀 많이 살아서 뛰어다닐때 쿵쾅쿵쾅 소리가 좀 크게 날 때가 있고 내부 시설이랑 청소도 그렇게 좋은편은 아닌거 같다 그래서 장점은 있고 단점도 거의 비슷하게 있는거 같아서 3점을 주었고 하지만 이거는 확실한 개인차가 있을수 있다.,3,바로앞에 버스정류장이 있어서 편리했고 늦은시간에 일어나 지각 할 수도 있는 상황에서는 완전 짱이였다,2,편의점이나 공원들이 집 근처에 있어서 무언가 급하게 필요할때 편리했다,2,단지 상태가 딱히 좋지는 않았고 청소같은것도 깨긋하지 않는 상태다,1,층간 소음이 심하고 아이들이 뛰어놀아서 불편했던 적도 있다
1280,한신,20대,남자,전세 또는 월세,기혼,5,아파트 좋아용 지하철도 가깝고 교통도 편리해요 무엇보다 다른아파트 보다 경비아저씨가 친절하신것 같아서 정말 좋아용 또한 층간소음도 얼마없는것같아서 정말 좋아용 그리고 주변아파트보다 잘되있는것 같아요,5,주변에 교통도 잘되있고 출퇴근길 불편함없이 살고있습니다,5,아무래도 앞에 차가 자주다녀서 위험할수도있지만  대체로 좋은편이다,5,경비아저씨 정말좋음 그리고 택배도 잘받아주셔서 정말 안심하고 경비실에 맡길수있어요,5,층간소음 없어서 다행 주변에도 서로 도와가면서 지내서 좋음
1280,한신,20대,여자,전세 또는 월세,미혼,4,필요한곳은 주변에 다 있고 딱히 불편한건 못느껴봤어요 근데 새벽에 집 오면서 주정부리는 아저씨를 몇번 본적있어서 무서웠어요,3,대중교통이 편리하지만 막힐때는 엄청막혀요 자가용이 없어서 잘은 모르지만 친구들은 나름 괜찮다고 하더라고요,4,저희 동네주변은 굉장히 깨끗해요 아파트내에서 어머님봉사활동(확실치는 않지만)하셔서 그런것같기도 합니다,5,경비원분께서 관리를 잘해주셔서 불편한건 못느껴봤어요 낙엽이나 눈같은걸로 미끄러진적도 없고 인사도 굉장히 잘받아주셔서 감사합니다,3,새벽에 윗집에서 노래하는 소리가 들려서 정말 짜증났었는데 인터폰하니까 조금은 조용해지긴 했었어요 근데 이건 어느집에 사느냐에 따라 다른거니까
1280,한신,20대,여자,전세 또는 월세,미혼,5,가까이에 중간 크기의 마트도 여러 개 있고 역이 두 개인데 소음도 없고 버스 정류장이 두 개이고 이웃들도 모두 친절하고 동네가 정갈하다. 좋은 카페도 여러 개 있어서 공부하기 좋을 것 같다.,5,"가까운 장소에 버스정류장이 두 군데가 있는데, 그 두 정류장 모두 편리하지만 한 정류장이 웬만한 장소를 모두 갈 수 있어서 편리하다. 그리고 가까운 장소에 역이 두 군데가 있어서 편리하다.",5,동네가 조용하고 깔끔하다. 정갈하고 소박한 분위기가 난다. 가까운 장소에 역이 두 군데나 있는데도 조용하다. 다른 옆 지역은 범죄가 일어난다고도 하는데 우리 지역은 범죄랑 거리가 먼 것 같다. 조용하고 정갈해서 산책하기도 좋다.,5,항상 경비 아저씨가 계셔서 밤늦게도 걱정이 없고 친구들이랑 단지 주변에 산책하러 드나들어도 딴지를 안 거셔서 좋다. 사람들도 다 착해서 불안하지도 않다.,5,딱히 환경적으로 문제 삼을 만한 것이 없다. 산책할 때 밤늦게라도 불이 켜져 있어서 편리하다. 조명이 좋다. 소음도 없는 편이다. 시끄러운 소리가 들린 적이 거의 없는 것 같다.
1280,한신,20대,남자,전세 또는 월세,미혼,4,적당하다 나쁘지 않다  층간소음에 민감하지 않은 사람이 아래 살면 좋다  그리고 화장실 물이 약해서 고통이다  솔직히 하나하나 따지면 이 정도는 괜찮은 더 같다  사실 집에서 교통이 편하면 그냥 최고다 그러므로  4점이면 딱이다,4,5분 이내에 핵심 지하철역으로 가는 버스가 다 있고  차고지 앞이라 금방 뜬다 하지만 언제 오는지는 모르기에 별 한 개 차감  애초에 학교나 다른 편의시설은 걸어가도 5분이라 교통은 매우 편리,5,10초 거리에 gs가 있고 간단한 술집과 밥집이 많아 좋고  초등 중학교 고등학교가 다 있어 통학이 쉬워 더 좋고  초등학교 앞 차 없는 거리 지정 공원을 만들어서 편안하다  Pc방 노래방 도 10분 이내에 전부 있어 아주 좋다,4,이번에 출입 자동문 건설 중이라 곧 좋아질 것 같다  하지만 아직 없기에 별한 개 차감  그 외 딱히 불편한 점 없다  저게 없어서 세탁소 아저씨도 집 앞까지 오기 때문에 오히려 좋을 수도,3,햇빛이 졸라 잘 드어와 광합성에 매우 좋지만  여름에 졸라 더워서 극혐이다  아랫집이 예민해서 층간소음에 민감하다  방음이 중요한 거 같다 아랫집 때문에 별 3개
1280,한신,30대,여자,자가 거주,미혼,3,시내가 다소 멀지만 단지내에서 생활하기 좋다. 따라서 추천한다.,3,중심가에서 떨어져 있다. 시내에 한 번 나가려면 차가 막히고 시간이 오래 걸리는 단점이 있다.,5,단지내에서 생활하기 좋다. 마트도 가까이 있다. 산책로도 잘 조성이 되어 있다.,5,단지가 잘 조성되어 있다. 경비원 아저씨가 잘 바뀌지 않고 친절하시다. 안전하다.,5,아이들이 자라기 좋다. 놀이터가 잘 조성되어 있다. 위험하지가 않다.
1280,한신,20대,여자,자가 거주,미혼,5,추천하는 이유는 근처에 없는 게 없다는 것이다 특히나 걸어서 10분 거리에 있는 홈플러스와 영화관이 최고의 장점인 것 같다,5,바로 앞에 버스 정류장이 있는데 경기도까지 가는 버스들도 많고 해서 편하고 근처 지하철역도 네 개나 돼서 어디로든 갈 수 있고 지나가는 지하철도 2개 노선이라 멀리 나갈 때도 편리하고 자가용을 이용할 때도 고속도로가 근처라 아주 편리하다,5,걸어서 5분 거리에 홈플러스가 있고 홈플러스 건물 안에 영화관도 있어서 문화생활 즐기기에 너무 편리하고 버스 타고 10분 정도 나가면 천호 로데오거리라 없는 게 없다,3,택배보관은 경비실에서 잘 해주고 안 찾아가면 바로 그 날 인터폰으로 알려주니 좋다 공동현관은 비밀번호가 있는 게 아니라 그냥 누구나 출입할 수 있게 되어있어서 약간 위험한 면이 있다,3,충간소음이 심한 편이다 이 문제로 위아래층과 여러 번 마찰이 있었다 그리고 아침에는 햇빛이 잘 들어와서 기상하는 데에 햇빛이 강해 저절로 일어나질 정도다
1280,한신,20대,남자,전세 또는 월세,미혼,5,"개인적으로 아 아파트에 살아본 한 사람의 거주민으로써 추천합니다. 이 아파트는 누구나 들어와서 살기에 안성맞춤입니다. 처음 시작하는 아파트 살이 인생, 이곳에서 시작하세요",4,지하철 역이 가까워서 좋았습니다. 주차  시설도 협소하지 않아서 항상 여유로웠습니다,4,지하철 역이 아까워서 매우 편리  했고 버스 정류장도 멀지 않아서 매우 좋았습니다.,5,단지는 항상 쓰레기가 없었고 분리수거가 잘되어 있었으며 경비 아저씨들과의 사이도 좋았기 때문에 살면서 큰  트러블은 없었다,5,거주환경 자체는 나쁘지 않았다. 여름에는 에어컨을 안 켜도 시원하고 겨울엔 따듯했으며 층간소음도 크지 않았고 물도 잘 나왔다. 강력 추천
1280,한신,30대,여자,전세 또는 월세,미혼,5,"7분 거리 대형마트 집 앞 작은 공원에서 운동을 할 수 있고, 도보 5분 버스, 도보 약 12분 거리에 지하철이 있으니 우리 집이 너무 좋은 것 같다.",5,마들역이나 상계역으로 가는 버스가 5분 거리에 있고 12분 걸어가면 지하철이 있어서 운동할 겸 걸어간다,5,7분 거리에 GS마트가 있고 5분 거리에 아이스크림 70% 하는 마트가 있다,5,경비아저씨가 교대로 계셔서 항상 안전하고 전단지가 붙어 있는 걸 본 적이 없는 거 같다.,5,고층에 살아서 여름엔 시원하고 겨울엔 베란다로 해가 비치니 따뜻하다. 층간소음은 별로 없어서 아주 좋다.
1280,한신,20대,남자,전세 또는 월세,기혼,4,요 근래에 살았던 아파트들 중에 제일 괜찮은 것 같다. 단지 그렇게 추천할 정도는 아니지만 그래도 거주할 거면 괜찮다 생각한다.,3,학교 다닐 때 교통 여건이 정류장과 가까워서 편하게 이동했지만 단지 나갈 때는 복잡했다.,3,마을버스로 3 정거장이면 한강이어서 여름에 가족들이랑 캠핑하기도 편하고 경치도 좋다.,4,경비 아저씨가 친절하신 게 제일맘에 들었다. 택배도 잘 관리해주시고 저렴하니 좋다.,4,햇빛이 잘 안 들어와서 춥긴 하지만 층간소음이 별로  없기 때문에 괜찮다. 아이들이 뛰어놀 수 있게 맘 편히 할 수 있다
1280,한신,20대,여자,전세 또는 월세,미혼,4,아파트가 웬만하면 층간 소음이 있기 때문에 그거에 그렇게 신경 쓰지 않는 분들이라면 추천할만하다,4,버스나 지하철 정류장이 가깝지 못하여 대중교통 이용하기가 불편함 그래도 덕분에 부지런해지고 여유 있게 나가서 나름대로 좋게 생각함,4,주변에는 아파트들이 둘러싸여 있고 지하에는 주차장이 있고 집 가까이는 아이들이 즐겁게 놀 수 있는 놀이터가 크게 있다 주변에는 초등학교도 있고 때문에 좀 많이 시끄러운감이 없지 않아 있지만 그래도 나름 못 살 정도는 아니라 크게 신경은 쓰이지 않음,4,현관은 비밀번호로 자금장치를 해놔서 안전한 편이고 택배는 현관 앞에 작은 신발장에 보관해놓는 편이다,4,베란다가 트여있지 않아 바람이 덜 들어와 에어컨을 항상 켜야 함 겨울에는 햇빛이 잘 들어와 난방비를 아낄 수 있음 아이들이 집에서 뛰어놀지 못해 아쉬움
1280,한신,40대,여자,전세 또는 월세,기혼,5,추천해요. 버스 타기도 좋아서 차 없는 사람들 살기도 좋고 근처 학교가 있어서 애 키우는 집들이랑 노인분들이랑 거주민들 연령이 다양합니다. 근처 역 생기면서 점점 번화하고 있네요. 앞으로도 더 오를 거 같고 계속 살고 싶어요,5,단지 내에 마을 버스정류장 있어서 편합니다. 배차간격이 좀 있지만 요즘엔 어플 보고 시간 맞춰 나가서 거의 안 기다리고 바로 타요 ㅎㅎ 종점 근처라 항상 앉을 수 있고 좋네요. 자차 없어도 대중교통으로 다니기 편합니다. 추천해요!,4,단지 내에 공원이랑 테니스장도 있고 애들 야구장도 있어요. 요즘에 애들 뛰어놀만한 곳 많이 없는데 좋네요. 애 키우는 분들께 추천합니다. 마트는 근처에 없지만 그냥 동네 마트랑 편의점 근처에 많아서 굳이 대형마트 안 가도 살만해요.,5,단지 청소 깨끗한 편이고 지은 지 좀 돼서 건물이 노후하지만 이 정도면 양호합니다. 한 번씩 페인트 칠새로 해주면 새 건물 같고요. 현관 비밀번호 있어서 보안도 괜찮아요. 택배는 경비실에 맡길 수 있어서 좋아요. 그런데 경비원분들 순찰 도시는 시간에 가면 헛걸음이라 미리 전화하고 가시길 추천,5,아파트라서 난방은 따뜻해요. 베란다 쪽은 웃풍 살짝 있는데 뽁뽁이나 담요 좀 덮어두면 괜찮습니다. 여름엔 복도식이라 창문 열기는 그렇고 베란다 열어두면 시원하고 좋아요. 층간소음 복도식이라 있습니다. 그래도 다들 조심해서 이 정도면 사람 사는 냄새나고 괜찮은듯합니다.
