danji_id,danji_name,age,sex,residenceType,married,totalScore,totalDesc,trafficScore,trafficDesc,aroundScore,aroundDesc,careScore,careDesc,residentScore,residentDesc
16156,리센츠,30대,남자,자가 거주,기혼,4,주변 환경이 아주 좋고 단지네 초중고등학교 모두 있어서 애들 키우기 아주 좋아요.,4,2호선 잠실역에서 가까워요. 잠실역에 버스 많아서 교통이 아주 편해요,5,"롯데마트, 롯데백화점, 롯데월드타워까지.., 단지 내 초중고등학교 모두 있어 학군 아주 좋아요",3,예전에 택배차량 못 들어오게 해서 택배 대란이 있었지만 지금은 해결됐고 관리비는 저렴합니다.,4,거주 환경은 괜찮은 편이지만 도로변 쪽은 약간 시끄러워요.
16156,리센츠,30대,여자,자가 거주,기혼,5,자녀가 있으신 분들은 단지 내 학교가 있고 편의시설 학원 등 잘 갖추어져 있아서 추천드려요!  지하철로 출퇴근하거나 통학하는 뷴들도 좋고요 대단지라 단지 조경 관리비도 모두 만족했어요,5,"교통은 최고 2호선 라인에 지하철과 가까워 출퇴근하기도 ,어디 놀러 가기도 정말 좋아요",5,롯데백화점 롯데마트 그 외에도 새마을 시장 신천 먹자골목 등등 주변에 웬만한 펀의 시설은 모두 다 있어요,4,출입 통제가 완벽할 정도로 잘 되는 게 아니지만 그래도 어느 정도는 만족해요,4,정남향이 아니라 그거 때문에 별 하나 뺐어요  그렇지만 한강 가깝고 대단지라 단지 내 조경도 좋고 다른 웬만한 건 모두 만족했어요
16156,리센츠,40대,여자,자가 거주,기혼,4,"운동, 산책할 수 있는 한강공원이 가까이 있고 백화점 대형마트 지하철 2호 선등 잠실역에는 외각으로 가는 모든 시외버스 있고 시내로 가는 접근성 아주 편리하다",5,지하철역이 바로 있음 잠실역에는 외각 지방 가는 시외버스도 많음,4,롯데백화점 마트 테마파크 근처에 재래시장도 있음 도보로 5에서 10분 거리,4,관리인들이 순찰 돌아 안전하고 쾌적하고 깨끗하게 관리되고 있고 대단지라 관리비도 절약,5,한강 바람으로 시원함 겨울렌 해가 초저녁까지 들어 따뜻하고 일조량이 아주 좋음
16156,리센츠,50대,여자,자가 거주,기혼,5,"대형마트와 재래시장이 공존하는 서울에서 드문 단지입니다  단지 내 초. 중. 고 있어서 교육환경도 좋고, 교통도 편리하고 걸어서 한강고수부지도 갈 수 있고요.  관리도 잘되어 있어서 거주하면서 아주 만족합니다.",5,"지하철 2호선과 연계된 버스 편이 많아서 편리해요.  9호 선도 가까워서 여의도까지 30분 내로 갈 수 있고요.  88 도로가 인접해 있어서 강북으로 가기도 편리하고 집 앞의 버스 편은 강남, 북을 거의 커버하네요.",5,한강 고수부지도 가깝고 상가와 재래시장인 새마을 시장과 복합쇼핑몰(롯데월드)도 인접해 있어서 생활에 편리합니다.  단지 내 녹지시설도 잘돼 있고요,5,대형단지이므로 같은 평수의 타 단지보다 관리비가 저렴하고 보안시설이 잘되어 있어 안전하게 아이들 키우기에 적합합니다.,5,지금껏 층간소음으로 불편한 점 없었고 송파구에서 최근에 조성된 단지중 하나이므로 깨끗하고 좋은 환경입니다.
16156,리센츠,30대,여자,전세 또는 월세,기혼,4,우선 위치가 너무 좋고 여러 가지 편의시설이 가까운 곳에 있고 아이들 키우기에 학교나 교육청이 다 근처에 있어서 조건이 참 좋은 아파트이다.  아무래도 잠실이라 조금 비싸다 보니 별 한 개는 뺐다,4,지하철역과 버스정류장이 매우 가까운 편이라 좋지만 우리 집은 안쪽에 있는 단지라 조금은 걸어야 해서 별 5개에서 한 개 뺐어요,5,"롯데백화점, 롯데월드, 마트가 다 가깝고 초중고등학교가 매우 가까워서 아이들 키우기 좋습니다",4,깨끗하게 정돈되어 있는 건 좋으나 주차장 쪽에서 도둑? 이 든 적이 있어서 주차를 할 때 약간의 불안함이 있습니다,4,일반적인 구조인데 이젠 조금 오래되어서 새롭게 리모델링을 하니 새집 같아서 좋긴 하나 약간은 층간소음이 아쉽다
16156,리센츠,30대,여자,전세 또는 월세,미혼,3,"주변 편의시설은 많고 좋으나, 단지 관리가 잘 안되고 입주한 지 7년이 너무은 아파트라 이제 곳곳이 점점 열악함. 아파트 가격 대비 비추천",5,지하철 2호선이 바로 연결되어있고 단지 앞에 버스정류장 있음.,5,"걸어서 10분 이내에 롯데월드 몰, 백화점, 시네마, 마트 등이 모두 있고 신천역과 시장이 있어서 모든 편의시설이 용이함",2,출입통제 주차장 관리 잘 안됨 출입구의 유리문이 고장 나도 잘 고치지 않는 등 단지 관리 엉망,3,"층간소음 심각, 난방이 뜨겁지 않아서 난방비 많이 나옴"
16156,리센츠,40대,여자,자가 거주,기혼,5,"교육, 교통이 다 좋다.  단지에 초중고, 교육청이 다 들어와 있고, 상가도 웬만한 건 다 있고  아파트 앞 사거리  지하로 아파트 3개의 단지에 있는 상가를 왕래하기 편하다",5,2호선 신천역 지하철 바로 앞이고 올림픽대로 바로 옆이라 자가용으로 출퇴근도 용이하다.  2호선과 9호선이 다 있어서 움직이기 편하다,5,"길 건너 재래시장인 새마을 시장이 있고, 바로 옆으로 롯데백화점, 롯데월드가 있어 쇼핑하기에도 쾌적하다.  하나로마트, 롯데마트 등 마트 이용이 용이하다",5,"현관은 입출 카드로 드나들고, 음식물 쓰레기 기계가 있음",5,"교통, 교육 등 전반적으로 다 만족.  단지 안에 초중고, 교육청이 다 들어와 있고, 단지 내 상가도 좋다."
16156,리센츠,30대,여자,전세 또는 월세,기혼,4,신천역 리센츠 아파트는 집값 비싼 것 빼고 관리업체 빼고 완벽합니다  교통편이 좋아 친구들과의 집결장소이며 대조할 수 있는 대형마트가 곳곳에 널려있고 맛집도 꽤나 많습니다 구경할 지하상가부터 메이커 프랜차이즈 등 쇼핑공간도 넉넉합니다,5,"강남, 판교, 명동, 수원 뭐 안 가는 데가 없습니다 지하철도 신촌 홍대 한방이고 쇼핑 동대문 명동(을지로입구)도 한방이고요 버스는 대성리 수원 판교 용인 등 안 가는 지역이 없다고 해도 무방합니다",5,걸어서 10분 한강공원 롯데백화점 롯데 2 롯데마트 두정거장 차로 10분이면 삼성 코엑스몰 석촌호수 잠실 홈플러스 올림픽공원 차로 15분 둑길 타면 장지 가든파이브까지 쇼핑부터 음식 찜질방 신혼부부부터 노부부도 행복합니다,2,주차장 관리가 잘 안된다는 단점 관리업체가 너무 세서 가끔 기분 나쁘며 잡상인들도 많이 와서 불편함 그러나 지하로만 차가 다녀서 위험한 사고가 없다,4,한강이 주변이라 전망이 좋고 여름에는 시원합니다 30평 이상부터는 추위 더위에 별 상관없는 것 같고요 12평대는 각 abc형에 따라 확연한 차이가 느껴지네요
16156,리센츠,20대,남자,자가 거주,미혼,5,매우 추천한다. 지리적 위치가 너무 좋아 강님과 잠실역은 10분이면 갈 수 있다. 또한 지은 지 얼마 되지 않은 아파트이기에 외관이 매우 깔끔하고 관리가 잘됨,5,2호선 중심으로 잠실역과 강남역을 쉽게 갈 수 있다. 또한 버스를 타면 어디든 경기도 지역으로 쉽게 길 수 있는 위치이다.,5,잠실역에 백화점 마트가 있으며 단지 내에서 대형 슈퍼가 3개 존재한다. 또한 5분 거리에 한강이 있기에 산책하기에 매우 용이,4,출입문부터 비밀번호를 사용해야 하고 분수대와 놀이터가 설치되어있어 미관이 좋다. 마지막으로 주차장이 지하에 있어 지상에 차량이 존재하지 않음,5,한강이 바로 보이는 방. 더운 여름에도 바람이 잘 불어 시원하다. 하지 맘 겨울에 보일러 비용이 높게 나온다. 위층의 소총이 강하며 소음을 위한 개선이 필요.
16156,리센츠,30대,남자,자가 거주,기혼,5,너무너무 좋다 초등학교 중학교 고등학교 단지 내에 다 있을뿐더러 교육청도 단지 내에 있다 너무나도 완벽한 단지라고 생각한다.,5,신천역 2호선이랑 통로가 이어져있으면 삼성동과 잠실역 사이에 위치해있어서 교통이 편리합니다 또한 한강이랑 가까워서 산책하기 좋아요,5,마트도 근처에 있고 잠실역 근처에는 롯데마트도 있어서 신선하게 물건을 사다가 먹을 수 있다 그리고 근처에 올림픽공원이 있어서 자주 산책한다,5,아파트 경비원들이 열심히 일하시고 적극적이시다 외부인 들어오는 게 까다로우며 단지 내 관리도 엄청 잘되어있어서 쾌적하고 깨끗한다.,5,집이 잘 나와서 평수보다 더 넓어 보이고 햇볕도 잘 들어온다 판상형 남향이라서 그리고 지어진지 8년 정도 되었는데 층간소음이 없다
16156,리센츠,30대,여자,자가 거주,미혼,5,생활의 편의성이 최고다 백화점 마트 영화관 공원 야구장 등등 원하는 곳이 다 자가용 10분 거리다 게다가 강남권 출퇴근도 매우 용이하고 경기권으로의 출퇴근도 편하니 참 좋은 위치인 거 같다 다만 가격의 압박이 조금 있다는 단점이 있다,5,신천역 도보 10분 거리이고 삼성동 압구정동 가는 버스 매우 많고 강남권 생활 용이하다는 점 주말에 잠실역 롯데백화점 차량으로 그쪽 통행이 많이 막힌다는 점이 있으니 자가용 이용 시 우회해야 한다,5,단지 내 아파트 상가에 생활에 필요한 모든 상점들이 다 있어서 그곳만 이용해도 되고 롯데백화점 롯데마트 홈플러스 등이 자가용 10분 거리에 다 있다는 점이 좋다  올림픽공원도 자가용 10분 거리고 야구장도 자가용 10분 거리 영화관도 제 2 롯데월드 몰에 가면 된다,5,늘 청결이 유지되어 있는 단지와 주차장도 지하 2층까지 있어서 넉넉하다 단지 내에 오토바이는 다니지만 차량 출입은 통제되어 안전하고 늘 조경관리가 잘되어있어 상쾌한 기분이 유지된다,4,단지가 커서 단지에 따라 많은 차이가 있을 수 있으나 우리 단지는 남향이라 해도 잘 들고 양쪽 베란다를 열면 바람도 시원하게 통해서 좋다 층간 소음은 조금 있는 편이라 아래위 소리가 조금 들리는 편이니 조심해야 한다
16156,리센츠,20대,여자,자가 거주,미혼,4,주변에 야구장 롯데월드 백화점 영화관 한강 시장에 마트에 살기 너무 편한 곳이에요,4,지하철 버스 가까이 있어 편리합니다만 거주 위치에 따라 거리가 멀 수 있어요,4,아파트 상가에 맛있는 음식점도 있고 한강도 가까이 위치해있어 산책하기도 좋음,4,공용 현관 비밀번호는 각 집마다 다르기에 잡상인 출입이 어려우며 분리수거 하기가 편리하게 되어있는 거 같음,4,층간소음은 심각하지 않은 것 같음 아마 위층에 어린애들이 없어서 잘 못 느낄 수 있겠지만
16156,리센츠,20대,여자,전세 또는 월세,미혼,4,우선 교통이 굉장히 편리하고 주변 단지 조성이 잘되어있어 가족 단위로 거주하기가 아주 좋음  이용 가능한 버스도 많고 강남이나 강북 어느 쪽으로도 쉽게 접근이 가능함  내부시설도 좋고 주민들도 괜찮음,4,신천역까지 5분 이내 도보로 도착가능  잠실 일대는 차가 밀려 자가용 사용은 자제함  단지 바로 앞에 버스가 많이 다니진 않아 역까지 도보로 가는 경우가 더 많음,4,근처 상가들에 편의시설들이 잘 구비되어있으며  단지 내 공원 조성도 좋음  롯데백화점이 15분 근처에 위치하며 한강공원 잠실지구가 바로 앞에 조성되어있음,5,경비분들이 철저하게 관리를 해주셔서 단지 관리는 아주 만족스러움  관리비가 비싼 편이지만 그만큼 경비아저씨들이 잡상인 관리나 주차관리를 제대로 해주심,4,일조량은 동에 따라 다르지만 낮시간 동안에는 조명을 켜지 않아도 될 정도로 밝은 편에 속함  층간소음도 거의 없는 편이며 강을 보고 있어 통풍이 아주 잘되는 편임
16156,리센츠,30대,남자,전세 또는 월세,미혼,3,근처에 상권이나 주변 상황은 좋으나 너무 상가지역으로 인해 아파트 단지 또한 관리 및 소음이 그대로 전달돼 추천하고 싶지는 않다,5,잠실역이 모든 노선 및 지하철 다 있어 대중교통은 만족한다 하지만 주변에 자가 차량 운행 시 차가 너무 막혀서 많이 불편하고 뒤쪽으로 88도로 및 강변도로가 있어 강북 및 강서 강동 다 이동하기에 만족한다,5,"버스 노선 및 지하철 교통도 좋고 대형마트도 있고, 정문 앞에 신선한 야채를 파는 마트가 있어서 장을 보기 편하다. 주변에는 재래시장도 있고 바로 뒤에 위치한 한강도 있어 아이들을 자주 데리고 나간다. 공기도 주변 아파트보다 더 맑은 느낌이다",4,"잡상인 및 외부인 아파트 안으로 들어와 안전하지 못하다. 경비 아저씨가 불친절 및 택배 사소한 부탁도 들어주지 않는다. 그리고 경비 초소 한편에 모아 두시다 보니, 한 번 잃어버린 적이 있어 불안하다. 전체적으로 만족하지 못한다",3,"베란다가 넓어 만족 바람 및 통풍 잘 들어와 만족한다. 하지만 정남향 아파트라서 하루 종일 햇빛이 잘 들어와, 겨울에는 난방을 덜 할 수 있을 정도로 따뜻하다. 층간 소음은 잘 늦기지 못함, 아이들도 뛰어 놀 공간 충분하다고 봄."
16156,리센츠,60대 이상,여자,자가 거주,기혼,5,"가까이 대형마트, 백화점, 각종 상권이 잘 형성되어 없는 게 없습니다. 각종 교통뿐 아니라 지하철 2호선 등 교통이 좋을 뿐 아니라 걸어 5분에 한강이 있어 산책 겸, 학군도 좋고 공기도 맑고 주거 환거 환경이 좋습니다.",5,"잠실역 근처에 각종 광역버스 및, 순환선인 지하철 2호선이 있어 교통이 아주 편리합니다.  더구나 아파트 인근 한강변 고속도로 진입로가 있어 사통팔달의 동네입니다.  어딜 가든 모든 교통이 훤하게 연결되는 좋은 동네임",5,"신천역 주변의 잘 형성된 상가와 새마을 시장, 롯데 마트와 롯데백화점, 롯데 월드 몰까지, 신선한 모든 식품이 5분이면 모든 것의 구입이 가능하다.  단지 내 울창한 숲과 한강도 5분 거리여서 공기도 좋고 주로는 아주 좋은 쾌적한 동네임",4,"대단지의 특성상, 관리비가 저렴하고 많은 수목과 조경이 잘 되어있어 아주 쾌적함.  건축 시부터 잘 조성된 친환경의 아름다운 조경과 시원한 단지 내 도로 및, 충분한 녹지 공간이 있어 주거에 아주 만족함",5,하루 종일 햇살이 들어오고 공기의 흐름이 좋을 뿐 아니라 지역난방이라 난방비도 싸게 나오는 편이라 겨울이 두렵지 않습니다.  여름에는 한강 바람이 시원하게 불어 아주 더운 며칠 외에는 에어컨이 필요 없을 만큼 시원합니다.
16156,리센츠,30대,여자,자가 거주,미혼,4,롯데월드 한강 석촌호수 올림픽공원 등 가까이 편의시설 있어 거주하기 너무 좋아요 다른 곳으로 이사 갈 수가 없답니다. 층간소음도 없고 단지관리 잘되고 있답니다.,5,신천역 잠실역 인근이라 편해요 도보거리에 각종 편의시설 공원 등이 있어 어디든 도보로 다 해결됩답니다,5,제2 롯데월드 석촌호수 한강 올림픽공원 롯데마트 롯데백화점 등 영화관 쇼핑도 도보로 갈 수 있고 주변 여건 좋아요.,5,관리해주시는 분 있어요 경비아저씨도 성실하시고 친절하고요. 장거리 외출 시 외출 눌러 놓고 가면 외부 침입자 있으면 경고음 울립니다 안심돼요,5,층간소음 없고 일조량 많고 조용해요 여름에는 한강 바람이 불어서 시원해서 에어컨 정말 몇 번 안 켭니다.
16156,리센츠,30대,여자,자가 거주,미혼,5,교통 문화시설 편리해요!  학군도 좋고요  단지 내 초중고 교육청이 다 있어요!,5,버스가 자주 다녀서 편리해요. 지하철도 2호선이라 어디든 가기 좋아요!!!,5,슈퍼 편의점 제2롯월 한강공원 석촌호수 등 없는 게 없어요.,4,단지 내 지하로 주로 차가 다녀서 좋아요  안전하고요!!,5,"냉난방 불편한 것 없고, 햇볕도 잘 들어오고 뷰도 좋아요!!!"
16156,리센츠,30대,남자,자가 거주,미혼,5,교통 좋고 초중고 다 있고 한강 있고 관리비가 저렴함  버스 노선도 다양하고 공항버스도 바로 앞에 있음  강남과 매우 가까움,5,2호선 신천역과 가까움  올림픽대로와도 가까움  강남과 10분 거리임,5,한강공원이 붙어있음  잠실 롯데월드와 롯데마트가 붙어있음  새마을 시장이 가까이 있음,5,동마다 보안카드가 필요  지하주차장 전등 매우 밝아서 안전  단지 내 지상주차 금지라 안전,5,단지 내 초중고가 모두 있어서 편리  층간소음은 없음  동간 간격이 넓어서 햇빛이 잘들어옵
16156,리센츠,30대,여자,전세 또는 월세,기혼,4,종합적으로 판단했을 때 그래도 우위적인 위치 선점과 산책로 그리고 10분 거리에 한강 산책로가 있어 살기에는 좋답니다. 그러나 외부 소음 때문에 매우 추천은 아니고요 4점 정도요.,4,교통은 편리한데 자차의 경우 올림픽로 정체구간에 걸리면 밀리는 경우도 많아요. 출퇴근 시간대는 오히려 대중교통이 편리하더라고요.,5,"롯데마트, 롯데월드, 하이마트, 롯데월드 몰까지 도보 10분15분소요. 올림픽공원 15분 소요. 너무나 편리해요.",4,조경이 특히 잘 되어있어 주변 공원 못지않게 산책하기 좋아요. 대단지라 관리비도 저렴한 편입니다.,3,"제가 사는 곳은 작은 평수라 3인 가구 이상 가족이 살기에는 너무 좁아요. 그리고 방음이 안돼서 주변 올림픽대로 소음을 그대로 흡수해버린다는 단점이 있네요. 신혼부부, 단신 외에는 거주용으로 비추요."
16156,리센츠,50대,여자,전세 또는 월세,기혼,4,주변 상권도 다양하게 형성되어있어 맛집도 많고 마트도 많고 거주지역으로는 좋다고 생각합니다,5,신천역이 가깝고 버스정류장도 가까워서 편리합니다. 잠실역보다 덜 막히지만 출퇴근 시간에는 약간 힘들 때가 있습니다,4,근처에 새마을 시장이 있어서 편리하고 작은 마트가 상가에 있어서 편리합니다. 대형마트는 잠실역까지 가야 하는 불편함이 있습니다,5,단지가 깔끔하고 아파트 내부 청소도 자주 해서 유지가 잘 되는 편입니다,4,한강 근처라 춥지만 단열이 잘 되고 햇빛이 잘 들어와 낮에 따뜻합니다. 여름에는 바람 잘 통하고 괜찮습니다
16156,리센츠,30대,여자,자가 거주,미혼,5,모든 면에서 완벽함. 돈만 있으면 여기서 평생 살기 좋음. 집값 비싼 값을 해요. 도로 옆은 조금 시끄러운 면..,5,사통발달. 어디든 가능 지하철도 2. 8호선 다니고. 교통으로 어려움은 전혀 없어요,5,롯데마트가 코앞이고 홈플러스도 가까움  새마을 시장도 가격 매우 저렴.  저렴한 가게들이 주위를 둘러쌈.,5,매우 관리 잘되요 관리비도 합리적이며. 층간소음도 거의 없고 주차장도 깨끗하고 충분함,5,비싼 값 해요. 남동향 아파트는 여름에 시원 겨울 따뜻. 아이들 많고 단지 내 초중고 매우 조음
16156,리센츠,20대,남자,전세 또는 월세,미혼,4,평균 이상으로 살기 좋습니다. 가격이 조금 비싸기는 하나 전체적인 인테리어도 좋고 시설 및 주변 환경이 잘되어있어 좋습니다.,4,지하철이 5분 거리입니다. 버스정류장 또한 가까이 위치해 있어 언제든지 편하게 다닐 수 있습니다  추천합니다,4,주변에 초중학교가 가까이 있으며 나무가 많아 쾌적합니다. 또한 놀이터가 모래가 없어 안전하고 주변에 시설이 많습니다.,4,단지가 매우 깨끗하며 보안 이철 저하여 좋습니다 관리비 또한 저렴하고 매일 관리소에서 단지를 관리해주어서 언제든지 믿고 이용할 수 있습니다.,5,구조가 조금 좁아 보이기는 하지만 방음이 잘되어있고 창가가 환합니다 겨울에는 난방이 덜할 수 있을 정도로 따뜻하고 주변 이웃과 소음이 없어 조용하게 살 수 있습니다.
16156,리센츠,20대,남자,자가 거주,미혼,5,"집 앞에 한강과 롯데가 있고, 잠실 쪽으로 나가면 지하철, 버스 노선들이 다양해서 교통편이 편리하다.",5,신천역과 잠실역 사이에 있어서 교통이 편리하다.  잠실역에 버스들이 많이 다닌다. 하지만 차가 막혀서 대중교통 타기에 편하다,5,"한강과 가깝고, 롯데백화점과 롯데마트 조금 더 걸어가면 롯데월드타워도 있다.",5,아파트 안에 자동차들이 지나다니지 않아서 교통에 위험할 일이 없다,5,바로 앞동들이 아파트라서 답답한 감도 있긴 한데 나머지는 좋다
16156,리센츠,30대,여자,자가 거주,기혼,4,살기는 좋은 듯 안에 교육청이며 주민 단지며 학교며 없는 게 없고 한강이랑도 가까워 자전거 타고 갈 수도 있고 석촌호수도 가깝고,2,역에서 가깝다 하지만 단지마다 다르다  잠실역과 신천역 사이일 수도 있고,4,주변에 상권 발달 정말 좋다 롯데도 가깝고 석촌호수도 가깝고,3,그럭저럭 관리되는 중 불만족스럽지도 만족스럽지도 않다  무인 택배함이 있었으면 좋겠다,3,아파트 동마다 다름 앞에 한강이 보일 수도 있고 아파트끼리 보일 수도 있고
16156,리센츠,30대,여자,전세 또는 월세,기혼,3,한강이 가깝고 잠실이 바로 옆에 있고 롯데월드 몰 백화점 등 다양한 쇼핑시설을 이용할 수 있다. 단지 안에 학교가 있고 공원이 가까워서 좋지만 비싼 집값은 어찌할 수 없다. 집값 상승이 덜되었다면 살기 좋을 것 같다. 또한 층간소음이 있고 담배 피우는 사람은 꼭 있다,4,잠실 신천역 바로 이용 가능 다만 언제나 차가 막힌다. 특히 주말에는 교통체증이 심하다,4,롯데마트가 크게 자리 잡고 있다 한강이 매우 가깝다 공기도 시내 대비해서 좋은 것 같다,3,공용현관이 비밀번호 입력이 아닌 무조건 카드를 소지해야 해서 불편하다 관리비가 평수 대비 많이 나온다,4,층이 높아 일조량이 좋고 바람이 잘 통한다 단지 내 학교가 있고 층간소음이 있다
16156,리센츠,30대,여자,전세 또는 월세,기혼,4,가까이마트 놀이동산 학교 등 있어서 멀리 나갈 필요 없음. 학군도 조성되어 있어 오래 교육도 좋음.  그러나 집값이 비쌈,3,신천역이 도보로 5분 거리로 가깝지만 차가 항상 막혀 자가용 이용은 자제한다.,5,잠실 롯데마트 롯데월드 gsi슈퍼 등이 가깝게 있고 아파트 단지 내에 놀이터 산책로가 있기 때문에 멀리 나갈 필요가 없음,4,단지 청소 잘 되어서 깨끗하고 출입통제 주차장 관리도 잘됨. 항상 집에 거주해 있어서 택배는 잘 모르겠음,4,베란다가 넓게 트여 있어 바람 잘 통하고 뷰가 좋음 햇빛도 잘 들어오고 그러나 어느 아파트든 층간 소음은 있는 거 같음
