danji_id,danji_name,age,sex,residenceType,married,totalScore,totalDesc,trafficScore,trafficDesc,aroundScore,aroundDesc,careScore,careDesc,residentScore,residentDesc
22870,방배롯데캐슬아르떼,30대,여자,전세 또는 월세,기혼,3,"강남, 강북, 강서 다 편리하고,  대중교통 이용이 편리하며,  단지가 조용하고  학군도 좋은 편이다",5,7호선 4호선 2호선   트리플 역세권에다   버스도 많아   대중교통이 너무 편리하다,5,"전통시장,  대형마트  중소형 마트가  다 밀집해 있다.  극장도 가깝고, 백화점 나가기도  교통이 좋아 좋다.  다만 단지 내 상권이 별로다",3,주차장 입구가 놀이터에  근접해 있어 위험하다.  밤에는 너무 깜깜한 게 단점  커뮤니티는 보통이며  아이들을 위한 커뮤니티가  있었으면 좋겠다,3,층간소음이 심하다.  재개발 지역에 밀집해 있어  공사 소음과 분진이 많다.  확장형이라 넓게 빠진 건 장점.  일조권도 좋고 단열도 잘 되어있다.
22870,방배롯데캐슬아르떼,30대,여자,전세 또는 월세,기혼,4,이보다 더없이 좋을 순 없다.  교육면에서도 주거 환경도 깔 꿈 하고  동네도 조용하다,5,7호선 이수역과 2호선 사당역 이용 용이  버스는 노선이 노량진만큼.. 다양하진 않지만.  강남 나가긴 좋음,4,도보 15분 거리에 엄청 큰 전통시 잔 남성 시장이 있음. 대형마트도 있고... 단지 내 놀이터. 공원에서 놀기 좋음. 극장.. 편의시설도 가까이 있어  동네에서 모든 걸 해결할 수 있음,4,경비아저씨가 매우 친절하고 단지 내 택배차량 등. 차량이 서행할 슈 있게 관리가 잘됨.  청결한 편이며 청소를 자주하 시.,4,해가 많이 들어 난방비가 확실히 적게 나감.  하지만 주변애서 공사를 많이 해서 봄가을 먼지가...
22870,방배롯데캐슬아르떼,30대,남자,전세 또는 월세,미혼,5,"역세권 단지라 교통 편리하고, 인근 마트나 시장 상권 형성되어있고. 대신 길 건너라 단지 인근 지저분하거나 시끄럽지 않음",5,이수역 걸어서 3분이고 차막힐 일 별로 없고. 사당역 쪽에서 걸어서 10분 내. 사통팔달의 교통환경임.,5,역주변이라 시장 마트가 종류별로 다 있고. 길 건너에 백화점. 메가박스 이수 있어서 편리.,5,단지 내 공원 조경 굿이고. 관리가 잘돼서 깨끗한 편임. 단지와 외부와 경계가 있어서 외부인 출입이 없음.,5,단지가 조용하고 쾌적하고. 난방 잘되고. 단지 내 아이들이 많지는 않은 편이라 조용한 걸 좋아하는 분들은 안성맞춤
22870,방배롯데캐슬아르떼,30대,여자,전세 또는 월세,기혼,2,너무 비싸요 ㅠ 교통 식당 영화관 편의성 다 좋지만..비싼게 흠. 그래도 백화점 시장 다 있고 최고죠,5,"교통 지하철 2,4,7 호선 이용 가능 리무진 버스도 있음. 버스도 강남 고터 중앙대 여의도 가는 노선 다 있고 9호선 갈아타고 나가기도 좋아요",4,주택가 겸 쇼핑 겸 모든 게 다 있어요. 조용하고 한적하고 어둡지 않아서 좋아요.,4,경비가 철저. 분리수거 철저. 주차 처리 철저해서 곡벙할일이 전혀 없었어요,4,볕도 좋고 설계가 잘되어있습니다. 시원하고 따뜻하고 최고로 잘 빠진 복도형 설계 살았어요
22870,방배롯데캐슬아르떼,30대,여자,자가 거주,기혼,5,"깔끔하고 관리도 굿 편리함 만족 가까이에 대형 마트, 백화점도 있고 용산 가족 공원도 걸어갈 수 있어서, 주변 환경에 매우 만족한다. 이용할 수 있는 지하철, 버스 노선도 다양해서 출퇴근이 편리한데, 주변 아파트에 비해 가격이 저렴하다. 내부 시설도 살기 좋다",4,"7 4 호선 5분 거리 버스 집 바로 앞 버스정류장에서 탈 수 있다. 배차 간격이 짧아 출퇴근이 편리하다. 하지만 러시아워에 차가 항상 막혀, 자가용 이용은 자제하려고 한다.",4,홈플러스 이마트 근접 편의점 및 동네 마트 근접 큰 공원은 조금 나가야 있고 시장 백화점은 가까워서 좋다 산책로도 있다 단지 내 산책도 가능하다 놀이터도 적당히 있다 영화관도 가깝다 메가박스가 코앞이라 애용하는 편이다,4,굿굿 단지 내 시설 및 관리 굿 공용 현관의 비밀 번호를 자주 바꿔서 잡상인이 아파트 안으로 들어오지 못해 안전하다. 택배는 무인 택배함 잘 운영되고 피트니스 센터도 좋다 카페도 있다 조경이 좋다,5,"새 아파트 굿굿 여름에는 에어컨을 항상 켜야 한다. 하지만 하루 종일 햇빛이 잘 들어와, 겨울에는 난방을 덜 할 수 있을 정도로 따뜻하다. 아이들이 뛰어놀지 못하게 하느라 조금 답답하다."
22870,방배롯데캐슬아르떼,30대,여자,전세 또는 월세,기혼,4,트리플 역세권으로 교통은 더할 나위 없이 좋음. 가까이에 좋은 고등학교들이 있어 학군이 괜찮음. 세대 수가 적당하여 소란스럽지 않음. 시끄러운 역 주변 상가들과는 적당히 떨어져 있어 조용한 편.,5,"4, 7호선 이수역은 도보 510분 거리이고 2호선 사당역은 1015분 거리. 가까운 버스 정류장은 2곳인데 5분 거리로 다양한 노선이 지나감. 자가용 운전도 수월한 편.",3,"다양한 브랜드의 편의점이 510분 거리에 많음. 도보로 1015분 거리에 영화관, 이마트 제일 가깝게는 아파트 상가에 국가대표 마트, 5분 걸어가면 한라마트가 있고 차 타고 1015분 거리에 홈플러스 남현점이 있음. 걸어서 1520분 거리에 도구 머리 공원이 있음.",4,새 아파트라 관리비가 높은 편은 아님. 무인 택배함이 있음. 집 앞에 며칠을 놓아두어도 택배가 분실된 적이 없음. 주차 자리 넉넉한 편. 분리수거장을 포함한 공용 공간도 청결하게 잘 관리가 되는 편. 단지 내로는 외부인 출입이 자유롭지만 아파트 내부로는 외부인 출입이 어려움.,3,층간 소음은 심하진 않지만 있는 편. 확장형 거실이라 일조량 많기 때문에 여름에 냉방은 필수고 겨울에 난방은 덜해도 됨. 집 앞 뒤로 창문을 열 수 있어 환기는 원활함. 현관에 중문이 없기 때문에 시끄럽게 떠들면 현관 바깥으로도 소리가 새어나감.
22870,방배롯데캐슬아르떼,30대,남자,자가 거주,기혼,5,장재터널 개통과 서리풀공원에 예술공원 테마단지 조성   인근 대단지 아파트 조성에 따른 추후 가격 상승 예상되는 곳으로 강추,5,4호선 7호선 이수역과 2호 선방 배사당이 모두 도보로 가능한 초역세권,4,이마트 태평백화점 사당시장이 코앞이어서 좋다  주변에 근처에 공원은 부족하나 10분 거리에 우면산이용이 가능하다,4,청소 보안 주차관리 쓰레기 관리 양호하며 주차공간이 여유롭다,4,서문여중 여고 반포중 이수중 세화고 배정되는 우수한 학군과 방배동 일대에 가장 최근에 지은 아파트로 깨끗하다
22870,방배롯데캐슬아르떼,20대,남자,자가 거주,미혼,3,지하철역 가깝지만 환경이 아쉬움 또한 층간소음도 조금 있어 바로 옆방에 소음이 굉장히 심하다,4,가깝지만 이수역과 사당역 사이에 있어 조금 멀다 그래서 4점 하지만 버스정류장도 가까우니 그럭저럭 괜찮은 편이라고 할 수 있음,4,번화가다 그래서 4점 하지만 약간 어두움 또한 주변 상가가 아직 발전하지 못한 부분이 있다 대형마트는 도보로 이용이 불편하며 간소화된 마트만 이용 가능,4,전기값을 아낀다 그래서 4점 불도 어둡고 경비는 대신 좋다  택배함이 있어서 택배를 잃어버리거나 그러는 건 없음,1,담배 피우는 인원 관리 없음  어두움  방음 굉장히 별로  옆집 목소리가 다 들리는 정도의 최악 방음 수준
22870,방배롯데캐슬아르떼,20대,남자,전세 또는 월세,미혼,4,추천할만함 근처에서 가장 정돈되어있고 새집이라 그게 우선 많이 먹고 들어 감 깨끗하니 잘되어있음,5,지하철 가깝고 버스정류장 가까움 굉장히 편함 출퇴근은 모름 차가 없음,4,주변에 이 단지가 생기고 편의시설이 많이 생겨서 행복함 많은 좋은 상가들이 생기고 편함 거의 없는 게 없음,1,관리사무실  돈만 받고 일 하나도 안 함. 특히 편의시설 관리 전혀 안됨. 독서실 관리 전혀 안 됨.,1,냉난방 방마다 에어컨 다 있고 새집이라 시스템 전부 새 거임 최첨단 시스템 많음 편함
18295,방배아크로타워,40대,여자,전세 또는 월세,기혼,4,지하철2 7 호선이모두지나가고공원도걸어갈수있어서 좋다추천합니다,5,방배역1분거리내방역8분거리라편리하다 버스노선도잘되어 있다,4,대형마트가 가까운곳에없어서불편하다 놀이터가있어좋고 길건너공원도있다,4,관리비가비싸지만 쓰레기관리가 잘이루어진다  택배관리주차관리도좋다,4,해빛은 잘 들어오지 않는다 냉난방은 잘된다 층간소음이 별로 심하지 않다
18295,방배아크로타워,20대,남자,자가 거주,미혼,4,방배역과 내방역 사이에 있어서 교통이 매우 편리하며 주변에 대형마트들도 많아서 주변 환경도 좋습니다. 바로 앞 방배 먹자골목이 있기 때문에 많은 먹거리들까지 있습니다. 내부시설 또한 좋습니다. 하지만 주변 소으이 약간 있어서 4점을 주었습니다.,5,"방배역과 내방역 사이에 있어서 교통은 정말 편리합니다. 주변에 버스 정류장도 상당히 많습니다. 방배역은 도보 5분 거리이고, 내방역은 도보 8분 거리입니다.",4,주변에 홈플러스 하이웨이 마트 등등 대형마트 편의점 소형마트들이 많이 있습니다. 도보 3분이면 바로 홈플러스 도착입니다.,4,공용 현관 비밀번호와 출입카드가 있어야 들어갈 수 있어서 안전합니다. 경비아저씨 2분이 계시고 엄청 친절하십니다. 단지 안에 작품도 전시되어 있어서 눈도 즐겁습니다.,4,아파트 3층 베란다는 정원으로 되어있어 꽃을 심고 식물을 기를 수 있으며 a동은 정남향 아파트라서 햇빛도 잘 들어옵니다. 층간 소음도 없습니다. 보일러 시설도 잘 갖추어져 있습니다.
18295,방배아크로타워,40대,남자,자가 거주,기혼,5,편리한 장지터널 개통을 앞두고 있어 강남 직통도로를 갖게 될 예정이며 지하철 2호선 방배역 7호선 내방역의 더블역세권의 편리한 교통 멀지 않은 곳에 예술의 전당 청계산 우면산 바로 앞에 효령대군 묘가 있어 산책하기 좋다 헬스장과 안전한 자전거 보관소가 있으며 아파트 내부가 아주 깔끔하며 주차공간이 넓어 문콕 사고 없음 인터넷과 케이블티브이가 아파트 잡수입에서 처리되어 무료 제공되며 대형단지에 비해 관리비가 오히려 싸다 서울고 인접하여 학군도 좋으며 나 홀로 동이어서 저평가되어 있음,5,강남과 인접한 도로 장지터널 개통되면 강남 직통이고 2호선 7호선 인접 교통에 대해 더할 나위 없이 좋음,5,먹거리가 많아 야식 걱정 없음 아파트 밑에 상가가 있고 마트 병원 볼링장 골프장 등이 있어 편리함 없는 것 없음,5,경비실을 통한 입구라 경비를 통과해야만 함 택배 관리 잘되며 고화진 cctv가 사각지대 없이 설치되어 안전함 입대의 임원들이 청렴해서 모든 회의 사항 지출 의결사항 재정을 공유하며 단독 아파트임에도 관리비가 아주 쌈 무엇보다 주차공간이 아주 넓어 문콕 사고의 위험이 전혀 없음 특히 100메가 인터넷과 케이블티브이가 아파트 잡수입에서 처리되어 관리비 절감 효과가 크다,5,층 간고가 높아 층간소음 거의 없으며 B동의 경우 겨울에도 해가 길어 따뜻해서 난방비가 적게 나옴 헬스장과 안전하게 자전거를 보관할 수 있도록 지하에 자전거 보관소가 넓게 별도로 있으며 고화질 cctv가 많이 설치되어 있어 도난의 걱정이 없음 3층의 경우 테라스가 2미터 정도 있어 화단 등 공간 활용도가 높다
18295,방배아크로타워,30대,여자,자가 거주,기혼,5,가까이 홈플러스 있고 예술의 전당도 가깝고 고터도 가까워 편리하고 살기도 좋고 주변 시세보다 저렴한데 아파트 괜찮음.  아이 둘 키우는데. 아랫집에서 올라온 적 없고. 지하주차장도 2층이나 사용해 항상 여유로워서 너무 좋다.,5,"지하철이 5분 거리 2호선 방배역이 있고, 버스 교통 편리해서 서울대 방면, 양재 방면, 강북, 강남, 과천 등 교통은 무지 편하다.  차 타고 다니기도 좋고 버스도 많아서 선택권이 다양함",5,"가까이 방림시장도 있고 먹자골목도 있어서 편리하다.  조금만 나가면 사당에 홈플러스가 있고 고터에는 신세계백화점, 마트 등 이용하기 편리하다. 바로 앞에 우면산이 있는데, 산책하기에 좋고 공기도 좋음! 또 바로 옆에 예술의 전당이 있어 문화생활도 편리하다.",5,경비 아저씨 계시고 청소하시는 분 따로 있어서 깨끗  주차장 관리도 좋음 택배보관도 확실,5,창이 커서 여름에는 시원하고 겨울에 난방비 적게 나옴  정남향이라 그럴지도..
6138,르메이에르,30대,남자,전세 또는 월세,미혼,5,"매우 좋은 위치, 층간소음이나 침수피해 걱정없이 튼튼하게 잘 지어진 집임은 분명하다 향후 사당역 주변에 복합환승센터, 대형쇼핑몰 등 이 생기면 더욱 편리해질 것이고 가격도 주변에 비해 저렴한 편이다 다만 한동짜리 나홀로 아파트라는 점은 분명한 단점이고 초등학생 자녀가 있는 경우 학교가 멀어 라이딩해야하기 때문에 비추천한다 각 지역 접근성이 좋기 때문에 직장인들과 신혼부부, 중장년 층에게는 추천한다",4,"지하철역에서 여유있게 잡으면 15분소요이나 빠른걸음으로 가면 10분이다  대신 4호선 사당역, 7호선 남성역에 모두 걸어서 접근가능하다는 점이 장점이다 버스정류장은 매우 가깝다 자차의 경우 이보다 좋은 위치는 없다  단지앞이 바로 남부순환로이니 자차로 이동하는 직장인들에게는 좋은 위치이다 지차가 아니더라도 광역버스의 경우 사당에서 수원, 과천, 용산ktx(4호선15분), 광명ktx(직행버스 8507번 20분)등 모든 곳에 접근 용이하다",5,"남부순환로 대로 안쪽에 한적한 곳에 있어서 조용하고 공기가 깨끗하다 앞에는 gs편의점과 무인셀프세탁소가 있어서 편리하다 걸어서 갈수있는 남성시장이 가까이에 있고, 대형마트는 이마트와 홈플러스가 근처에 있어서 장보기 편리하다",5,단지관리는 매우 잘되고 있다 오래된 아파트에 비해서 깨끗하고 관리비도 저렴한 편이다 작은 단지임에도 조경도 신경쓰고 이중주차 걱정 같은건 전혀 없다,5,2000년초반에 지어졌던 집이라서 중국인 인부들이 짓는 요즘 집들과 달리 부실공사나 층간소음이 거의없다 일조량은 봄 여름 가을엔 더울정도로 많고 해가 잘 들어온다 지대가 높다보니 홍수피해는 단 한번도 겪어보지 못했고 아무리 홍수가 나도 지하주차장에 물 한방울 들어오지 않는다
6138,르메이에르,20대,여자,자가 거주,미혼,4,"층간소음없고 주변이 시끄럽지 않은 아파트에 살고 싶다면 추천. 교통을 생각하면 절대 비추, 버스 지하철 한번 타려면 매일 언덕을 넘어야 한다.",3,사당역까지 가는데 적당한 걸음걸이로 15분 정도 걸리는데 적응이 절대 안되는 거리.. 언덕도 있어서 다니기 불편하다,4,주변에 편의점이랑 세탁소 가까운거 빼면 딱히 장점이 없다. 시끄럽지 않은거랑 동이 한동짜리고 가까운 다른 아파트가 없어서 탁 트인 도시뷰를 볼 수 있다,4,딱히 불편한 사항은 없다. 청소 깨끗이 하고 정기적으로 물탱크 청소도 하고 관리는 문제없다,4,방이 3개라 가족이 충분히 쓸 수 있다. 층간소음은 없다. 주차장까지 엘리베이터가 오진 않아서 계단으로 내려가야하는데 그거빼면 괜찮다.
6138,르메이에르,40대,남자,자가 거주,기혼,5,사통발달 요지인 사당동의 저평가된 아파트라 생각됩니다 사당동은 꾸준한 호재가 있는지 역으로 향후 이 아파트는 한 단계 높이 평가받게 될 거라 생각됩니다 실제로 3년 전부터 매물 거래가 활발하고 전세 매매가가 급격히 상승하고 있습니다  직접 방문하여보시면 더욱 잘 알게 되실 겁니다,4,"2,4호선 사당역 10분 7호선 남성역 도보 12분 2호선 낙성대역 11분 도보 역세권 직접 측정한 시간이며 강남순환도로 개통 남부순환로 인접하여 사통발달 지역입니다 2019년 장재터널 개통으로 강남 테헤란로 지역과 연결되는 강력한 호재도 존재합니다",3,홈플러스 사당점 이마트 이수역점을 이용 가능하고 아파트 입구에는 gs편의점이 있으나 가게는 없습니다 경사로를 가야 하지만 까치산 공원 산책로가 있고 주위엔 빌라촌으로 조용한 주택가에 위치하고 큰대로 안쪽으로 위치하여 차량 소음은 없습니다,5,140세대의 작은 단지이지만 아파트가 매우 튼튼하게 지어졌으며 깔끔합니다 누수되는 곳 결로 되는 곳 없고 층간소음은 보통입니다 경비실 노인정 여름 쉼터 어린이 놀이터도 잘 갖추어져 있습니다 가족 같은 분위기로 입주민들 서로들 인사하면서 지내고 스스로 꽃나무 등을 잘 관리하셔서 단지 내가 이쁩니다 경비원 아저씨도 친절한 편입니다,4,주위엔 빌라들이 에워싸고 있어 5층 이상은 조망권이 우수합니다 지상주차장도 20면 정도 있고 지하주차장은 지하 2층까지 연결되어 편리하고 세대당 1.1대로 주차 시 문제없습니다
6138,르메이에르,20대,여자,자가 거주,미혼,4,교통도 그럭저럭 괜찮고 대체적으로 주변 환경도 괜찮다. 주민간의 배려심이 다들 많아서 인심을 느낄 수 있다.,3,"남성역, 사당역과 가까워서 지하철 이용에 편리하다. 대신 그쪽으로 가려면 오르막 길을 올라야 해서 불편하다.",4,"바로 앞에 중학교, 편의점이 있고 골목길이 많아서 좋다. 중학교 운동장이나 시설을 이용할 때 편리하지만 오르막 길이 상당히 많다.",3,"불친절한 경비 아저씨가 영입되실 때도 있지만 대체로 친절하시고 아파트 앞에는 넓은 마당과 주차장(지하 주차장도 있음), 놀이터까지 있어서 만족하는 편이다. 대신 동이 4개밖에 없고 작아서 불편하다.",4,층간 소음은 거의 없는 편이고 공사하는 것이 있으면 주민분들이 다들 엘리베이터에 공사 안내문과 양해문을 붙여 놓으셔서 정말 좋다. 베란다가 조금 작아서 아쉽다.
6138,르메이에르,30대,여자,전세 또는 월세,기혼,3,가격이 중요하신 분들은 가격대가 괜찮아요  하지만 교통편 과시장 접근성은 매우 낮아요  공기는 좋을 것 같다 차가 많지 않은 것도 아이 키우는 집으로서 만족한다,1,아파트 단지가 큰 길가에서 많이 들어온 편이라 대중교통이용은 거리가 상당하다 남성역 이수역 사당역 모두 성인 걸음걸이로 10분 이상 소요되고 버스는 제일 가까운 노선이 752라 갈아타야 하는 번거로움이 있다,1,큰 도로에서 많이 들어오는 위치라 매연이 적은 편이라 비교적 먼지가 적을 것 같다 주변에 놀이터 공원이 있어서 아이들과 시간을 보내기 좋다 바로 앞에 중학교가 있어서 운동하기도 좋을 것 같다 하지만 마트는 거리가 멀어서 급할 땐 제일 가까운 곳이 gs25 편의점을 이용해 야한다는 것이 불편하다,2,여기는 단지 입구에 따로 보안이 안되어있다 인적이 드문편이라 잡상인이 들어오거나 한 적은 없지만 그럴 가능성은 많다 주차장에 연결된 엘리베이터가 없는 건 단점이라 할 수 있다 하지만 청소하시는 분을 매일 아침 볼 수 있을 정도로 깨끗하게 청소해주시고 아파트 주변도 비교적 깨끗하다 관리비도 평수에 비해 저렴한 편인 거 같다 택배보관을 맡긴 적은 없지만 경비실이 하나이고 위치가 애매해서 찾고 하는 게 좀 번거로울 것 같다,3,오전에 해가 잘 비추고 저녁 석양도 잘 비춘다  겨울에는 비교적 따뜻한 편이다 층간소음은 크지 않은 편이다 하지만 아랫집은 우리 집이 시끄러운지 여러 차례 조용히 해달라고 하셔서 아이 단속하느라 조금 불편하긴 하다
6138,르메이에르,30대,여자,전세 또는 월세,기혼,4,"교통 편리하고 근처에 롯데슈퍼, 재래시장, 병원, 약국 등 있으며 관악산과 근접해서 공기가 좋아요. 또 물가가 저렴한 편이고요. 만족스럽습니다.",5,"사당역 5분 안 되는 거리, 버스 정류장 1분 거리, 길가 도로면 평지에 있어서 편해요",4,"관악산 가까워서 공기 좋고 많이 번잡하고 복잡하지 않으며 근처에 시장, 마트, 병원, 약국 등이 있어요. 교통 매우 편리합니다.",5,깨끗하게 관리 잘해주시고 관리비도 많이 나오는 편 아니며 주차 관리 등도 잘 되어 있어요. 청소도 깔끔하게 해주시고 관리인 친절하세요.,4,"전망이 좋으나 위치에 따라서 도로가 보이는 쪽은 전망이 좋지는 않아요. 1층과 지하가 아웃백이라서 장단점 있고요. 방 넓게 잘 빠졌고, 그에 비해 시세 괜찮은 편이에요."
6138,르메이에르,30대,여자,자가 거주,기혼,4,층간 소음문제가 심각한 요즘 지어진 아파트와 달리 15년 정도 된 아파트라 일부 리모델링하여 사용하는 것에는 문제가 없습니다. 큰 언덕 없이 주변 평지에 가깝습니다.,3,사당역 이수역 남성역 모두 이용 가능하나. 전철역까지 약 10분 이상 걸어야 합니다.  단지는 조용한 편이며 아파트 튼튼하여 층간소음으로 문제 된 바 없습니다.,3,"근처 편의점, 세탁소등 있어 급한 편의 시설은 있는 편이지만 단지가 작아 아파트 근처 학원이나 음식점 등은 없습니다.",5,청소 아주머니 두 분께서 항상 각층 열심히 친절히 정리해 주시고 경비아저씨 역시 택배 등 친절히 맡아주시는 편입니다.,4,단지가 작고 놀이터가 조용하고 구성이 괜찮은 편인데 너무 그늘진 곳에 있다 보니 이용자가 거의 없습니다.  주변 놀이터에서 주로 아이들이 노네요.
6138,르메이에르,20대,여자,전세 또는 월세,미혼,3,교통만 빼면 좋은 아파트예요 가격 도적 당하고 페인트칠을 새로 해서 그런지 아주 깔끔해 보여요 또 편의점 외에는 좀 걸어야 먹을 거든 살 곳이 든 있어서 불편하긴 해요,2,역이랑 너무 멀어요 한참 안으로 걸어와 야해요 사당역 남성역 이수역 사이라서 어디를 가든 많이 나가야 해요 버스도 근처에 없어요 너무 외져서 택시도 잘 안 가려 해요 교통은 진짜 너무 불편해요 교통이 제일 중요한 듯,3,큰 편의점이 있어서 좋아요 좀 많이 걸어 야하지만 이수역사당역 둘 다 번화가라서 먹을걸 놀 것은 많아요 놀이터랑 주위에 공원도 있어서 좋아요,4,남성중 아이들이 가끔 와서 담배를 펴요 그것 빼고는 경비아저씨들이 잘 관리해줘요 하지만 순찰 돌 때 한 명은 경비실을 지켜주셨으면... 한분이시라 좀 불안해요,4,복도식이라 층간소음 밖에 소음이 심해요 그리고 벽이 얇은 건지 작게 말해도 복도 소리가 다 들려요 일조량은 아주 좋고요 근처 빌라 주택 중 제일 높아서 그런지 해는 잘 들어옵니다 산경 치도 무척 이쁩니다
