danji_id,danji_name,age,sex,residenceType,married,totalScore,totalDesc,trafficScore,trafficDesc,aroundScore,aroundDesc,careScore,careDesc,residentScore,residentDesc
240,대우효령,30대,여자,전세 또는 월세,기혼,3,우선 근처 아파트 대비 매매 전세 금액이 저렴한 편입니다 주차시설은 좀 부족하지만 주변 학군도 좋고 교통시설은 최고입니다 출퇴근 시 문제가 안돼요~~~ 리모델링하며 더욱 살기 좋겠죠,5,지하철역에서 도보 5분 거리고 근처에 버스정류장도 있어 교통편은 최고예요 마을버스도 바로 앞이에요,3,공기는 좋으나 마트 등 편의시설이 단지 내에는 없어요  홈플러스는 차로 10 분거리에 있어요,4,경비원 아저씨들이 너무 친절하세요 택배도 잘 맡아주시고 관리도 싼 편입니다,3,예전 구조의 아파트라 외풍이 있고 가끔 녹물이 나와요.. 층간소음도 무시 못하고요
240,대우효령,60대 이상,남자,자가 거주,기혼,5,"편리한 교통, 깨끗한 주거 환경, 주 벼보다 저렴한 가격 등 장점이 많고 특히 학군이 우수하다.",5,"방배역이 도보로 3분, 내방역 도보로 10분, 사당역 마을버스로 5분 걸리고, 아파트 단지 정문 앞에 버스정류장이 있어 교통 펀이 매우 편리함.",5,"아파트가 산으로 둘러싸여 있어 공기가 쾌적하고, 주 벼에 상가가 잘 조성되어 있어 생활이 아주 편리함",5,아파트 관리체계가 매우 양호하여 입주민이 아주 만족하며 거주.,4,"주변이 산으로 둘러 쌓여 매우 쾌적하고, 남향 이파트라 햇빛이 잘 들어온다."
240,대우효령,20대,여자,자가 거주,미혼,4,가까이에 시장. 방배 먹자골목이 있고 방배 유스센터 등 아이들이 갈 수 있는 곳도 있다. 아파트 바로 앞에 버스 정류장이 위치하였고 10분 도보 이용 시 지하철도 있다. 내부 시설 또한 살기 좋은 편이다. 화장실이 두 개다. 하지만 오래된 아파트라 비밀번호를 치고 들어간다던지 하는 안전문제에서 취약한 편이다.,4,집 앞에 버스정류장 있음 그리고 방배역과 굉장히 가까운 편임(지하철) 출퇴근이 편리한 편이다. 사당역과도 굉장히 가까운 편이므로 교통 면에서는 만점을 주고 싶다.,3,마을버스로 몇 정거장 이내에 대형 마트가 있고. 단지 내에는 상권이 조성되어 있지는 않다. 매주 수요일에 정기적으로 주차장에서 시장이 열리는 것 빼고는.. 그러나 주거지로서 적합하고 방배 시장과도 가까운 편이다.,3,공용 현관의 비밀번호 같은 것이 없다. 안전 문제에서는 조금 취약할 수 있겠다. 하지만 경비원들도 많고 이상한 사람도 살면서 보지 못했다. 단지의 청소는 훌륭하며 지하 주차장이 있어 편리하다.,4,"단지 내는 시원한 편이다. 놀이터가 아파트의 중심에 위치해 아이들이 노는 모습을 웬만하면 베란다로 쉽게 다 볼 수 있을 것이다. 놀이터가 두 개 있어 한 놀이터에서는 주민들이 시원하게 앉아 있는 모습을 볼 수 있다. 층간 소음도 적고, 나름 괜찮다."
240,대우효령,30대,남자,자가 거주,미혼,2,언덕이 높아 다니기가 불편하고 아파트 자체가 오래되어 보완점이 다소 많은 편이다. 다만 방배역 주변에서 가성비 측면을 고려하여서는 나쁘지 않을 수 있겠다.,3,바로 앞 버스정류장이 있어 편리하고 택시가 잘 잡히는 편이나 방배역 특성상 88 대로 혹은 강북까지 가기 오래 걸릴 수 있다. 특히 최근 내방역 이후 구간부터 공사를 하고 있어 차가 상당히 밀린다,4,백화점 등 대형 쇼핑센터는 없으나 방배역 사거리에서 웬만한 것들은 모두 찾을 수 있다. 단지 내 공기는 좋은 편이나 언덕이 높아 어르신들이 다니시기에 매우 불편하다.,3,"경비가 상주하고 있으나 오래된 아파트의 특성상 방범 출입통제 등에 보완해야 할 점이 많으며, 주차공간이 부족하지는 않으나 길이 협소하여 초보 운전자들은 주의할 필요가 있다.",3,일조량은 괜찮은 편이나 층간 소음이 심하고 아파트가 오래돼어 내부구조에 인테리어 공사가 반드시 필요할 것으로 보인다.
240,대우효령,30대,남자,전세 또는 월세,미혼,4,방배역 쪽이라 가격이 비싼 게 흠이지만 서울 강남권에서는 저렴한 가격이며 마트 학원 병원 등 가까이 있고 많이 있어서 생활하는 데는 불편함이 없다 단지 단점이라면 아파트 지은 지 오래되은 게 단점이라 할 수 있겠다,5,버스정류장이 도보 1분거리에 있고 방배역도 도보 5 분거리에 있어 편리하다. 강남역도 가깝고 경부고속도로도 차로 10분거리라 편리하다,5,도보 5분 거리에 방배역이 있어서 병원 마트 시설을 이용하기 편리하다. 우면산도 도보 20분 거리 한강도 도보 2030분이면 갈 수 있어 환경적으로 만족한다,4,경비아저씨가 관리해주셔서 택배나 보안에 안전하다고 느낀다 주차장이 지하가 없어 많은 대수를 할 수 없는 게 불편하다,4,햇볕도 잘 들어오고 바람도 잘 들어와서 만족한다  단열도 잘되어서 여름에는 시원하고 겨울에는 따듯하다  층간소음도 적어서 만족한다
240,대우효령,50대,여자,자가 거주,기혼,4,"만족한다. 이웃주민들도 좋고 대중교통도 잘 되어있고 주변 학교나 분위기도 좋다. 사당역이나 강남역도 가깝고 근처에 올리브영, 패스트푸드점, 은행 등 다양하게 많이 있다. 다 뜯어고치고 들어온다면 좋을 듯!",5,"방배역에서 한 10분 잡고 올라와야 한다. 생각보다 가깝지 않은데 그 이유가 오르막길 때문이다. 그래도 직진하면 아파트가 나와서 편하다. 방배역 2호선이어서 편하고 집 앞에 버스정류장이 두 개가 있는데 461, 350, 641 등이 다닌다. 마을버스도 많아서 다니는 데 불편함이 전혀 없다",4,"큰 마트가 근처에 없어서 불편하다. 자가용 차가 있다면 양재 이마트랑 코스트코, 킴스클럽까지 있어서 편하지만 없다면 매우 불편하다. 아파트 단지 내 놀이터가 두 개가 있어서 편하고 맞은편 도로에 공원이 있다. 하지만 한 번도 안 가봄. 뭐 나쁘지는 않은 듯",4,경비실이 각 단지마다 하나 씩 있고 매일 경비원이 상주해서 불편함은 없다. 하지만 보안에 크게 도움되는 지는 잘 모르겠다. 왜냐하면 아파트 안에 들어가는 입구가 활짝 열려있어서 아무런 문제없다. 주민인 척한다면... 경비원들이 많아서 그런지 관리비 비싸다. 택배보관은 잘 해주심!,3,몇 동에 사냐에 따라 다르지만 전반적으로 쾌적하다. 빛도 잘 들어오고 바람도 분다. 근데 아파트가 오래돼서 그런지 겨울에 찬바람이 솔솔 들어온다. 리모델링하는 거 아니면 좀 추워서 난방 많이 해야 한다. 층간 소음 있으니 조심해야 한다. 말소리 물소리도 들린다.
240,대우효령,20대,여자,자가 거주,미혼,4,돈만 있다면...추천 아 다만 아파트 단지 내 주차공간 부족이랑 가까이 마트 없음.,5,"역이랑 7분 거리에 집 앞에 버스 총 6대 다녀요 461, 350, 641, 서초 17, 15, 16 이렇게",3,다 좋은데 좀 언덕에 위치함 그래서 올라오기 힘듦 근데 주변에 공원 없음 그래도 안에 놀이터 두 개 있음.,4,각 동마다 경비아저씨 있어서 편함. 알아서 다 관리해주시고 청소해주시는 분들 굉장히 빈번하게 보고 다들 깔끔하게 잘 이용함.,4,주민들 다 좋음 그러나 백석예대 들어오면서 시끄럽고 학생들 많아짐 상점들 많이 생겨서 좋으나 학생들 많은 거 좀 별로.
240,대우효령,30대,여자,전세 또는 월세,기혼,3,어린아이들이 아니라면 중고등학생이 있는.. 특히 주변 서울고 상문고를 다니는 아이가 있는 집이라면 더할 나위 없는 집이라고 생각된다. 개별난방이라 자기관리에 따라 비용처리가 되고.. 역세권이면서도 금액이 저렴한 편이며 리모델링 이야기가 나오고 있어서 투자에도 좋을듯하다,5,"방배역 도보 5분  바로 앞 버스정류장에 마을버스 및 일반버스 정차, 건너편 공항버스정류장도 있어 좋다.. 앞쪽 대로가 막히는 도로가 아니라 남부 터미널쪽 사당역 쪽 다 편리하다. 그러나 바로 앞에 횡단보도가 없어 언덕 구름다리를 건너던지 내려가 횡단보도를 통해 건너야 한다는 단점이 있다",4,마을버스 타고 10분이면 이수 남성 시장도 갈 수 있고 사당역에 가면 모든 생활편리시설이 다 있어서 좋다.. 그리고 얼마 전 아파트 옆쪽으로 편의점도 크게 생겨서 좋다.. 뒤에 매봉재산 이 있어서 산책하기도 좋고 공기도 다른 곳에 비해 좋은 편이다,3,주차가 힘들다....ㅡㅡ지하주차장이 있지만.. 넓지 않고 저녁 늦게 들어오면 이중주차를 하던지 해야 한다.. 재활용은 수시로 버릴 수 있어서 좋고 택배도 아저씨들이 관리를 잘 해주셔서 좋다.. 놀이터도 2개다 깨끗하고 아이들이 뛰어놀기 좋게 잘 되어있다,4,남향이라 해도 잘 들고 옛날 아파트라 나무들도 많고 좋다.. 그러나 층간소음이 있고 녹물이 가끔 나온다
22870,방배롯데캐슬아르떼,50대,남자,자가 거주,기혼,5,"지하철 트리플 역세권과 다양한 버스노선(공항,시내,시외)의 우수한 교통여건, 인근의 대형병원 및 대형 백화점 등 탁월한 생활편의, 조용하고 쾌적한 주거여건 등 제반 환경이 매우 좋음",5,"지하철 3개 노선(2,4,7호선)의 트리플역세권  이고,버스노선도 많을뿐 아니라,최근 서리풀터널개통으로 교통여건은 최고임",5,"신세계백화점,태평백화점 등 대형 백화점과  서울성모병원 등 국내최고의 메이저병원이 있고  관악산과 청계산 산림욕장 접근성이 좋아  주변환경이 매우 양호함",5,"단지내 각종 편의서설이나 커뮤니티(헬스장,골프연습장,탁구장, 독서실,각종 회의실,샤워실 등)가 매우 우수함",5,주변의 주택단지내에 위치하여 아주 조용하고 단지내 산책공간이 매우 좋음 향후 인근에 대형 재개발단지가 조성될 예정이어서 더욱 전망이 좋음
22870,방배롯데캐슬아르떼,50대,여자,자가 거주,기혼,5,일단 학군과 교통이 우수하고 반포에 비해 공기며 조요한 분의기가 좋으며 주변 시설이 다 좋아요,5,교통 완전 최고죠 고속화도로 예술의전당 강남성모병원및 주변에 각종 유명병원이 도보로 가능하다는점,5,교통이 편리해 어디든 갈수 있고 특히 서울고속화도로가 근처에 있어 코스코 양재점도 10분이면 간다 더할수 없이 편리한 대중교통 노선도 만족함,5,휘트니스관리가 잘되고 무료요가도 있어 편하게 이용하며 골프연습장과 독서실이 있어 저렴하게 시설을 이용해 편리하고 좋음,5,층간소음 전혀 없었고 주변 나무나 환경이 깨끗해 매우 만족함. 반포보다 공기가 좋은데 가격은 훨씬 싸서 가성기 최고의 아파트임
22870,방배롯데캐슬아르떼,50대,남자,자가 거주,기혼,4,교통 쇼핑 학군 다 좋고 시설 및 관리 조용한 입지로 매우 좋으나 가격이 너무 비싸서 감점요인이 있음  큰 길 건너 동작구 가면 물론 품질은 떨어지나 가격이 6-70%에 불과,4,"4,7호선 이수역, 2,4호선 사당역 지하철 매우 편리하고, 고속터미널이나 남부터미널도 매우 인접함  버스 노선 많음",4,이마트 남성시장 사당시장 태평백화점 유통권 좋고 방배경찰서 인근 치안 좋음 공원은 없지만 사당역 남성역 둘레길 인근임,4,"매우 친절한 관리사무소이며 청소,보안, 택배 관리 등   대체적인 관리수준이 높음",4,"비교적 동간 간격이 넓어 여유로우며, 햇볕도 잘드는 편 조용한 거주지역 위치  다만 4호까지 있는데 엘리베이터 하나인게 불편"
22870,방배롯데캐슬아르떼,30대,여자,전세 또는 월세,기혼,5,주변환경이 너무좋고 교통입지또한우수하며 초등학교도 도보로가능하고 주변이 주택가라 조용하며 새로지은지얼마되지않아서 깨끗하다,5,지하철역에서 5분내거리로 가깝다 버스정류장도 3분내거리라 가깝고 교통입지가 무지조음,5,이수역이마트가있고 이수메가박스도있고 남성시장도 가깝고 주변에 작은마트나 편의점도많다.아파트단지가커서 산책도용이.,5,지은지알마되지않아서 깨끗하다 주차시설 택배시설도 잘 갖춰져있고 경비아저씨들도 너무 친절하며 아파트관리비도 저렴한편이다.,5,앞이 뻥뚤려있어서 시야를 가리지않고 관악산이보이고 주변에 큰도로가없어서 소음도없고 해도잘들고 바람도잘들어온다
22870,방배롯데캐슬아르떼,20대,여자,전세 또는 월세,미혼,4,"대중교통을 이용하기 정말 편리하며 주변에 많은 마트들과 여가생활을 즐길 수 있어 좋고, 단지 내에 관리가 좋아 안심이 된다. 하지만 그런만큼 아파트의 가격이 좀 나간다.",5,"지하철역과 버스정류장이 도보 3분 거리이고, 그래서 통학에 문제가 없었다.",5,집 주변에 음식점이나 마트와 여러가지 여가생활을 즐길 수 있는 시설들이 굉장히 많이 있고 도보로 조금만 더 걸어가면 백화점도 볼 수 있다.,5,"단지 안에 있는 쪽문을 막아두어서 수상한 사람들이 들어올 수 없도록 하였고, 문마다 경비 아저씨들이 있어서 안심이 되었다.",5,베란다도 있고 여름에는 덜 덥게 겨울에는 덜 춥게 지낼 수 있다. 지어진 지 좀 되었지만 층간소음이 별로 있지 않다. 그리고 넓은 공원이 있어 산책을 하기 좋고 헬스장이 있어서 운동하기 좋다.
22870,방배롯데캐슬아르떼,30대,여자,전세 또는 월세,기혼,1,"역세권은 출퇴는은 최고,마트도 가깝지 않고 주변 아파트값에비해 너무너무 비싸다 .층간소음 너무 심해서 이집저집 불만이 많다",5,이수역 바로앞이고 버스정류장도 가캅고 강남 나가기도 좋은위치.그러나 이수역은차가 너무 많아서 항상 막힘,1,슈퍼 대형마트가 가깝지 않고 차가없으면 장보기불편. 재래시장도 사당동 까지 나가야함.주변공원도 없어서 한강공원까지 나가야함. 역세권이라공기질은 좋지않다,3,아직은 잘관리되고있음.청소도 잘되고있고 입구도 경비아저씨가 잘관리하심.,1,층간소음 심함 아이들집에서 절대 뛸수없음.  앞이 트여있어서 여름엔 바람이 잘들어오나 겨울엔 넘 춥다 난밧비 많이나옹
22870,방배롯데캐슬아르떼,20대,남자,전세 또는 월세,미혼,4,전반적으로 주변에 각종 편의시설이나 식당이 가까움에도 단지 내는 조용하며 교통은 세개 호선이 근방에 있어 매우 편리하다.,5,"도보5-10분 거리에 4,7호선 이수역과 2,4호선 사당역이 있어서 대중교통이 매우 편리하다. 다만 평소 차는 막히는 편이다.",4,정문앞에 편의점이 있고 사당역 근처에 홈플러스가 있다. 자전거를 타고 십분정도면 한강에 도착한다.,4,"경비원 분들은 성실, 친절하시고 주차장도 충분히 넓고 택배보관함이 있어 편리하다.",4,남향이라 일조량이 좋으며 층간 소음은 크게 못 느끼는 편이다.
22870,방배롯데캐슬아르떼,30대,남자,전세 또는 월세,미혼,5,"우선 교통이 매우 편하고, 단지 관리가 너무 잘되있다.",5,이수역 부근이라 교통이 매우 편리하고 버스도 잘되어 있다.,4,사당역 부근이라 음식점도 많고 파스텔 시티도 주변에 있다. 대형마트 걸어서 갈 만한곳이 없는것이 단점,5,단지 내 청결과 보안이 매우 잘되고 있다. 공용시설도 매우 잘 관리되는 편,5,일조량 매우 풍부하고 단지내 조성을 잘해놔서 매우 조용하다.
22870,방배롯데캐슬아르떼,20대,남자,전세 또는 월세,미혼,4,주변에 이런저런 시설도 많고 메가박스도 바로 앞이고 환경도 좋아요. 비싼 게 문제지요.,4,"인근 지하철은 2,4,7호선. 사당역에 버스 노선 다수고 강남순환로도 편리. 길이 막히는 건 흠",4,"이마트, 홈플러스, 하이웨이마트, 하나로마트, 편의점 등 편의시설 다수. 산책로는 도구머리길이 있으며 벚꽃이 좋음",4,단지 내 차도가 극히 적어서 안전. 경비도 어르신은 아니고 전문 경비업 직원들. 관리가 철저,4,앞에 복개천이 있어서 탁 트임. 냉난방 잘 됨. 주변에 재건축이 예정되어서 5년 내로 공사 소음이 발생되지 않을까 함.
22870,방배롯데캐슬아르떼,50대,여자,전세 또는 월세,기혼,4,대중교통편 재래시장 다양한 마트 여러과목의 병원의 접근성이 우수하여 살기 좋으나. 방음은 약한편으로 아쉽다. 이수 사거리 이수역 사거리 교통량은 잘 알려져 있는것 같이 복잡하다,4,"지하철 이수역 4,7호선 사당역 2호선 걸어서10분 이내 가능하며 시내버스 인천 공항버스 역시 3분이내 거리에 있어 교통 편리성 우수함",4,"이마트. 메가박스, 재래시장인 남성시장. 태평백화점, 토요 벼룩시장, 금요일 토요일 열리는 서초구 먹거리장터를 이용할 수 있어 장보기 편리하며 이수역 사거리의 밀집해 있는 개인병원이 근거리에 있다",4,"무인택패시스템과 정문 경비실에서 택배 보관 및 반품을 처리하주어 편리하다. 주민 커뮤니티 시설로 스포츠센터. 골프연습장, 북카페, 독서실, 게스트룸, 샤워장, 스크린골프 등으로 활성화 되어 있다",4,신축한지 4련된 아파트로 시설 깨끗하고 평수에 대비 구조도 우수하다. 지상에 벤치나 작은 공원이 부족하여 내부 산책은 어려움이 있다.
22870,방배롯데캐슬아르떼,40대,여자,전세 또는 월세,미혼,4,"편의시설, 대중교통시설, 강남 용산으로 근접한 거리, 교육여건에서 모두 매우 만족합니다. 가격이 비싼 것이 제일 큰 흠이 되겠지요. 그래도 아파트값이 크게 빠질 걱정이 없는 것은 또 장점입니다.",5,이수역과 1분 거리에 위치. 이수역이 4호선 7호선 환승역이여서 더욱 편리합니다. 시내 버스 정류장도 가깝고 마을버스도 배차가 잘 되어 있는 편입니다.,4,슈퍼 마크 편의점 백화점 모두 가까운 거리에 위치해 있습니다. 뱍화점은 소규모로 태평백화점. 강남 신세계는 차로 10분 거리에 위치하여 편리합니다. 산책로는 뒷산에 도구머리길이 있으나 쾌적한 편은 아님.,4,단지가 매우 큰 대단지는 아니어서 깨끗하고 관리가 잘 되는 편입니다. 아파트 상가 뿐만 아니라 조금 더 나가면 식당이나 편의시설이 곳곳에 잘 배치되어 있음. 정문초소도 크게 잘 되어있음.,4,베란다가 넓게 트여있고 전망으로는 관악산 봉우리가 보여서 깨끗한이미지 입니다. 도로가 가까운 거리에 있지만 차소리로 있한 소음은 거의 없는 편. 창으로 들어오는 일조량도 충분합니다.
22870,방배롯데캐슬아르떼,30대,여자,자가 거주,미혼,5,비싸서 그렇지 교통 환경시설 말이 필요없요 시장도 병원 교통 대형마트까지 다있습니다 터미널도가까워요,5,2호언 4호선 7호선다 걸어갈수있고 두말하면 입아픔 버스노선도 엄청말아요,5,백화점 교통편 조용하고 사당역도 가깝고 마을버스도 셀수없다,5,좋다 경비아저씨들 상주 새거라 깨끗하고 좋아요 헬스장도 있어요 실내골프장도있음,5,빌트인이 너무 잘되어있습니다 화장실에 인터폰 티비 다되어있구요 방마다 에어컨 있고 공원도 잘되어있어요
22870,방배롯데캐슬아르떼,20대,여자,전세 또는 월세,미혼,5,주변에 여러 가지 시설들도 있고 매우 편리하다 특히 교통이 편리한 게 매우 마음에 든다. 또한 아파트 단지 내에 어린이집이 있고 주변에 초등학교가 있어서 좋다. 공기가 조금 나쁜 건 아쉽지만 그래도 전반적으로 훌륭하다,5,근처에 버스정류장이랑 지하철역이 있어서 매우 편리하고 자가용 타도 바로 사당 쪽으로 가서 관악구랑 과천으로 가거나 아니면 반포 쪽으로 가서 고속터미널도 갈 수 있어서 매우 편리함,5,"근처에 마트나 편의점이 여러 군데 있고 아파트 바로 앞에 공원이 있으며 도보 5-10분 거리에 영화관, 백화점, 시장, 음식점 등이 많아 매우 편리하고 지내기 좋음",5,아파트가 전체적으로 매우 깨끗하고 관리가 잘 되어있다. 아파트 내 편의시설도 항상 관리가 잘 되어있어서 부담감이 전혀 없다.,4,전체적으로 다 괜찮지만 아쉬운 점은 주변에 차들이 많이 다니는 큰 도로가 있어서 공기는 그다지 좋지 않다. 그래도 햇빛이 잘 들어오고 층간소음도 별로 없어서 괜찮다.
22870,방배롯데캐슬아르떼,30대,여자,전세 또는 월세,미혼,5,"이 아파트 단지는 2,4호선 사당역과 4,7호선 이수역 사이에 있는 단지라 3개 지하철 라인을 모두 이용할 수 있다. 지하철이 가깝고 버스정류장도 가까워서 서울 내 이동이 편하다. 서울 내 이동하는데 중심부에 위치하여 어디든지 이동할 때 1시간 내로 걸려서 위치도 좋다. 편의점. 영화관이 근처에 있고 마트도 차로 가까운 편이라 너무 좋은 단지다. 친절하신 경비분들도 단지 내에 많아서 안전하며 치안이 좋다. 무인 택배함이 아파트 라인마다 있어서 부재 시 택배 받을 때 편하다. 아파트 내 시설들 헬스장 골프장 독서실도 쾌적하고 좋다. 이수교차로 퇴근길 막히는 것 빼고는 교통도 좋다. 단점은 가격 빼고 없다고 생각한다. 매우 추천하는 단지다.",4,사당역 이수역이 근처다. 버스정류장이 가깝다.   이수교차로가 막힌다.,5,단지 앞에 바로 편의점이 있다. 영화관이 가깝다. 대형마트도 차로 15분 내에 있다.,5,단지관리상태 매우 좋다. 무인 택배함이 있다. 공용현관이 잘되어있다. Cctv가 설치되어있다.,5,냉난방이 잘되며 에어컨이 모두 붙박이로 방마다 설치되어있다. 일조량도 좋은 편이며 층간소음 없다. 겨울에 난방도 방마다 따로 설정할 수 있어 편리하다. 아파트 사이 간격은 그리 넓지 않은 것 같다. 주변에는 주택가가 많은 편이다.
22870,방배롯데캐슬아르떼,20대,여자,전세 또는 월세,미혼,5,홈플러스 이마트도 가까워서 장보기도 좋고요 남성 시장도 있어서 제례시장 분위기도 즐길 수 있습니다. 특히 교통이 너무 좋아서 어딜 가든 편합니다.,5,"지하철 4,7호선 같이 다녀서 어딜 가든 가깝게 매우 빠르게 갈 수 있습니다. 역세권이죠",5,맛집들도 많이 있고 빵집 카페 많습니다. 십 분 거리에 사당 파스텔 시티 있어서 더 좋습니다. 서점도 있습니다. 아파트 내에 공원 있습니다,5,통제 잘 되어있고 경비원들 일 잘합니다. 잡상인들 온 적 없네요. 무인 택배함 있어서 좋고요 늘 깨끗합니다. 관리비도 비교적 저렴한 편입니다.,5,일조량 좋고요 동네 자체가 조용해서 너무 좋네요. 바람도 잘 들어오고 붙박이로 에어컨 설치되어 있어서 너무 좋네요
22870,방배롯데캐슬아르떼,30대,남자,자가 거주,미혼,4,교통편 좋습니다. 동네 번화가 사당 이수 사이에 있음에도 불구하고 조용합니다. 한강까지 자전거 타면 10분에서 15 분이면 갈 수 있습니다. 주위에 초 중 고 학군에 대해서 걱정 없으실 거고요,5,지하철 버스정류장 포함 서울시내와 경기권으로 나갈 수 있는 대중교통 도보로 10분 거리에 있습니다,5,극장이 집 앞에 바로 있고요 먹자골목 시장부터 대형마트 지역 백화점 병원도 어떠한 지형지물 방해 없이 편안하게 도보로 이용하실 수 있습니다.,3,아직까지는 분리수거를 하는데 있어 정확한 기준이 잡히지 않은거 같아요. 아파트 관리하시는 분들이 고생만 하시겠죠,3,너무 좋습니다. 햇빛이 잘 들어와 따듯하고요 여름에는 블라인드로 더운 열기는 충분히 막아줄 수 있어서 좋습니다. 지하상가를 통하여 목적지를 오고 갈 때 돌아갈 필요도 없고요 단 최근에 지어진 아파트 치고는 층간소음이 다른 비슷한 시기에 완공한 아파트보다는 방음이 부족합니다.
