danji_id,danji_name,age,sex,residenceType,married,totalScore,totalDesc,trafficScore,trafficDesc,aroundScore,aroundDesc,careScore,careDesc,residentScore,residentDesc
946,은마,50대,여자,전세 또는 월세,기혼,3,교통은 지하철 3호선 대치역 학여울역 연결되어 매우 편리하나 건물이 노후되어 불편합니다 그래도 밤늦게도 치안이 좋아 아이들 학원 보내기도 좋아요.,5,지하철 3호선 대치역. 학여울역 연결 2호선 삼성역 버스 환승 가능 교통 매우 편리. 버스도 사통팔달 매우 편리합니다.,5,병원 학원 은행 백화점 등. 모든 제반 시설이 구비되어 있어 매우 편리하고 학교도 좋으며  양재천 대모산 자연환경도 좋아요.,3,건물 노후되어 불편하지만  경비원이 있어 쓰레기 분리수거도 편리하고 택배 관리도 쉽고 편합니다.,3,중앙난방이라 덥고 추울 때 스스로 조절 불가.  햇볕은 남향이라 잘 들어와 따뜻하다.
946,은마,50대,여자,자가 거주,기혼,3,"워낙 오래된 아파트라 간혹 내부가 너무 오랫동안 손을 안 본 집들이 있기는 하나 깨끗이 수리한 곳은 교통, 생활, 편의 시설들이 매우 잘되어 있어 추천한다.",5,대중교통이 잘 되어 있다. 버스나 지하철 등 역세권이라 어디든 사통팔달로 편리하게 이용할 수 있다.,4,"도보로 롯데백화점 강남점, 하이마트 본점 및 양재천, 대모산 등이 가까이 있다",3,세대수에 비해 단지는 조용하고 녹음이 많은 편이나 오래된 아파트라 주차공간이 부족하다,3,판상형이라 남향의 경우 장점이다. 오래된 반면 층간소음은 심하지 않다.
946,은마,20대,여자,자가 거주,미혼,5,확실히 현대백화점 롯데백화점도 근거리에 있고 교통 또한 편리하고 주변 학원가로 인해 분위기가 안전하고 아이들이 거주하기 매우 좋다,5,한티역까지 도보로 15분 정도 걸리고 대치역은 10분 거리라 매우 편리함. 버스 노선도 다양하고 배차 간격도 짧아서 좋다. 자가용을 이용하면 출퇴근 시간에 막히는 점도 있다.,5,"도보로 8분 이내에 은마상가가 있고, 상가를 제외해도 주변에 음식점 및 술집 그리고 학원가라 포장마차 등등 많이 있어서 좋다. 단지 내에 놀이터와 주변에 벤치로 앉아서 휴식할 공간이 많다.",4,주차장은 지상이지만 아파트 거주민만 들어올 수 있기에 편리하다. 택배는 경비아저씨가 보관해주신다.,3,"일조량과 냉난방 모두 흡족하지만, 층간소음이 불편하다. 방음이 잘 안되고 아이들이 많이 거주하는 탓에 밤에 소음이 잘 들린다"
946,은마,20대,여자,자가 거주,미혼,4,교통이 편리하고 귀갓길이 안전하다. 주변 아파트에 비해 가격이 저렴하고 편의시설이 가까워서 이동하기가 편하다.,5,버스정류장과 지하철이 가깝다. 버스의 배차간격이 짧다. 하지만 밤 10시 이후에는 학부모들이 학생들을 데리러 오기 때문에 교통이 다소 혼잡하다.,5,앞에는 은마상가가 있고 뒤쪽으로는 마트가 있다. 도보로 10분에서 15분을 걸어가면 양재천이 있다. 애완동물들을 데리고 다니기에도 좋고 그냥 산책하기에도 좋다. 여름에는 다리 밑에서 더위를 피하기 좋다.,4,큰 문제가 없다. 외부인들이 많이 너무나들지 않고 최대한 청결하게 관리를 한다. 큰 문제가 있다면 엘리베이터 고장이 빈번하다. 이것은 아파트가 오래됐기 때문일 수도 있다.,4,중앙난방이라 편하다. 방음이 비교적 잘 되는 것 같고 하다. 하지만 복도식 아파트라서 엘리베이터 가까운 쪽에 사는 사람들이라면 소음이 신경 쓰일 수 있다.
946,은마,30대,여자,전세 또는 월세,기혼,5,주변이 전부 마트여서 시장 보기 너무 편해요. 출퇴근 교통도 너무 편하고요. 어디를 가든 딱 중심인 것 같아요,5,대치역 바로 앞이고 도롯가가 전부 버스 타는 곳입니다  너무너무 편해요,5,양재천이 있어서 운동하기 너무 편하고요 은마상가가 있어서  병원이든 뭐든 없는 게 없어요,3,24시간 교대로 경비아저씨들이 있어서 도둑이나 들 염려가 없어요. 택배는 아저씨가 받아서 집에 올라갈 때 주세요. 보관이 너무 편해요,3,오래된 아파트이긴 하지만 정남향이라서 채광이 좋고 통풍이 너무 잘되요. 그리고 층간소음이 거의 없어요
946,은마,30대,여자,자가 거주,기혼,4,교통환경이 무척 좋고 주변 아파트 단지 내에서 모든 걸 해결할 수 있을 만큼 편의시설을 모두 갖추고 있으나 오래된 아파트라 이미지가 좋지 않고 미관상 좋지 않습니다  주차시설이 따로 없어 주변 길이 매우 혼잡합니다,5,매우 편리함 여러 호선의 지하철이 모두 연결되어있고 그렇지 않더라도 버스와 모두 연결되어 있음  ,5,"슈퍼, 마트 등 모든 편의시설이 주변이 많아 가까운 어디에서든지 장을 볼 수 있음  양재천도 가까워서 산책하기 좋고 살기에 편리함 ",4,오래된 아파트라 불편함 택배는 동마다 경비실이 있어 맡기지만 공간이 협소하고 집 앞에 두고 갈 경우 분실 위험 많음,4,난방도 중앙난방이라 겨울에 난방비가 저렴하고 한겨울에도 반팔을 입어도 될 만큼 따뜻함  여름에는 창문을 열면 시원함 층간소음 있음
946,은마,30대,여자,전세 또는 월세,미혼,3,"오래되었지만 주변 환경이 좋아서 살기는 편함, 집마다 내부 수리 정도의 차이가 큰 듯",5,"단지가 워낙 커서 동에 따라 지하철과의 거리는 다르지만 제일 먼 곳도 큰 불편함 없이 이용 가능, 특히 아파트 출구에 에스컬레이터 있어서 편리. 버스는 아파트 둘레 네 군데 모두 있어서 매우 편리",5,학원가 근처라 밤에 30분-1시간 정도 차가 엄청 막힘,3,워낙 오래된 아파트라 나무 등이 많아 좋지만 반대로 세월의 흔적을 가리기 힘듦,3,큰 불편함 못 느끼며 대체로 만족하며 거주하고 있음  동 간 간격이 넓은 편인 듯... 따라서 햇빛 잘 들어옴
5683,도곡삼성래미안,40대,여자,자가 거주,기혼,5,"대도초등학교, 숙명여중고, 중대부고가 아파트 단지와 나란히 있어 학군이 최고이고, 교통도 펀리합니다. 아파트 입주민들이 교양있고 남을 배려할 줄 압니다.",5,"3호선과 분당선 도곡역이 5분 거리이고,잠실,서초,과천,광화문 등에 한 번에 가는 버스 노선이 많습니다. 서울시내는 주로 남부순환로를 이용하고, 경부고속도로와 용인서울고속도로 IC가 가까워서 지방 가는 길도 편리합니다.",5,"길건너에 롯데프리미엄, 롯데마트,신세계마트 등이 있고 아파트 단지 안에는 슈퍼마켓과 세븐일레븐 편의점이 있습니다. 길건너에 내과, 이비인후과, 피부과, 정형외과 등 유명한 전문의 병원이 많습니다.양재천 공원과 매봉산 공원이 바로 앞에 있어 운동하기에도 좋습니다.",5,"입주자대표회의 운영이 잘 되고 있어 관리비 운영이 투명하고, 장기수선충당금을 적재적소에 잘 사용하여 관리하고 있이 18년된 아파트임에도 낡은 느낌이 들지 않습니다.아파트 게스트하우스에서는 커피등 음료를 입주민에게 저렴하게 제공합니다. 아파트에서 운영하는 독서실이 관리사무소 건물 지하1층과 2층에 있는데, 고급브랜드의 책상과 의자, 공기청정기가 비치되어 있고 입주민 자녀들에게 저렴한 비용으로 이용할 수 있게 하고 있습니다. 아파트 주민만 이용할 수 있는 헬스장에도 다양한 기구가 많이 비치되어 있습니다.",5,"매봉산에서 불어오는 바람으로 여름에는 시원하고, 최근 난방배관 공사 이후 난방이 더욱 잘 되어 겨울에도 따뜻하게 지내고 있습니다."
5683,도곡삼성래미안,40대,남자,자가 거주,기혼,5,강남에서 전원생활하는 느낌을 가지면서 강남의 편의시설은 모두 이용가능한 아파트. 시끄럽고 번잡한것이 싫지만 강남에 살고 싶다면 최고의 아파트.,5,도곡역 3호선 분당선 이용 편리하고 경부고속도로나 중부고속도로 제2영동고속도로 등을 이용하기 매우 좋은 위치임. 아파트 바로앞에 공항버스 정류장이 있어 공항 이용도 편히,5,매봉산이 뒤에 있으며 비온뒤면 강남 한복판이라 생각하기 힘들 정도로 공기가 좋음. 아파트에 들어서면 공기 자체가 다름. 롯데마트 신세계ssg 모두 가까워 이용이 편리하고 단지내 슈퍼도 작지만 없는것이 없어 편리,5,경비실 관리나 단지관리사무실 관리 잘되는 편임. 택배관리 잘되며 관리실에서 여러가지 일들 지원이 잘됨. 관리비도 저렴한편임,5,동과 동사이가 적당히 떨어져 있어 쾌적한편이고 단지에 외부인이 들어오지 않아 조용하고 위험요소가 낮음. 대부분 남동향이어 효율도 좋은 것으로 알고 있음
5683,도곡삼성래미안,60대 이상,남자,자가 거주,기혼,5,교육여건 최상이고 주변에 유해시설이 전혀없어서 자녀들이 있는부들에게 최고의 여건 나이드신 부들은 바로 엎에 강남세브란스병원이 있음,5,집앞에서 강북과 강남권일대 시내버스가  있고 공항버스6009번이 시간당 3~4회  다녀서  인천공항 가기도 매우 편리하고 전철역도 10분이내에 갈 수 있음,5,"단지 뒷편에 매봉산이 있어서 수시로 가벼운 등산을 할 수 있고, 10분 거리에 양재천이 있어서 산책하기가 매우 좋음",5,여러 얘기가 필요없을 정도로 관리가 잘되고 있고 단지내 조경이 매우 좋음 계절마다 꽃을 식재하여서 주민들에게 만족을 느끼게 함,5,단지내에 소형 마트와 세탁소 등 약간의 편의시설이 있고 지하에 헬스장은 저렴하게 이용할 수 있으며 학생들은 자체 독서실이 있엇니 좋음
5683,도곡삼성래미안,30대,남자,자가 거주,미혼,3,교통도 괜찮고 마트도 주변에 있어 괜찮지만 주변 주상복합과 아파트에 비해 제일 집값이 싸다.,4,도곡역과 매봉역이 걸어서 10분 거리이고 버스 정류장이 아파트 입구 바로 앞에 있음. 하지만 집앞 사거리는 출퇴근시간에 차가 많이 막힘.,4,스타슈퍼가 걸어서 10분거리이고 아파트 입구 맞은편에는 롯데마트가 있어서 장 보는데에 용이하다. 그리고 차로 10분을 가면 역삼 이마트도 있다.,4,아파트 들어올때 입구에서 방문자와 거주자 차 검사를 하고 아파트 입구에서 거주자 카드를 찍어야 들어갈 수 있다.,3,바로 옆에 동산이 있어 여름에는 벌레가 많다. 또한 우리동 뒷편에 매봉터널이 있어 새벽에는 차들이 달리는 소리가 들려서 방음창을 달았다.
5683,도곡삼성래미안,40대,여자,전세 또는 월세,기혼,2,학교 바로 옆이라 그학교를 목적으로 주거하기는좋다. 그러나 학원이나 식당등 이용하기에는불편한 입지,2,지하철역은 조금 먼편이고 안쪽동은 10분정ㄷㆍㄷ  버스는반대편 건너갈때 건널목이 돌아서가야해서 많이불편하다.  공항버스타는것은 편함,1,주변에 아무것도 없고. 학교만 같은블럭임  유해시설. 없으나. 너무 아무것도 없어서 불편하다,4,관리직원들도 친절하고 커뮤니티도 좋은 편  정원도 굿.  독서실이나 운동시설도 아쉬운댈ㆍㄷ 좋다,4,층간소음은 있는편  동에따라 일조량은 차이날듯  뒷동아님 조금 시끄럽고 어두울거같다
5683,도곡삼성래미안,20대,여자,전세 또는 월세,미혼,3,"가까운곳에 우리가 쉽게 이용하는 마트 , 버스정류장 등이 있어서 편리하다",3,차가 많이 막힌다 하지만 버스정류장이랑 가까워서 대중교통을 이용할때 편리하다,1,장을 보기 편하고 이쁘다 자주 나가서 산책도 하고 친구들이랑 사진도 찍으면 이쁘다 공기가 좋다,1,이상한 사람들이 안 들어와서 좋다 하지만 비밀번호를 자주 바꿔서 기억하기가 어렵다,1,여름에는 시원하고 겨울에는 따뜻하다 하지만 뛰어놀지 못해서 아쉽다
5683,도곡삼성래미안,20대,남자,전세 또는 월세,미혼,4,일단 중학생 고등학생 자녀를 키우신다면 학원가(대치동)바로 옆이기에 교육 시키기 편하실겁니다,5,집 바로 앞에 버스 정류장이 있고 3분 거리에 한티약 분당선이 있습니다.또한 코엑스와 강남역 두군데 중간지점에 있어 어딜 가려해도 편히 이동할 수 있슴니다.,5,강남약과 코엑스 중간지점에 있어 이동이 편이하고 집 4분거리에 롯데백화점이 위차하면 학원가 근처입니다,5,담배냄새 안나게하고 쓰레기 제때 처리하고 벌레가 나오면 관리 다해줍다,3,층간소음 문제에서 약간 문제가 있습니다 유독 저희 윗쪽이 시끄럽긴하나 그것 이외에는 문제가 없습니다
5683,도곡삼성래미안,20대,남자,전세 또는 월세,미혼,5,가격은 비싸지만 다 살만한이유가있고 집근처에 고등학교도있어서 학생을 둔 부모는 매우좋다.,5,도보3분 도곡역 집앞에 바로 버스정류장이 있어서 매우 교통이 편리하다.,5,맞은편에 마트가있고 편의점도있고 단지안에 공원있다. 그래서 매우 편리하다. 공기도 주변 타 아파트보다 좋다.,5,단지안이 매우 청결하게 관리된다. 흡연할 곳도 많이 없다보니 어린자녀를 둔 부모들은 매우좋을것이다.,5,일조량 충분하다. 층간소음도 거의없어서 시끄러웠던적이없다. 겨울에는 집이 좀 추웠던적이있지만 각 방은 난방이 잘된다.
5683,도곡삼성래미안,20대,여자,자가 거주,미혼,4,우선 모든 생활조건이 좋지만 물가가 상당하다 주변이웃들도 매우 친절하다,3,도곡역이 5분거리지만 차가 매우매우 막힌다 버스도 402덕분에 강남역 20분 생활권이다,5,양재천이 있어서 산책하기에 매우 좋다 그리고 슈퍼는 아주 많이 널렸고 한티역으로 조금만 가면 백화점이 있다,5,공용현관으로 이상한 사람 들어온건 딱한번 부동산아주머니였고 한번도 의심스러운 사람을 만난적이없다 택배 관리도철저하시다,4,일조량은 타워펠리스때문에 별로이다 하지만 뒤에 바로 산이 있어서 서울에서 산의 혜택을 받고 있는 아파트라는 사실에만족한다
5683,도곡삼성래미안,20대,여자,전세 또는 월세,미혼,5,살기 좋고 교통 편하고 조용하고 주변에 여러 시설이 많아서 불편하지 않다.,5,"지하철 3호선, 분당선이 근처라 교통이 편하다. 그리고 버스도 많다. 기본적으로 주변에 시설이 많아서 굳이 차 타고 멀리 나갈 필요가 없다",5,주위가 조용하고 백화점 공원 등 시설이 다양해서 살기 좋다.,5,경비가 잘되고 안전하다고 느낀다. 단지에 대해서 불편함을 느낀 적 없다.,5,불편한 점을 느낀 적 없다. 관리비가 많이 나오지만 그럴만하다고 느낌
5683,도곡삼성래미안,20대,여자,자가 거주,미혼,5,저번에 아파트값 1억 올랐습니다. 좀 더 오를 전망이 보입니다. 돈 많은 사람들은 이곳에 노후를 계획해도 좋습니다. 바로 근처에 강남 세브란스 대학병원이 있어 크게 다쳤을 시 바로 응급처치가 가능합니다. 돈 많으면 꼭 여기 사세요.,5,뒷문 쪽으로 횡단보도를 건너면 3호선 매봉역이 있음. 정문으로 8분 정도 걸어가면 3호선 도곡역이 있음. 차가 잘 막히지 않아 좋음.,5,매봉 터널을 지나면 바로 근처에 롯데 백화점이 있음. 맞은편 아카데미스위트 지하에 롯데 슈퍼가 있음. 회사가 몰려있는 곳이라 직장인들이 끼니를 때울 수 있는 가게나 음식점이 많음.,5,관리사무소가 곳곳에 있어 치안 걱정이 없음. 관리비는 아파트 값에 비해서 적당하다고 생각함. 중상위층 정도면 부담이 없을 것이라 생각합니다. 택배 쪽으로는 문제가 된 적이 없습니다. 친절하고 좋아요.,5,층간 소음은 없었음. 난방은 잘 되는 편임. 살던 102동은 일조량이 좋은 위치에 있음. 뒤쪽에 매봉산이 있어 산 근처에 있는 동은 공기가 맑고 좋은 대신에 햇빛이 덜 들어옴. 여름에는 벌레가 좀 꼬임.
5683,도곡삼성래미안,20대,남자,자가 거주,미혼,3,"교통편과 단지관리에 대해서는 불만이 있지만  집에서 일하는 사람들에게는 최고의 아파트가 될 수도 있을 거 같다. 환경이나 내부 구조등 등은 최상이기에  그래도 내 선에서 봤기에 3점을 준다.  집에서 일하는 사람들의 입장에서 4점, 5점까지도 줄 수 있을 거 같다.",2,아파트가 넓어서 나가는데 시간 다소 비하고  버스정류장이나 역까지 가는 것도 거리가 있고...  버스나 지하철이 생각 외로 잘 안 와서 불편  자가용 이용하기에도 차 많이 막혀서 교통면으로는  불편함이 많다.,4,근처에 마트들이 많고 상가가 잘되어있어서  나름 편리하다. 상가 사람들 또한 친절하고  웬만한 편의시설 등등이 좋다. 또한 아파트 내 환경 또한 깨끗한 편. 담배꽁초도 많이 안 보여서 깨끗해 보인다,1,공용현관 비밀번호 웬만한 사람들이 다 안다.. 저번에 배달시켰더니 매번 그냥 올라와서 음식 준다.  택배 아저씨들도 경비실이 아닌 집 앞에 택배 두고 간다.. 출입에 대해 뭐라 하는 건 아니지만 보안에 신경 썼으면 좋겠다.,4,방이 넓고 소음도 없다. 여름에는 냉방을 굳이 안 틀어도 시원한 감이 있고 겨울에도 난방비 많이 안 든다.  베란다로 햇볕도 잘 들어서 빨래가 잘 마른다.  층간소음이 없으니 아이들도 잘 뛰어놀 수 있고  대체로 만족한다.
5683,도곡삼성래미안,20대,여자,전세 또는 월세,미혼,5,차가 다닐 때 소음이 있지만 동네 자체는 조용한 편이고 밤에도 안전하며 접근성이 좋고 단지가 갈 가꿔져 있어 살기 좋다,4,매봉역 도곡역 둘 다 가깝다  횡단보도가 아파트 바로 앞에 없어 길 건너에 가려면 돌아가야 한다,5,마트 양재천 헬스장 각종 서비스센터 등 편의시설 여가시설이 모두 갖춰져 있다,5,조경이 이쁘다  경비아저씨들이 친절하시다  분리수거도 주 1회씩 절 이루어지고 헬스장 카페 독서실 등의 시설도 갖춰져 있어 편리하다,5,길 바로 앞에 있어 다소 시끄럽다  동네 자체는 조용하고 안전하다  층간소음이 있다
5683,도곡삼성래미안,30대,여자,자가 거주,미혼,5,모든 여건이 좋습니다.  동네가 워낙 좋은 동네이다 보니..  편의시설 가까이에 다 있고  대중교통도 편리하고 차 있으면 강남권 접근성도 무척 좋습니다.,5,"지하철 3호선 매봉역 도곡역 정중앙에 위치해서 어느 쪽이든 10분 내로 갈 수 있고 특히 도곡역은 분당선 환승역이어서 강북 쪽으로는 왕십리까지 20분, 남쪽으로는 분당 용인까지 접근성이 무척 좋습니다.  숙명여고 앞 버스정류장에서 402 버스와 경기도 빨간 버스 이용 편리합니다.  자가용 이용 시 남부순환로 통해서 어디든 접근성이 좋은 편입니다.",4,"동네가 워낙 좋아서 편의시설은 10분 거리에 다 위치합니다. 편의점, 마트, 커피집, 음식점 모두 괜찮습니다.  다만 전부 타워팰리스 쪽으로 길을 건너야 하고 단지 내 상가에는 편의점은 없고 그냥 슈퍼만 있다는 게 단점입니다.  그리고.. 동네가 동네인 만큼 물가가 비쌉니다.  양재천이 가까워서 운동, 산책 하기에는 너무 좋습니다.",5,단지가 매봉산과 연결되어 있어서 그쪽으로 산책로도 잘 되어있고 단지 내 곳곳에 벤치와 휴식공간이 잘 마련되어 있고 놀이터와 농구장도 잘 배치되어 있습니다.  경비실도 2개 동 정도에 하나씩 배정되어 있어서 택배관리 현관 출입관리 철저히 잘되는 편입니다.,5,남향인 동에 거주하면 일조량은 무척 좋아서 아침부터 저녁까지 참 밝습니다. 매봉산 쪽에 가까운 동이면 공기도 맑고 좋은 편입니다.  층간소음은 조금 있는 편이긴 한데 이웃 간 조심하면 불편한 정도는 아닙니다.
5683,도곡삼성래미안,20대,여자,자가 거주,기혼,5,"코엑스 강남역 모두 자동차로 15분 거리, 버스로 20분 이내 도착한다. 무엇보다 딸을 가지신 분들은 숙명여고 학군으로 갈 수 있다. 대치동이 걸어서 5분으로 교육에 더 집중할 수 있다.",5,정문 바로 앞 버스노선 7개 존재한다. 지하철 걸어서 5분 이내.,5,스타슈퍼 롯데 프리미엄 슈퍼 롯데슈퍼 편의점 두 개 김영모 베이커리 파리크라상 와바 1 금융권 모두 있음. 무엇보다 양재천의 산책길이 단연 최고.,5,43평 관리비 월평균 30만 원 초반 (2016년 기준) 나온다. 경비아저씨들 모두 살갑고 좋은 분들이 심.,5,개별난방으로 관리비 절약. 매봉산이 있어서 봄에는 자연경치를 보고 여름에는 시원하고 가을에는 쾌적하고 겨울에는 포근하다.
5683,도곡삼성래미안,20대,남자,전세 또는 월세,미혼,5,자가 차량이 있으면 더욱이 살기 좋고 아이들을 키우는 부모님에게도 자녀교육에 좋은 환경,4,남부순환로가 있어 교통이 용이함. 출퇴근 시간 때만 조심할 것,3,근처 편의시설까지 거리가 있음 단지 상가에는 슈퍼뿐..,5,항시 관리함 디테일하게 관리. 쾌적한 아파트 환경이 마련되어져 있음,5,전체적으로 시야가 트여있고 남부순환로가 크게나 있어서 주거환경은 최고임. 번화가까지 거리가 있어 단지가 조용함.
5683,도곡삼성래미안,30대,남자,자가 거주,기혼,5,가까이에 대형병원이 있어서 병을 자주 다니시는 분들에게 좋으며 롯데백화점이 가까이 있어서 젊은 분들이 좋으며 대치동에 학원가가 있어서 아이들의 교육환경에 좋으며.. 맞은편에 타워팰리스가 있어서 삶의 질이 높으며 집값이 비싸다 보니 지질한 주민들이 없어요.,3,3호선과 가까우며.. 강남역이 가까워서 강남역으로 가면 서울 전역으로 가는 광역버스 또는 서울시내버스노선이  있어서 어디든지 가기수 월하고. 3호선과 분당선이 가까워서 좋아요,3,2013년도에 완공된 최신식 디자인으로도 시적 느낌을 풍기면서도 강남 세브란스병원이 가까이 있어서 노인분들이 살기에 아주 적절합니다. 대치 롯데 백화점이 차량으로 5분 거리에 위치하고 있어서 젊은 신혼부부들이 선호합니다.,3,아직 생긴 지 얼마 안돼서 단지 내생활 시설들이 새것이고  보안 또한 타 지역에 래미안과는 틀리게 보안직원들이 젊고 인원수도 많으며 강북이나 타 지역 래미안처럼 할아버지 경비가 없어요. 관리비가 한 달에 50만 원 나오며 저렴한 편입니다.,3,강남의 학군은 말 안 해도 알고 계시죠  요즘은 아이들 교육 때문에 타 지역 엄마들이 자꾸 강남으로 들어와서 삶의 질이 떨어지고 있네요..  의식 수준이 낮은 사람들은 더 이상 안 들어왔으면 하네요
5683,도곡삼성래미안,40대,남자,전세 또는 월세,기혼,4,"도곡역이 가깝고, 숙명여중 보낼 딸이 있다면 최고 가까운 아파트임(담이 인접하여 놓고 간 준비물을 담너머로 건네줄 수 있음).  도곡공원이 붙어있어서 비교적 공기가 좋고, 산책하기 좋음.",4,3호선과 분당선 도곡역이 도보 5분 거리라 편리하다.  분당이나 판교로 출근한다면 구룡터널을 거쳐 빠르게 이동 가능하다.,5,"이마트까지 차로 10분이내 갈수 있고, 단지 맞은편 롯데 수퍼를 도보로 이용 가능하다(배달 서비스도 해줌).  단지 뒤편이 도곡 공원이라서 나무냄새 꽃냄새를 맡을수 있고 산책할수 있어서 좋다.",4,"정문에서 자동차 폐기로 차량통제. 입주민 차량은 번호인식.  각 동 건물 입구는 키로 열거나 집, 경비실 호출하여 열어야 함.  택배는 경비실에서 맡아줌.",4,"남향은 햇빛이 잘 들어오고 서향은 오후에만 들어옴.  바람은 다 잘 통하여, 여름에 창문을 열면 시원함.  도로변에 위치한 동에서는 차 소리가 들리는 것이 단점."
